,Name,Full_Address,Website,Plus_Code,Rating,Reviews,URL
1902,Warung Kampung Indonesian Restaurant,"Jl. Melasti No.20, Legian, Kuta, Kabupaten Badung, Bali 80361",warungkampung.com,"75R9+9J Legian, Badung Regency, Bali",4.5,215,"https://www.google.com/maps/place/Warung+Kampung+Indonesian+Restaurant/@-8.657239,115.0125274,11z/data=!4m9!1m3!2m2!1srestaurants+in+Badung+Regency,+Bali!6e5!3m4!1s0x2dd246c17d3609b3:0x1346e07172952662!8m2!3d-8.7090845!4d115.169018?hl=id"
1903,"LUMBUNGASRI | Puri Lumbung Restaurants, Cottage & Waterpark","Jl. Puri Lumbung, Penarungan, Kec. Mengwi, Kabupaten Badung, Bali 80352",lumbungasri.com,"F655+J5 Penarungan, Badung Regency, Bali",4.1,215,"https://www.google.com/maps/place/LUMBUNGASRI+%7C+Puri+Lumbung+Restaurants,+Cottage+%26+Waterpark/@-8.657239,115.0125274,11z/data=!4m9!1m3!2m2!1srestaurants+in+Bangli+Regency,+Bali!6e5!3m4!1s0x2dd23c6d000fea71:0x306bb6e73041bb2e!8m2!3d-8.5409933!4d115.2079516?hl=id"
1905,Coco Bistro,"Banjar Semawang, Jl. Duyung, Sanur, Kec. Denpasar Sel., Kota Denpasar, Bali",tropicalbalirestaurant.com,"77W7+9Q Sanur, Denpasar City, Bali",4.2,215,"https://www.google.com/maps/place/Coco+Bistro/@-8.6703321,115.2031965,13z/data=!4m9!1m3!2m2!1srestaurants+in+Denpasar+Regency,+Bali!6e5!3m4!1s0x2dd241c1ca51585b:0x8f1fd18ffad12928!8m2!3d-8.7040078!4d115.2643919?hl=id"
1907,Warung Sanur Segar,"Jl. Pasar, Sindu, Sanur, Kec. Denpasar Sel., Kota Denpasar, Bali 80228",,"8776+X3 Sanur, Denpasar City, Bali",4.8,215,"https://www.google.com/maps/place/Warung+Sanur+Segar/@-8.6703321,115.2031965,13z/data=!4m8!1m2!2m1!1srestaurants+in+Denpasar+Regency,+Bali!3m4!1s0x2dd24035859981f5:0x9ab36c3f8d3c358f!8m2!3d-8.6851141!4d115.2602315?hl=id"
1908,Warung Ladhu,"Jalan Camplung Tanduk Seminyak, Kuta, Badung, Bali 80361, Seminyak, Kuta, Seminyak, Kuta, Badung Regency, Bali 80361",,"8558+H6 Seminyak, Badung Regency, Bali",4.1,216,"https://www.google.com/maps/place/Warung+Ladhu/@-8.657239,115.0125274,11z/data=!4m9!1m3!2m2!1srestaurants+in+Badung+Regency,+Bali!6e5!3m4!1s0x2dd24721d6c1dead:0x92283027553e930f!8m2!3d-8.6911189!4d115.1655259?hl=id"
1909,"Warung Belayag ""Dek Ani""","Jl. Diponegoro Gang Batu Aya Amlapura, Karangasem, Kec. Karangasem, Kabupaten Karangasem, Bali 80811",business.site,"HJ37+5V Karangasem, Karangasem Regency, Bali",4.6,217,"https://www.google.com/maps/place/Warung+Belayag+%22Dek+Ani%22/@-8.6568036,114.5904003,9z/data=!4m9!1m3!2m2!1srestaurants+in+Karangasem+Regency,+Bali!6e5!3m4!1s0x2dd2063339df5acb:0x8f3f90bf05a71854!8m2!3d-8.4470251!4d115.6147215?hl=id"
1910,Artrolling Bistro,"Batununggul, Nusapenida, Klungkung Regency, Bali 80771",business.site,"8HG7+3W Batununggul, Klungkung Regency, Bali",3.9,217,"https://www.google.com/maps/place/Artrolling+Bistro/@-8.6567527,114.5897129,9z/data=!4m9!1m3!2m2!1srestaurants+in+Klungkung+Regency,+Bali!6e5!3m4!1s0x2dd2738634359e25:0xd6ec5cf7acdee73!8m2!3d-8.674796!4d115.564816?hl=id"
1911,Copenhagen,"Jl. Canggu Padang Linjong No.71a, Canggu, Kec. Kuta Utara, Kabupaten Badung, Bali 80361",copenhagenbali.com,"943M+HF Canggu, Badung Regency, Bali",4.5,217,"https://www.google.com/maps/place/Copenhagen/@-8.6570861,115.010465,11z/data=!4m9!1m3!2m2!1srestaurants+in+Tabanan+Regency,+Bali!6e5!3m4!1s0x2dd2386340b679bd:0x260f391f0c4d2633!8m2!3d-8.6461006!4d115.1337237?hl=id"
1912,Ubud Water Palace,"Jl. Kajeng No.24, Ubud, Kecamatan Ubud, Kabupaten Gianyar, Bali 80571",,"F7V6+HF Ubud, Gianyar, Bali",4.3,217,"https://www.google.com/maps/place/Ubud+Water+Palace/@-8.5066963,115.0803123,10z/data=!4m9!1m3!2m2!1sobjek+wisata+di+bali!6e1!3m4!1s0x2dd23d411d3f6979:0x2c31a9295b1ad82e!8m2!3d-8.5060094!4d115.2611947?hl=id"
1913,The Coffee Club - Legian,"Blue Ocean Beach, The Coffee Club, Jl. Pantai Arjuna No.18, Legian, Kuta, Bali 80361",facebook.com,"8527+56 Legian, Badung Regency, Bali",4.6,218,"https://www.google.com/maps/place/The+Coffee+Club+-+Legian/@-8.657239,115.0125274,11z/data=!4m9!1m3!2m2!1srestaurants+in+Badung+Regency,+Bali!6e5!3m4!1s0x2dd247ce7f4e3803:0x50c0de6d3615bddd!8m2!3d-8.6995068!4d115.1631106?hl=id"
1914,Twist Ubud,"Jl. Raya Pengosekan Ubud, Ubud, Kecamatan Ubud, Kabupaten Gianyar, Bali 80571",,"F7H7+G4 Ubud, Gianyar, Bali",4.8,218,"https://www.google.com/maps/place/Twist+Ubud/@-8.5211937,115.1927651,12z/data=!4m9!1m3!2m2!1srestaurants+in+Gianyar+Regency,+Bali!6e5!3m4!1s0x2dd23def557fcb33:0xc614e305a73972b9!8m2!3d-8.5211937!4d115.2628029?hl=id"
1915,Furama,"Jl. Raya Tuban No.52B, Tuban, Kuta, Kabupaten Badung, Bali 80361",,"755H+9F Tuban, Badung Regency, Bali",4.3,219,"https://www.google.com/maps/place/Furama/@-8.657239,115.0125274,11z/data=!4m9!1m3!2m2!1srestaurants+in+Badung+Regency,+Bali!6e5!3m4!1s0x2dd247158ee6bf75:0x9920261dc51e506e!8m2!3d-8.7415703!4d115.1786453?hl=id"
1916,Kopi Bangkit,"Jl. Gajah Mada No.A935, Banjar Jawa, Buleleng, Buleleng Regency, Bali 81113",,"V3QR+RQ Banjar Jawa, Buleleng Regency, Bali",4.1,219,"https://www.google.com/maps/place/Kopi+Bangkit/@-8.1104701,114.5316832,9z/data=!4m9!1m3!2m2!1srestaurants+in+Buleleng+Regency,+Bali!6e5!3m4!1s0x2dd19bcba4a77b8d:0x50f47d79ed1e9b36!8m2!3d-8.1104701!4d115.0919859?hl=id"
1917,Seafood Cak Ibad,"Banyuasri, Buleleng, Buleleng Regency, Bali 81119",seafood-cak-ibad.business.site,"V3JG+Q2 Banyuasri, Buleleng Regency, Bali",4.1,219,"https://www.google.com/maps/place/Seafood+Cak+Ibad/@-8.1180072,114.5148126,9z/data=!4m9!1m3!2m2!1srestaurants+in+Buleleng+Regency,+Bali!6e5!3m4!1s0x2dd19a6b9eaa8bd7:0x9afe475f6f8aa786!8m2!3d-8.1180072!4d115.0751153?hl=id"
1919,Beach Club Restaurant,"Puri Santrian, a Beach Resort and Spa, Jl. Cemara No.35, Sanur, Kec. Denpasar Sel., Kota Denpasar, Bali 80228",santrian.com,"77R5+8M Sanur, Denpasar City, Bali",4.4,219,"https://www.google.com/maps/place/Beach+Club+Restaurant/@-8.6703321,115.2031965,13z/data=!4m9!1m3!2m2!1srestaurants+in+Denpasar+Regency,+Bali!6e5!3m4!1s0x2dd2419538461855:0x8aa30c9e46f62321!8m2!3d-8.709211!4d115.25917?hl=id"
1920,Dhipa Warung dan Shop,"Jl. Dream Beach, Jungutbutu, Nusapenida, Jungutbatu, Nusapenida, Kabupaten Klungkung, Bali 80771",,"8C6M+FV Jungutbatu, Klungkung Regency, Bali",4.6,219,"https://www.google.com/maps/place/Dhipa+Warung+dan+Shop/@-8.6567527,114.5897129,9z/data=!4m9!1m3!2m2!1srestaurants+in+Klungkung+Regency,+Bali!6e5!3m4!1s0x2dd26db11f0dd18b:0x46f0bd0b99a1a652!8m2!3d-8.6888145!4d115.434632?hl=id"
1921,BA'BAR KITCHEN & LOUNGE,"Jl. Raya Toya Pakeh - Ped, Ped, Nusapenida, Kabupaten Klungkung, Bali 80771",facebook.com,"8FCQ+8X Ped, Klungkung Regency, Bali",4.4,219,"https://www.google.com/maps/place/BA'BAR+KITCHEN+%26+LOUNGE/@-8.6567527,114.5897129,9z/data=!4m9!1m3!2m2!1srestaurants+in+Klungkung+Regency,+Bali!6e5!3m4!1s0x2dd272615cb0a891:0x8338c49c7d0463e9!8m2!3d-8.6791338!4d115.4899302?hl=id"
1922,Vegan Soul Kitchen,"Unnamed Road, Sakti, Nusapenida, Kabupaten Klungkung, Bali 80771",vegansoulkitchen.com,"7GV3+4Q Sakti, Klungkung Regency, Bali",4.8,219,"https://www.google.com/maps/place/Vegan+Soul+Kitchen/@-8.6567527,114.5897129,9z/data=!4m9!1m3!2m2!1srestaurants+in+Klungkung+Regency,+Bali!6e5!3m4!1s0x2dd27226b99164f7:0xad3286f950865121!8m2!3d-8.7072325!4d115.5043993?hl=id"
1923,Akar Cafe,"Jl. Binaria No.Kalibubuk, Anturan, Kec. Buleleng, Kabupaten Buleleng, Bali 81152",,"R2QG+53 Anturan, Buleleng Regency, Bali",4.4,220,"https://www.google.com/maps/place/Akar+Cafe/@-8.1620021,114.4648516,9z/data=!4m9!1m3!2m2!1srestaurants+in+Buleleng+Regency,+Bali!6e5!3m4!1s0x2dd19b3f1a23aba7:0x1eaf9bad2bc7a7e!8m2!3d-8.1620021!4d115.0251543?hl=id"
1924,Putu's Wild Ginger,"Jl. Jro Gedung No : 60, Kutuh Kelod, Petulu, Kecamatan Ubud, Kabupaten Gianyar, Bali 80571",putuswildginger.com,"F7R9+QP Petulu, Gianyar, Bali",4.7,220,"https://www.google.com/maps/place/Putu's+Wild+Ginger/@-8.5080579,115.199225,12z/data=!4m12!1m3!2m2!1srestaurants+in+Gianyar+Regency,+Bali!6e5!3m7!1s0x2dd23d6852205ce5:0x738b8701e91c7cf1!5m2!4m1!1i2!8m2!3d-8.5080579!4d115.2692628?hl=id"
1925,Mie Ndower,"Jl. Dr. Ir. Soekarno No.768, Banjar Anyar, Kec. Kediri, Kabupaten Tabanan, Bali 82121",business.site,"C4XJ+6M Banjar Anyar, Tabanan Regency, Bali",4.2,221,"https://www.google.com/maps/place/Mie+Ndower/@-8.6570861,115.010465,11z/data=!4m9!1m3!2m2!1srestaurants+in+Tabanan+Regency,+Bali!6e5!3m4!1s0x2dd23a48f74516cb:0x1c90034ed3754fe8!8m2!3d-8.5519771!4d115.1317062?hl=id"
1926,Pacung Indah,"Jl. Raya Pacung, Baturiti, Kec. Baturiti, Kabupaten Tabanan, Bali 82191",pacung-indah.business.site,"M57P+8X Baturiti, Tabanan Regency, Bali",4,222,"https://www.google.com/maps/place/Pacung+Indah/@-8.3367323,115.047372,11z/data=!4m12!1m3!2m2!1srestaurants+in+Gianyar+Regency,+Bali!6e5!3m7!1s0x2dd2275321f4ef47:0x3699461a35bff1a6!5m2!4m1!1i2!8m2!3d-8.3367323!4d115.1874477?hl=id"
1927,Maruti Beach Club,"banjar nyuh,ped,nusa penida, Ped, Nusapenida, Kabupaten Klungkung, Bali 80771",,"8FFQ+RP Ped, Klungkung Regency, Bali",4.3,223,"https://www.google.com/maps/place/Maruti+Beach+Club/@-8.6754772,115.3491849,11z/data=!4m9!1m3!2m2!1srestaurants+in+Klungkung+Regency,+Bali!6e5!3m4!1s0x2dd27263918b2645:0x429e52a7b912acc5!8m2!3d-8.6754772!4d115.4892606?hl=id"
1928,Café Folie Beachwalk,"1, Beachwalk Shopping Center, Level, Jl. Pantai Kuta, Kuta, Kabupaten Badung, Bali 80361",foliebali.com,"75M9+6P Kuta, Badung Regency, Bali",4.5,224,"https://www.google.com/maps/place/Caf%C3%A9+Folie+Beachwalk/@-8.657239,115.0125274,11z/data=!4m9!1m3!2m2!1srestaurants+in+Badung+Regency,+Bali!6e5!3m4!1s0x2dd24758cd7e69ab:0x5ed527be06ed61ad!8m2!3d-8.7168926!4d115.1693386?hl=id"
1929,Babi Guling De Bolot,"Jl. Singaraja-Gilimanuk, Banjar Asem, Kec. Seririt, Kabupaten Buleleng, Bali 81153",business.site,"RW34+HC Banjar Asem, Buleleng Regency, Bali",4,224,"https://www.google.com/maps/place/Babi+Guling+De+Bolot/@-8.1961223,114.3457197,9z/data=!4m9!1m3!2m2!1srestaurants+in+Buleleng+Regency,+Bali!6e5!3m4!1s0x2dd182a8723a1ca3:0x557fb96749793f26!8m2!3d-8.1961223!4d114.9060224?hl=id"
1930,Banh Mi & Beans Canggu Shortcut,"Jl. Raya Semat No.30, Canggu, Kec. Kuta Utara, Kabupaten Badung, Bali 80361",banhmiandbeans.com,"84WR+8R Canggu, Badung Regency, Bali",4.4,225,"https://www.google.com/maps/place/Banh+Mi+%26+Beans+Canggu+Shortcut/@-8.657239,115.0125274,11z/data=!4m9!1m3!2m2!1srestaurants+in+Badung+Regency,+Bali!6e5!3m4!1s0x2dd238800d6cda73:0x3f48b0e20263918a!8m2!3d-8.654132!4d115.1420277?hl=id"
1931,Dae Jang Geum,"Jl. By Pass Ngurah Rai No.500, Pemogan, Kec. Denpasar Sel., Kota Denpasar, Bali 80361",,"75HR+89 Pemogan, Denpasar City, Bali",3.7,225,"https://www.google.com/maps/place/Dae+Jang+Geum/@-8.6703321,115.2031965,13z/data=!4m9!1m3!2m2!1srestaurants+in+Denpasar+Regency,+Bali!6e5!3m4!1s0x2dd2414d6edb2acf:0x1a737bba307194ad!8m2!3d-8.7217127!4d115.1908952?hl=id"
1932,Boga Segara Villa & Resto,"Batununggul, Nusapenida, Klungkung Regency, Bali 80771",m.facebook.com,"8H6H+QV Batununggul, Klungkung Regency, Bali",4.1,225,"https://www.google.com/maps/place/Boga+Segara+Villa+%26+Resto/@-8.6567527,114.5897129,9z/data=!4m12!1m3!2m2!1srestaurants+in+Klungkung+Regency,+Bali!6e5!3m7!1s0x2dd2740d86230d47:0xbc98b4ebb2437da6!5m2!4m1!1i2!8m2!3d-8.688015!4d115.5796661?hl=id"
1933,Jikaa Coffee x Eatery,"Jl. Pantai Berawa No.1a, Tibubeneng, Kec. Kuta Utara, Kabupaten Badung, Bali 80361",business.site,"84XX+9M Tibubeneng, Badung Regency, Bali",4.8,226,"https://www.google.com/maps/place/Jikaa+Coffee+x+Eatery/@-8.657239,115.0125274,11z/data=!4m9!1m3!2m2!1srestaurants+in+Badung+Regency,+Bali!6e5!3m4!1s0x2dd23883b129b24b:0x2d1d25764ae45264!8m2!3d-8.6515097!4d115.1492359?hl=id"
1935,Plant Cartel,"Canggu, North Kuta, Badung Regency, Bali",plantcartel.com,"84WJ+GR Canggu, Badung Regency, Bali",4.4,226,"https://www.google.com/maps/place/Plant+Cartel/@-8.657239,115.0125274,11z/data=!4m9!1m3!2m2!1srestaurants+in+Bangli+Regency,+Bali!6e5!3m4!1s0x2dd23987382dbf57:0x5c645d3e2bbfe9e9!8m2!3d-8.6536821!4d115.1320426?hl=id"
1937,Segara Hotel & Restaurant,"Kedisan, Kintamani, Bangli Regency, Bali 80652",segara-id.book.direct,"P9CH+PG Kedisan, Bangli Regency, Bali",3.6,226,"https://www.google.com/maps/place/Segara+Hotel+%26+Restaurant/@-8.657239,115.0125274,9z/data=!4m12!1m3!2m2!1srestaurants+in+Bangli+Regency,+Bali!6e5!3m7!1s0x2dd1f67f8321e703:0xed597bac454f6967!5m2!4m1!1i2!8m2!3d-8.2781458!4d115.3788626?hl=id"
1940,Taman Suci Hotel,"Jl. Imam Bonjol No.45, Pemecutan Klod, Kec. Denpasar Bar., Kota Denpasar, Bali 80112",tamansuci.com,"86P5+M7 West Denpasar, Denpasar City, Bali",4,226,"https://www.google.com/maps/place/Taman+Suci+Hotel/@-8.6703321,115.2031965,13z/data=!4m12!1m3!2m2!1srestaurants+in+Denpasar+Regency,+Bali!6e5!3m7!1s0x2dd240bc60cbd333:0x605ebbc91560ded0!5m2!4m1!1i2!8m2!3d-8.6633704!4d115.2081676?hl=id"
1941,Gong Restaurant Sanur,"Jl. Tirta Akasa, Sanur Kauh, Kec. Denpasar Sel., Kota Denpasar, Bali 80228",kayumanis.com,"8724+7W Sanur Kauh, Denpasar City, Bali",4.6,226,"https://www.google.com/maps/place/Gong+Restaurant+Sanur/@-8.6703321,115.2031965,13z/data=!4m8!1m2!2m1!1srestaurants+in+Denpasar+Regency,+Bali!3m4!1s0x2dd241b9e5549ef5:0xa4f1042f08f7d32b!8m2!3d-8.6993343!4d115.2572958?hl=id"
1942,Pog's Warung,"Jl. Kecubung No.99X, Semarapura Kelod, Kec. Klungkung, Kabupaten Klungkung, Bali 80716",pogswarung.business.site,"FC52+3M Semarapura Kelod, Klungkung Regency, Bali",4.4,226,"https://www.google.com/maps/place/Pog's+Warung/@-8.5423732,115.261621,11z/data=!4m9!1m3!2m2!1srestaurants+in+Klungkung+Regency,+Bali!6e5!3m4!1s0x2dd21144279bad75:0x6d506f33411c9a14!8m2!3d-8.5423732!4d115.4016967?hl=id"
1943,La Casa Kita,"Jalan Raya Gilimanuk-Seririt, Pemuteran, Gerokgak, Pemuteran, Gerokgak, Kabupaten Buleleng, Bali 81155",la-casa-kita.business.site,"VM33+W5 Pemuteran, Buleleng Regency, Bali",4.3,227,"https://www.google.com/maps/place/La+Casa+Kita/@-8.1451648,114.0926029,9z/data=!4m9!1m3!2m2!1srestaurants+in+Buleleng+Regency,+Bali!6e5!3m4!1s0x2dd16eed09cdae61:0xa8a291e80b629aaa!8m2!3d-8.1451648!4d114.6529056?hl=id"
1944,Rumah Makan Gandi,"Jl. A. Yani No.25H, Kp. Anyar, Kec. Buleleng, Kabupaten Buleleng, Bali 81114",restoran-gandi.business.site,"V3QQ+VJ Kampung Anyar, Buleleng Regency, Bali",4.3,227,"https://www.google.com/maps/place/Rumah+Makan+Gandi/@-8.1103712,114.5287321,9z/data=!4m9!1m3!2m2!1srestaurants+in+Buleleng+Regency,+Bali!6e5!3m4!1s0x2dd19a0bee80e601:0xa0bd73bfc0b162ce!8m2!3d-8.1103712!4d115.0890348?hl=id"
1945,Dumara Cafe,"Jl. Raya Pengosekan, MAS, Kecamatan Ubud, Kabupaten Gianyar, Bali 80571",dumara-cafe.business.site,"F7F7+PF MAS, Gianyar, Bali",4.5,227,"https://www.google.com/maps/place/Dumara+Cafe/@-8.5256885,115.1936459,12z/data=!4m9!1m3!2m2!1srestaurants+in+Gianyar+Regency,+Bali!6e5!3m4!1s0x2dd23d9e28638397:0x86c0431d274e2c4c!8m2!3d-8.5256885!4d115.2636837?hl=id"
1946,Warung BintAng,"Nyuh Tebel, Manggis, Karangasem Regency, Bali 80811",business.site,"FHV6+HV Nyuh Tebel, Karangasem Regency, Bali",4.6,227,"https://www.google.com/maps/place/Warung+BintAng/@-8.6568036,114.5904003,9z/data=!4m8!1m2!2m1!1srestaurants+in+Karangasem+Regency,+Bali!3m4!1s0x2dd20ed5df63aacf:0x2e1397b8016fc005!8m2!3d-8.5060473!4d115.5621287?hl=id"
1947,Tari Barong Dan Keris Batubulan,"Jl. Raya Batubulan No.295X, Batubulan, Kec. Sukawati, Kabupaten Gianyar, Bali 80582",diparda.gianyarkab.go.id,"97R3+28 Batubulan, Gianyar, Bali",4.5,227,"https://www.google.com/maps/place/Tari+Barong+Dan+Keris+Batubulan/@-8.5066963,115.0803123,10z/data=!4m9!1m3!2m2!1sobjek+wisata+di+bali!6e1!3m4!1s0x2dd23fb39b3e201d:0xe5d1932bed9f477!8m2!3d-8.6098775!4d115.2533225?hl=id"
1948,Pererenan Beach,"Jl. Pantai Pererenan No.171, Pererenan, Kec. Mengwi, Kabupaten Badung, Bali",,"84XC+7J Pererenan, Badung Regency, Bali",4.4,228,"https://www.google.com/maps/place/Pererenan+Beach/@-8.657239,115.0125274,11z/data=!4m9!1m3!2m2!1srestaurants+in+Bangli+Regency,+Bali!6e5!3m4!1s0x2dd238769d121665:0xf88bb320555bb3ea!8m2!3d-8.651868!4d115.1215347?hl=id"
1949,REV BISTRO,"Jl. Yudistira No.11, Seminyak, Kuta, Kabupaten Badung, Bali 80361",,"855F+VV Seminyak, Badung Regency, Bali",4.8,229,"https://www.google.com/maps/place/REV+BISTRO/@-8.657239,115.0125274,11z/data=!4m9!1m3!2m2!1srestaurants+in+Badung+Regency,+Bali!6e5!3m4!1s0x2dd24378fe0780c5:0x674301d7db623f7f!8m2!3d-8.6903109!4d115.1746982?hl=id"
1951,Garlic Lane Restaurant,"Jl. Sahadewa No. 3 Legian Kelod, Legian, Kuta, Kabupaten Badung, Bali 80361",,"75R9+QP Legian, Badung Regency, Bali",4.3,229,"https://www.google.com/maps/place/Garlic+Lane+Restaurant/@-8.7080406,115.1342429,13z/data=!4m9!1m3!2m2!1srestaurants+in+Gianyar+Regency,+Bali!6e5!3m4!1s0x2dd246c3c3bfa8c7:0xe5fce167ea99b70a!8m2!3d-8.7080406!4d115.1692618?hl=id"
1953,Why Not,"Jl. Bisma No.8, Ubud, Kecamatan Ubud, Kabupaten Gianyar, Bali 80571",,"F7V5+8H Ubud, Gianyar, Bali",4.6,229,"https://www.google.com/maps/place/Why+Not/@-8.5067378,114.6986062,9z/data=!4m9!1m3!2m2!1srestaurants+in+Gianyar+Regency,+Bali!6e5!3m4!1s0x2dd23d1540cead6d:0xf56bd10622251ad!8m2!3d-8.5067378!4d115.2589089?hl=id"
1954,The Street Room Steamboat Restaurant,"Jl. By Pass Ngurah Rai No.850, Pemogan, Kec. Denpasar Sel., Kota Denpasar, Bali 80221",,"75HV+PV Pemogan, Denpasar City, Bali",4.5,230,"https://www.google.com/maps/place/The+Street+Room+Steamboat+Restaurant/@-8.6703321,115.2031965,13z/data=!4m9!1m3!2m2!1srestaurants+in+Denpasar+Regency,+Bali!6e5!3m4!1s0x2dd2414dc2b8eb45:0xe93f9d1bdd5000c7!8m2!3d-8.7206506!4d115.1947108?hl=id"
1955,Omang Omang Bar And Diner.,"Jl. Silayukti No.12, Padangbai, Kec. Manggis, Kabupaten Karangasem, Bali 80871",business.site,"FGC5+2J Padangbai, Karangasem Regency, Bali",4.7,230,"https://www.google.com/maps/place/Omang+Omang+Bar+And+Diner./@-8.6568036,114.5904003,9z/data=!4m8!1m2!2m1!1srestaurants+in+Karangasem+Regency,+Bali!3m4!1s0x2dd20e67d8a3fa2b:0xa8b145011caa11bc!8m2!3d-8.5299566!4d115.5090156?hl=id"
1957,Chir Chir Fusion Chicken Factory - Samasta Jimbaran,"Jl. Wanagiri, Jimbaran, Kec. Kuta Sel., Kabupaten Badung, Bali 80364",instagram.com,"6577+QG Jimbaran, Badung Regency, Bali",4.5,231,"https://www.google.com/maps/place/Chir+Chir+Fusion+Chicken+Factory+-+Samasta+Jimbaran/@-8.657239,115.0125274,11z/data=!4m9!1m3!2m2!1srestaurants+in+Badung+Regency,+Bali!6e5!3m4!1s0x2dd244ed5ee5f127:0xc8415bc86d8b05b2!8m2!3d-8.7855954!4d115.1637589?hl=id"
1958,Sanghyang Bay Bar & Restaurant,"Lembongan, Nusapenida, Klungkung Regency, Bali 80771",m.facebook.com,"8C8M+W8 Lembongan, Klungkung Regency, Bali",3.7,231,"https://www.google.com/maps/place/Sanghyang+Bay+Bar+%26+Restaurant/@-8.6567527,114.5897129,9z/data=!4m9!1m3!2m2!1srestaurants+in+Klungkung+Regency,+Bali!6e5!3m4!1s0x2dd26dae8aaee5cf:0xceca7ea6fe05916d!8m2!3d-8.6827171!4d115.4333144?hl=id"
1959,ENVY,"Jl. Wana Segara No.33, Kuta, Kabupaten Badung, Bali 80361",holidayinnresorts.com,"7577+C6 Kuta, Badung Regency, Bali",4.5,232,"https://www.google.com/maps/place/ENVY/@-8.657239,115.0125274,11z/data=!4m9!1m3!2m2!1srestaurants+in+Gianyar+Regency,+Bali!6e5!3m4!1s0x2dd2442045e6fac7:0xf393dd4cca3e5c0b!8m2!3d-8.73644!4d115.1630755?hl=id"
1961,Danau YEH MALET,"Unnamed Road, Antiga Kelod, Kec. Manggis, Kabupaten Karangasem, Bali 80871",,"FF5M+CQ Antiga Kelod, Karangasem Regency, Bali",4,232,"https://www.google.com/maps/place/Danau+YEH+MALET/@-8.5066963,115.0803123,10z/data=!4m9!1m3!2m2!1sobjek+wisata+di+bali!6e1!3m4!1s0x2dd20e0542d0555f:0x45e8bf046026392!8m2!3d-8.5414575!4d115.4844259?hl=id"
1962,Warung Shinta,"Jl. Kartika Plaza Gg. Puspa Ayu, Kuta, Kabupaten Badung, Bali 80361",shinta-warung.business.site,"7599+XJ Kuta, Badung Regency, Bali",4.7,233,"https://www.google.com/maps/place/Warung+Shinta/@-8.657239,115.0125274,11z/data=!4m8!1m2!2m1!1srestaurants+in+Badung+Regency,+Bali!3m4!1s0x2dd246a16e520ae1:0xa18ab1b3138124e2!8m2!3d-8.7300175!4d115.1691144?hl=id"
1963,Oma Jamu,"Front of Pura Puseh, Jl. Pantai Batu Bolong No.46a, Canggu, Kec. Kuta Utara, Kabupaten Badung, Bali 80361",omajamuvegan.com,"945V+R9 Canggu, Badung Regency, Bali",4.6,233,"https://www.google.com/maps/place/Oma+Jamu/@-8.657239,115.0125274,11z/data=!4m9!1m3!2m2!1srestaurants+in+Bangli+Regency,+Bali!6e5!3m4!1s0x2dd238899200a5cb:0x9cdcf91a7ea787fb!8m2!3d-8.6404948!4d115.1434994?hl=id"
1966,PADANG BREEZE,"No.3, Jl. Labuansait, padang padang, uluwatu, Badung Regency, Bali 80361",breezecafebar.business.site,"53MX+GW Pecatu, Badung Regency, Bali",4.2,234,"https://www.google.com/maps/place/PADANG+BREEZE/@-8.657239,115.0125274,11z/data=!4m12!1m3!2m2!1srestaurants+in+Badung+Regency,+Bali!6e5!3m7!1s0x2dd245540a280c0b:0xe7357939398ad6c6!5m2!4m1!1i2!8m2!3d-8.8161507!4d115.0998347?hl=id"
1967,Poke Poke,"Pantai Batu Bolong St No.58, Canggu, North Kuta, Badung Regency, Bali 80351",,"84XM+7F Canggu, Badung Regency, Bali",4.3,234,"https://www.google.com/maps/place/Poke+Poke/@-8.657239,115.0125274,11z/data=!4m9!1m3!2m2!1srestaurants+in+Buleleng+Regency,+Bali!6e5!3m4!1s0x2dd23879133a5bad:0x7f0d82b5cb5100f2!8m2!3d-8.6518127!4d115.1337019?hl=id"
1969,Warung Biker,"jl raya jasri pertigaan patung salak lantai 2 jesson motor building.jasri, Subagan, Kec. Karangasem, Kabupaten Karangasem, Bali 80811",,"GJG8+CV Subagan, Karangasem Regency, Bali",4.4,234,"https://www.google.com/maps/place/Warung+Biker/@-8.6568036,114.5904003,9z/data=!4m9!1m3!2m2!1srestaurants+in+Karangasem+Regency,+Bali!6e5!3m4!1s0x2dd208625ea77441:0xc1e2163a4aa5b612!8m2!3d-8.4738859!4d115.6171428?hl=id"
1970,Munduk Waterfall Parking,"Jl. Kayu Putih - Munduk, Munduk, Kec. Banjar, Kabupaten Buleleng, Bali 81152",,"P3Q9+Q8 Munduk, Buleleng Regency, Bali",4.5,235,"https://www.google.com/maps/place/Munduk+Waterfall+Parking/@-8.2605241,114.9282373,11z/data=!4m9!1m3!2m2!1srestaurants+in+Buleleng+Regency,+Bali!6e5!3m4!1s0x2dd1867493d43fd9:0xdaf77946c5ba9ffd!8m2!3d-8.2605241!4d115.068313?hl=id"
1971,Pirate Dinner Cruise Bali,"Jl. Dermaga II Jl. Raya Pelabuhan Benoa, Pedungan, Kec. Denpasar Sel., Kota Denpasar, Bali 80221",piratedinnercruise.com,"7647+X2 Pedungan, Denpasar City, Bali",4.3,235,"https://www.google.com/maps/place/Pirate+Dinner+Cruise+Bali/@-8.742504,115.1775311,13z/data=!4m9!1m3!2m2!1srestaurants+in+Denpasar+Regency,+Bali!6e5!3m4!1s0x2dd243e81b280bd1:0x7397c4d45ac1d300!8m2!3d-8.742504!4d115.21255?hl=id"
1972,The Damai,"Jl. Damai, Kayu Putih, Kayu Putih, Lovina, Kabupaten Buleleng, Bali 00362",thedamai.com,"R29V+CH Kayu Putih, Buleleng Regency, Bali",4.6,236,"https://www.google.com/maps/place/The+Damai/@-8.181459,114.9038163,11z/data=!4m12!1m3!2m2!1srestaurants+in+Buleleng+Regency,+Bali!6e5!3m7!1s0x2dd184d5ca466c53:0xb00f7e1e7cef2c41!5m2!4m1!1i2!8m2!3d-8.181459!4d115.043892?hl=id"
1973,Wr. Ayam Betutu Khas Gilimanuk,"Jl. Buluh Indah No.51X, Pemecutan Kaja, Kec. Denpasar Utara, Kota Denpasar, Bali 80118",,"953W+C5 Pemecutan Kaja, Denpasar City, Bali",4.3,237,"https://www.google.com/maps/place/Wr.+Ayam+Betutu+Khas+Gilimanuk/@-8.657239,115.0125274,11z/data=!4m9!1m3!2m2!1srestaurants+in+Bangli+Regency,+Bali!6e5!3m4!1s0x2dd23f56acf62ac1:0x9f811e3f911719e9!8m2!3d-8.6464751!4d115.1954645?hl=id"
1974,Avocado Warung Ubud,"Jl. Tirta Tawar No.45, Banjar Kutuh Kaja, Kecamatan Ubud, Kabupaten Gianyar, Bali 80571",avocadowarungubud.com,"G739+8R Ubud, Gianyar, Bali",4.8,237,"https://www.google.com/maps/place/Avocado+Warung+Ubud/@-8.496718,114.7092793,9z/data=!4m9!1m3!2m2!1srestaurants+in+Bangli+Regency,+Bali!6e5!3m4!1s0x2dd23dd6ede48003:0x5782176b4f497dfa!8m2!3d-8.496718!4d115.269582?hl=id"
1977,Pura Dalem Balingkang,"Pinggan, Kintamani, Bangli Regency, Bali 80652",purabalingkang.blogspot.com,"Q9WC+62 Pinggan, Bangli Regency, Bali",4.8,237,"https://www.google.com/maps/place/Pura+Dalem+Balingkang/@-8.5066963,115.0803123,10z/data=!4m9!1m3!2m2!1sobjek+wisata+di+bali!6e1!3m4!1s0x2dd1f3d01686b861:0xc631bd662f7975c2!8m2!3d-8.2044948!4d115.3700458?hl=id"
1978,Kuali Restaurant,"Jl. Arjuna Jl. Raya Legian No.99, Legian, Kuta, Kabupaten Badung, Bali 80361",,"8526+VV Kuta, Badung Regency, Bali",4.4,239,"https://www.google.com/maps/place/Kuali+Restaurant/@-8.657239,115.0125274,11z/data=!4m9!1m3!2m2!1srestaurants+in+Badung+Regency,+Bali!6e5!3m4!1s0x2dd246e11e6d519d:0xc0c43744b28e8f62!8m2!3d-8.697765!4d115.162142?hl=id"
1979,Warung Apple,"Jl. Mawar, Anturan, Kalibukbuk, Kabupaten Buleleng, Bali 81151",,"R2RG+5M Anturan, Buleleng Regency, Bali",4.3,239,"https://www.google.com/maps/place/Warung+Apple/@-8.1595794,114.4664358,9z/data=!4m9!1m3!2m2!1srestaurants+in+Buleleng+Regency,+Bali!6e5!3m4!1s0x2dd19b3e3406577b:0xdb82f3b958bbd53c!8m2!3d-8.1595794!4d115.0267385?hl=id"
1981,Warung Nyoman,"Jl. Pratama No.66X, Benoa, Badung, Kabupaten Badung, Bali 80361",facebook.com,"66FF+V6 Benoa, Badung Regency, Bali",4,240,"https://www.google.com/maps/place/Warung+Nyoman/@-8.657239,115.0125274,11z/data=!4m9!1m3!2m2!1srestaurants+in+Badung+Regency,+Bali!6e5!3m4!1s0x2dd24308b815e62b:0x5f8cddb28f1dcc70!8m2!3d-8.7752895!4d115.2230899?hl=id"
1982,One Eyed Jack,"Jl. Pantai Berawa No.c89, Tibubeneng, Kec. Kuta Utara, Kabupaten Badung, Bali",oneeyedjackbali.com,"84MQ+WX Tibubeneng, Badung Regency, Bali",4.2,240,"https://www.google.com/maps/place/One+Eyed+Jack/@-8.6700536,115.0981279,11z/data=!4m9!1m3!2m2!1srestaurants+in+Denpasar+Regency,+Bali!6e5!3m4!1s0x2dd24782ca6c740b:0x38f545c227802fae!8m2!3d-8.6652062!4d115.1399335?hl=id"
1986,Bukit Belong,"Jl. Raya Gunaksa, Gunaksa, Kec. Dawan, Kabupaten Klungkung, Bali 80761",,"FC4H+23 Gunaksa, Klungkung Regency, Bali",4.3,240,"https://www.google.com/maps/place/Bukit+Belong/@-8.5066963,115.0803123,10z/data=!4m9!1m3!2m2!1sobjek+wisata+di+bali!6e1!3m4!1s0x2dd211763d252145:0x2c9994967ab65efa!8m2!3d-8.5449492!4d115.4276538?hl=id"
1987,"Natrabu Minang Restaurant (Padang Food) Nusa Dua, Bali","Pertokoan Niaga Nusa Dua, Jl. By Pass Ngurah Rai, Benoa, South Kuta, Badung Regency, Bali 80361",instagram.com,"662F+Q4 Benoa, Badung Regency, Bali",4.1,241,"https://www.google.com/maps/place/Natrabu+Minang+Restaurant+(Padang+Food)+Nusa+Dua,+Bali/@-8.657239,115.0125274,11z/data=!4m9!1m3!2m2!1srestaurants+in+Badung+Regency,+Bali!6e5!3m4!1s0x2dd2433b1146a863:0xaff95cc5cac5132f!8m2!3d-8.7980146!4d115.2227896?hl=id"
