,Name,Full_Address,Website,Plus_Code,Rating,Reviews,URL
1793,W Sport Bar & Restaurant,"Jln Legian No.99, Kuta, Badung Regency, Bali 80361",wsportsbar.com,"75MF+PJ Kuta, Badung Regency, Bali",2.8,191,"https://www.google.com/maps/place/W+Sport+Bar+%26+Restaurant/@-8.657239,115.0125274,11z/data=!4m9!1m3!2m2!1srestaurants+in+Badung+Regency,+Bali!6e5!3m4!1s0x2dd246c6dd575519:0x91ef1071973ec937!8m2!3d-8.7156445!4d115.174062?hl=id"
1794,Miro's Garden Restaurant,"Jl. Bisma, Ubud, Kecamatan Ubud, Kabupaten Gianyar, Bali 80571",,"F7V5+QM Ubud, Gianyar, Bali",4.4,191,"https://www.google.com/maps/place/Miro's+Garden+Restaurant/@-8.5056022,114.6988431,9z/data=!4m9!1m3!2m2!1srestaurants+in+Bangli+Regency,+Bali!6e5!3m4!1s0x2dd246c5bb70e409:0xfcbe7bc8d6bf015d!8m2!3d-8.5056022!4d115.2591458?hl=id"
1795,The Grill at LUXE,"Jl. Kajeng AT Juwuk Manis Ubud Kaja, Ubud, Kecamatan Ubud, Kabupaten Gianyar, Bali 80571",luxeubud.com,"G736+99 Ubud, Gianyar, Bali",4.7,191,"https://www.google.com/maps/place/The+Grill+at+LUXE/@-8.4965132,114.7006882,9z/data=!4m9!1m3!2m2!1srestaurants+in+Bangli+Regency,+Bali!6e5!3m4!1s0x2dd23d4767322a73:0x5c19d6d45cc2e9ae!8m2!3d-8.4965132!4d115.2609909?hl=id"
1799,Warung Taman Gemitir,"Jalan Raya Denpasar Singaraja, Banjar Pacung No.km.40, Baturiti, Kec. Baturiti, Kabupaten Tabanan, Bali 82191",baligemitir.com,"M57P+CR Baturiti, Tabanan Regency, Bali",4.1,191,"https://www.google.com/maps/place/Warung+Taman+Gemitir/@-8.336427,115.0470403,11z/data=!4m9!1m3!2m2!1srestaurants+in+Tabanan+Regency,+Bali!6e5!3m4!1s0x2dd22752c6f16bbb:0x28fd0c0647d8e4fd!8m2!3d-8.336427!4d115.187116?hl=id"
1800,Tandjung Sari Restaurant,"Jl. Danau Tamblingan No.41, Sanur, Kec. Denpasar Sel., Kota Denpasar, Bali 80228",tandjungsarihotel.com,"8767+9J Sanur, Denpasar City, Bali",4.6,192,"https://www.google.com/maps/place/Tandjung+Sari+Restaurant/@-8.6703321,115.2031965,13z/data=!4m9!1m3!2m2!1srestaurants+in+Denpasar+Regency,+Bali!6e5!3m4!1s0x2dd241cb6600a57f:0xe4bb0dea6baf1935!8m2!3d-8.6890963!4d115.2641246?hl=id"
1801,Tebing Karang Boma,"Pecatu, South Kuta, Badung Regency, Bali",badungtourism.com,"537Q+Q2 Pecatu, Badung Regency, Bali",4.7,192,"https://www.google.com/maps/place/Tebing+Karang+Boma/@-8.5066963,115.0803123,10z/data=!4m9!1m3!2m2!1sobjek+wisata+di+bali!6e1!3m4!1s0x2dd2500eb0e671a1:0x5b60f43e02ae5d5f!8m2!3d-8.8355116!4d115.08752?hl=id"
1802,Frestro & Bar,"Jalan Petitenget No.108 - 110, Kerobokan, Kuta Utara, Kerobokan Kelod, Kec. Kuta Utara, Kabupaten Badung, Bali 80361",frestro.co.id,"85F4+96 Kerobokan Kelod, Badung Regency, Bali",4.5,193,"https://www.google.com/maps/place/Frestro+%26+Bar/@-8.657239,115.0125274,11z/data=!4m9!1m3!2m2!1srestaurants+in+Badung+Regency,+Bali!6e5!3m4!1s0x2dd24712f6b263d3:0x462df6146f98689b!8m2!3d-8.676618!4d115.155546?hl=id"
1803,Fullmoon Bar & Restaurant,"Jl. Ped - Buyuk, Ped, Nusapenida, Kabupaten Klungkung, Bali 80771",,"8GC8+P9 Ped, Klungkung Regency, Bali",4.4,193,"https://www.google.com/maps/place/Fullmoon+Bar+%26+Restaurant/@-8.6567527,114.5897129,9z/data=!4m9!1m3!2m2!1srestaurants+in+Klungkung+Regency,+Bali!6e5!3m4!1s0x2dd2725215e0e24d:0x274212bdeb91c747!8m2!3d-8.6781486!4d115.5159395?hl=id"
1804,Les Waterfalls,"Buleleng, Les, Tejakula, Kabupaten Buleleng, Bali 81173",,"R9W7+92 Les, Buleleng Regency, Bali",4.7,194,"https://www.google.com/maps/place/Les+Waterfalls/@-8.1540173,115.2225032,11z/data=!4m9!1m3!2m2!1srestaurants+in+Buleleng+Regency,+Bali!6e5!3m4!1s0x2dd1edf0177e49f5:0x64c4c57409eaf678!8m2!3d-8.1540173!4d115.3625789?hl=id"
1805,Blue Corner Bar & Restaurant - Lembongan,"Nusa Lembongan, Gg. Blue Corner, Jl. Jungutbatu, Jungutbatu, Nusapenida, Kabupaten Klungkung, Bali 80113",facebook.com,"8CMX+69 Jungutbatu, Klungkung Regency, Bali",4.1,194,"https://www.google.com/maps/place/Blue+Corner+Bar+%26+Restaurant+-+Lembongan/@-8.6567527,114.5897129,9z/data=!4m9!1m3!2m2!1srestaurants+in+Klungkung+Regency,+Bali!6e5!3m4!1s0x2dd26d0cd87612f5:0x2f7592c6fdfb9273!8m2!3d-8.666888!4d115.448489?hl=id"
1806,Penida Minang Resto & Bar,"Ped, Nusapenida, Klungkung Regency, Bali 80771",business.site,"8GF7+FH Ped, Klungkung Regency, Bali",4.3,194,"https://www.google.com/maps/place/Penida+Minang+Resto+%26+Bar/@-8.6567527,114.5897129,9z/data=!4m9!1m3!2m2!1srestaurants+in+Klungkung+Regency,+Bali!6e5!3m4!1s0x2dd272516fd0a53d:0xf00082f880a6c1e1!8m2!3d-8.676306!4d115.513932?hl=id"
1808,Warung d'Carik,"Jl. Sri Wedari, Ubud, Kec. Gianyar, Kabupaten Gianyar, Bali 80571",warung-dcarik.business.site,"G7C9+68 Ubud, Gianyar, Bali",4.6,195,"https://www.google.com/maps/place/Warung+d'Carik/@-8.4794032,114.7080227,9z/data=!4m9!1m3!2m2!1srestaurants+in+Bangli+Regency,+Bali!6e5!3m4!1s0x2dd222b17c9c5229:0x5b9ddec65b1ae85f!8m2!3d-8.4794032!4d115.2683254?hl=id"
1810,Warung Falafel,"Jl. Karna No.15, Ubud, Kecamatan Ubud, Kabupaten Gianyar, Bali 80571",warungfalafelbali.com,"F7R6+7X Ubud, Gianyar, Bali",4.5,196,"https://www.google.com/maps/place/Warung+Falafel/@-8.5093734,115.1223555,11z/data=!4m9!1m3!2m2!1srestaurants+in+Buleleng+Regency,+Bali!6e5!3m4!1s0x2dd23d6b063b57e7:0x9e72e335b5848245!8m2!3d-8.5093734!4d115.2624312?hl=id"
1811,Fussy Bird Bali,"Jl. Tirta Tawar No.32, Petulu, Kec. Gianyar, Kabupaten Gianyar, Bali 80571",fussybirdbali.weebly.com,"F7V9+79 Petulu, Gianyar, Bali",4.4,196,"https://www.google.com/maps/place/Fussy+Bird+Bali/@-8.506833,115.1984042,12z/data=!4m9!1m3!2m2!1srestaurants+in+Gianyar+Regency,+Bali!6e5!3m4!1s0x2dd23d69b1db5565:0xb49132966e9d239b!8m2!3d-8.506833!4d115.268442?hl=id"
1812,Made Becik Waroeng,"Jl. Tirta Tawar, Petulu, Kecamatan Ubud, Kabupaten Gianyar, Bali 80571",business.site,"G75C+94 Petulu, Gianyar, Bali",4.5,197,"https://www.google.com/maps/place/Made+Becik+Waroeng/@-8.4915476,114.7099944,9z/data=!4m9!1m3!2m2!1srestaurants+in+Bangli+Regency,+Bali!6e5!3m4!1s0x2dd23d4dbc8f8753:0x31b675ab595a5fd3!8m2!3d-8.4915476!4d115.2702971?hl=id"
1813,CasCades Restaurant,"Jl. Lanyahan, Br. Nagi, Kecamatan Ubud, Kabupaten Gianyar, Bali 80571",cascadesbali.com,"G74H+F6 Ubud, Gianyar, Bali",4.7,197,"https://www.google.com/maps/place/CasCades+Restaurant/@-8.4938625,114.717764,9z/data=!4m9!1m3!2m2!1srestaurants+in+Bangli+Regency,+Bali!6e5!3m4!1s0x2dd23d5755ef25c9:0x4a1c70f30315e974!8m2!3d-8.4938625!4d115.2780667?hl=id"
1814,Warung Satria,"Jl. Kedondong No.11A, Dangin Puri Kauh, Kec. Denpasar Utara, Kota Denpasar, Bali 80231",warungsatria.business.site,"86X9+CG Dangin Puri Kauh, Denpasar City, Bali",4.3,197,"https://www.google.com/maps/place/Warung+Satria/@-8.6703321,115.2031965,13z/data=!4m9!1m3!2m2!1srestaurants+in+Denpasar+Regency,+Bali!6e5!3m4!1s0x2dd2409ddc375065:0x4d10519be743b18a!8m2!3d-8.6513862!4d115.2187881?hl=id"
1818,The lokal 80361,"Jl. Sahadewa No.13d, Legian, Kuta, Kabupaten Badung, Bali 80361",,"75V9+7J Legian, Badung Regency, Bali",4.5,198,"https://www.google.com/maps/place/The+lokal+80361/@-8.657239,115.0125274,11z/data=!4m9!1m3!2m2!1srestaurants+in+Badung+Regency,+Bali!6e5!3m4!1s0x2dd246c3a5b51429:0x45e8e007a82dbd28!8m2!3d-8.706813!4d115.169085?hl=id"
1819,"Ikan Restaurant & Bar at The Westin Resort Nusa Dua, Bali","The Westin Resort Nusa Dua Kawasan Pariwisata Nusa Dua, ITDC Lot No.N-3, Benoa, Kec. Kuta Sel., Kabupaten Badung, Bali 80363",westinnusaduabali.com,"663J+WV Benoa, Badung Regency, Bali",4.4,198,"https://www.google.com/maps/place/Ikan+Restaurant+%26+Bar+at+The+Westin+Resort+Nusa+Dua,+Bali/@-8.7952156,115.0920569,11z/data=!4m9!1m3!2m2!1srestaurants+in+Badung+Regency,+Bali!6e5!3m4!1s0x2dd2432136f20c05:0x2637b4d1fe52c7f1!8m2!3d-8.7952156!4d115.2321326?hl=id"
1820,The Samani Restaurant,"Jl. Trenggana No.37, Penatih, Kec. Denpasar Tim., Kota Denpasar, Bali 80238",,"96VP+M4 Penatih, Denpasar City, Bali",4.4,199,"https://www.google.com/maps/place/The+Samani+Restaurant/@-8.6058537,115.2003063,13z/data=!4m9!1m3!2m2!1srestaurants+in+Denpasar+Regency,+Bali!6e5!3m4!1s0x2dd23eff9c6a792f:0xe9dedf08b386c006!8m2!3d-8.6058537!4d115.2353252?hl=id"
1821,Souvlaki Greek Restaurant,"Kuta, Badung Regency, Bali 80361",,"75JF+CF Kuta, Badung Regency, Bali",4.4,199,"https://www.google.com/maps/place/Souvlaki+Greek+Restaurant/@-8.718968,115.1386841,13z/data=!4m9!1m3!2m2!1srestaurants+in+Gianyar+Regency,+Bali!6e5!3m4!1s0x2dd246bbd3fe093b:0x8ff34698c68b0a5c!8m2!3d-8.718968!4d115.173703?hl=id"
1823,The Dungki Bendega Resto,"Jl. Secret Beach, Nusa Ceningan, Lembongan, Nusapenida, Kabupaten Klungkung, Bali 80771",,"7CRR+VW Lembongan, Klungkung Regency, Bali",4.7,199,"https://www.google.com/maps/place/The+Dungki+Bendega+Resto/@-8.6361621,115.4416862,12z/data=!4m8!1m2!2m1!1srestaurants+in+Klungkung+Regency,+Bali!3m4!1s0x2dd26ddba298b7bb:0x1e5f34f0c06f4bfd!8m2!3d-8.7078405!4d115.442278?hl=id"
1824,Boneka Restaurant,"Kawasan Pariwisata Nusa Dua Lot S6 BenoaHotel St. Regris Lt.Lobby, Benoa, Kec. Kuta Sel., Kabupaten Badung, Bali 80363",marriott.com,"56PG+QG Benoa, Badung Regency, Bali",4.8,200,"https://www.google.com/maps/place/Boneka+Restaurant/@-8.8130837,115.0862945,11z/data=!4m9!1m3!2m2!1srestaurants+in+Badung+Regency,+Bali!6e5!3m4!1s0x2dd25cd2f0235d21:0xbe09926e54ea1454!8m2!3d-8.8130837!4d115.2263702?hl=id"
1825,Breeze,"Jl. Laksamana Basangkasa, Seminyak, Kuta, Kabupaten Badung, Bali 80361",thesamayabali.com,"8583+P6 Seminyak, Badung Regency, Bali",4.4,200,"https://www.google.com/maps/place/Breeze/@-8.6700536,115.0981279,11z/data=!4m9!1m3!2m2!1srestaurants+in+Denpasar+Regency,+Bali!6e5!3m4!1s0x2dd2470fc1390a39:0x7965212426ac8671!8m2!3d-8.6831596!4d115.1530552?hl=id"
1827,Virgin Beach Restaurant,"Jl. Ped - Buyuk, Ped, Nusapenida, Kabupaten Klungkung, Bali 80771",,"8GG2+X2 Ped, Klungkung Regency, Bali",4.1,200,"https://www.google.com/maps/place/Virgin+Beach+Restaurant/@-8.6567527,114.5897129,9z/data=!4m9!1m3!2m2!1srestaurants+in+Klungkung+Regency,+Bali!6e5!3m4!1s0x2dd27313accee2c1:0xf3dda07b07bc91e3!8m2!3d-8.6726056!4d115.5001095?hl=id"
1829,Element Restaurant and Bar,"Jl. Penestanan No.8, Sayan, Kecamatan Ubud, Kabupaten Gianyar, Bali 80571",elementrestaurantbali.com,"F7V3+F6 Sayan, Gianyar, Bali",4.5,201,"https://www.google.com/maps/place/Element+Restaurant+and+Bar/@-8.5062621,115.112955,11z/data=!4m9!1m3!2m2!1srestaurants+in+Buleleng+Regency,+Bali!6e5!3m4!1s0x2dd23d161bfeba73:0x5152d62796b600f9!8m2!3d-8.5062621!4d115.2530307?hl=id"
1832,Nalu Bowls,"Jl. Pantai Batu Mejan No.88, Canggu, Kec. Kuta Utara, Bandung, Bali 80316",,"84WG+HM Canggu, Badung Regency, Bali",4.2,202,"https://www.google.com/maps/place/Nalu+Bowls/@-8.657239,115.0125274,11z/data=!4m9!1m3!2m2!1srestaurants+in+Bangli+Regency,+Bali!6e5!3m4!1s0x2dd238770036baf5:0xe2ef6a950c517edf!8m2!3d-8.6535721!4d115.1267326?hl=id"
1833,Warung Santai,"Jl. Danau Tandakan No.9, Sanur, Kec. Denpasar Sel., Kota Denpasar, Bali 80227",facebook.com,"8786+84 Sanur, Denpasar City, Bali",4.6,202,"https://www.google.com/maps/place/Warung+Santai/@-8.6703321,115.2031965,13z/data=!4m9!1m3!2m2!1srestaurants+in+Denpasar+Regency,+Bali!6e5!3m4!1s0x2dd2403586487bcd:0xd8f4181869a3b750!8m2!3d-8.684249!4d115.2602546?hl=id"
1834,Warung Ting Ting,"Jl. By Pass Dharma Giri No.100X, Bitera, Kec. Gianyar, Kabupaten Gianyar, Bali 80515",business.site,"F837+PR Bitera, Gianyar, Bali",4,202,"https://www.google.com/maps/place/Warung+Ting+Ting/@-8.657188,115.0118399,11z/data=!4m9!1m3!2m2!1srestaurants+in+Karangasem+Regency,+Bali!6e5!3m4!1s0x2dd216696bb6d2c9:0xe1b8bff3452e6299!8m2!3d-8.5456815!4d115.3146176?hl=id"
1837,Bollywood masalaz - Best Indian Restaurant In Kuta Bali,"Jl. Kartika Plaza No.10, Kuta, Kabupaten Badung, Bali 80361",bollywoodmasalaz.com,"7598+7X Kuta, Badung Regency, Bali",4.8,203,"https://www.google.com/maps/place/Bollywood+masalaz+-+Best+Indian+Restaurant+In+Kuta+Bali/@-8.657239,115.0125274,11z/data=!4m9!1m3!2m2!1srestaurants+in+Badung+Regency,+Bali!6e5!3m4!1s0x2dd2472c32563a53:0x3818948eb0d55f62!8m2!3d-8.7317802!4d115.1674538?hl=id"
1838,Warung Losni,"Jl. Raya Celuk No.27, Celuk, Kec. Sukawati, Kabupaten Gianyar, Bali 80582",warunglosni.business.site,"97W3+7G Celuk, Gianyar, Bali",4.2,203,"https://www.google.com/maps/place/Warung+Losni/@-8.604336,114.6934843,9z/data=!4m9!1m3!2m2!1srestaurants+in+Gianyar+Regency,+Bali!6e5!3m4!1s0x2dd23e4c620cd03b:0xb6aef6e55473b960!8m2!3d-8.604336!4d115.253787?hl=id"
1839,"Warung Makan Muslim "" Bidadari ""","Jl. Jenderal Sudirman No.23, Pendem, Kec. Negara, Kabupaten Jembrana, Bali 82218",business.site,"JJVH+4C Pendem, Jembrana Regency, Bali",3.8,203,"https://www.google.com/maps/place/Warung+Makan+Muslim+%22+Bidadari+%22/@-8.6568036,114.5904003,9z/data=!4m9!1m3!2m2!1srestaurants+in+Jembrana+Regency,+Bali!6e5!3m4!1s0x2dd1620359bc0f71:0x7e153d286efaebfe!8m2!3d-8.3572369!4d114.6286239?hl=id"
1840,Warung Sabar,"Bunutan, Abang, Karangasem Regency, Bali 80852",,"MM2J+W5 Bunutan, Karangasem Regency, Bali",4.7,203,"https://www.google.com/maps/place/Warung+Sabar/@-8.6568036,114.5904003,9z/data=!4m8!1m2!2m1!1srestaurants+in+Karangasem+Regency,+Bali!3m4!1s0x2dcdff6c1c79e80b:0x8c6b5a5a9600a1ee!8m2!3d-8.3476483!4d115.6803875?hl=id"
1841,Warung jumpung,"Jl. Rama No.104, Semarapura Kangin, Kec. Klungkung, Kabupaten Klungkung, Bali 80761",warung-jumpung.business.site,"FC66+F6 Semarapura Kangin, Klungkung Regency, Bali",4.1,203,"https://www.google.com/maps/place/Warung+jumpung/@-8.6567527,114.5897129,9z/data=!4m9!1m3!2m2!1srestaurants+in+Klungkung+Regency,+Bali!6e5!3m4!1s0x2dd2116c4f232aab:0x92ac99010c303f9d!8m2!3d-8.5388021!4d115.4105555?hl=id"
1842,Warung Forest,"Suana, Nusapenida, Klungkung Regency, Bali 80771",,"7HMR+GR Suana, Klungkung Regency, Bali",4.9,203,"https://www.google.com/maps/place/Warung+Forest/@-8.6361621,115.4416862,12z/data=!4m8!1m2!2m1!1srestaurants+in+Klungkung+Regency,+Bali!3m4!1s0x2dd27697d7702a61:0xc0980e4f8642044a!8m2!3d-8.7162358!4d115.5920227?hl=id"
1843,Monggo Bar & Restaurant,"Jl. Munduk Catu No.8X, Canggu, Kec. Kuta Utara, Kabupaten Badung, Bali 80351",business.site,"84WJ+G5 Canggu, Badung Regency, Bali",4.4,204,"https://www.google.com/maps/place/Monggo+Bar+%26+Restaurant/@-8.657239,115.0125274,11z/data=!4m9!1m3!2m2!1srestaurants+in+Buleleng+Regency,+Bali!6e5!3m4!1s0x2dd238783289f727:0x23b2ecc59f15749!8m2!3d-8.6536724!4d115.1304234?hl=id"
1845,Warung Enak,"Jl. Raya Pengosekan Ubud, Ubud, Kecamatan Ubud, Kabupaten Gianyar, Bali 80571",warungenakbali.com,"F7H7+R3 Ubud, Gianyar, Bali",4.3,204,"https://www.google.com/maps/place/Warung+Enak/@-8.5204,115.1926122,12z/data=!4m9!1m3!2m2!1srestaurants+in+Gianyar+Regency,+Bali!6e5!3m4!1s0x2dd23d13562e31a5:0x1252fe33e74dbcd8!8m2!3d-8.5204!4d115.26265?hl=id"
1847,Nirwana Beach & Resort Candidasa,"Jalan Sengkidu, Jl. Raya Candidasa, Sengkidu, Kec. Manggis, Kabupaten Karangasem, Bali 80871",trmhospitality.com,"FHW4+2J Sengkidu, Karangasem Regency, Bali",4.2,204,"https://www.google.com/maps/place/Nirwana+Beach+%26+Resort+Candidasa/@-8.6568036,114.5904003,9z/data=!4m12!1m3!2m2!1srestaurants+in+Karangasem+Regency,+Bali!6e5!3m7!1s0x2dd209204f50d07f:0xc5a727787a4f33b8!5m2!4m1!1i2!8m2!3d-8.504999!4d115.556559?hl=id"
1848,Sands Restaurant at The Anvaya Beach Resort Bali,"Jl. Kartika Plaza, Tuban, Kuta, Kabupaten Badung, Bali 80361",theanvayabali.com,"7597+4Q Tuban, Badung Regency, Bali",4.6,205,"https://www.google.com/maps/place/Sands+Restaurant+at+The+Anvaya+Beach+Resort+Bali/@-8.657239,115.0125274,11z/data=!4m9!1m3!2m2!1srestaurants+in+Badung+Regency,+Bali!6e5!3m4!1s0x2dd2469f9cdc7491:0xd3e8cccbfe60b387!8m2!3d-8.732245!4d115.164389?hl=id"
1849,Di Lipah Warung,"Amed St, Bunutan, Abang, Karangasem Regency, Bali 80852",,"JMXM+C4 Bunutan, Karangasem Regency, Bali",4.6,205,"https://www.google.com/maps/place/Di+Lipah+Warung/@-8.6568036,114.5904003,9z/data=!4m8!1m2!2m1!1srestaurants+in+Karangasem+Regency,+Bali!3m4!1s0x2dcdff6b9a786e15:0x71b7521581aa9bd3!8m2!3d-8.3514516!4d115.6828407?hl=id"
1850,Tirai Air Terjun Tukad Unda,"Tukad Yeh Unda, Semarapura Kelod Kangin, Kec. Karangasem, Kabupaten Klungkung, Bali 80761",,"FC86+F9 Semarapura Kelod Kangin, Klungkung Regency, Bali",4.4,205,"https://www.google.com/maps/place/Tirai+Air+Terjun+Tukad+Unda/@-8.5066963,115.0803123,10z/data=!4m9!1m3!2m2!1sobjek+wisata+di+bali!6e1!3m4!1s0x2dd21112e25d78d3:0x4db4be8663906cab!8m2!3d-8.5338492!4d115.4109914?hl=id"
1851,The Coffee Club International Bali Airport,"Terminal Keberangkatan Airport Gusti Ngurah Rai Tuban Kuta Badung, Tuban, Kuta, Kabupaten Badung, Bali 80362",,"7548+RG Tuban, Badung Regency, Bali",4,206,"https://www.google.com/maps/place/The+Coffee+Club+International+Bali+Airport/@-8.6700536,115.0981279,11z/data=!3m1!5s0x2dd2441814247a99:0x6a010471a0323cf5!4m9!1m3!2m2!1srestaurants+in+Denpasar+Regency,+Bali!6e5!3m4!1s0x2dd2441869a37d35:0x81861c6d215913e0!8m2!3d-8.7428816!4d115.1663389?hl=id"
1853,Tippos Bali,"Tippos, Jl. A.A. Gede Rai No.555, Lodtunduh, Kecamatan Ubud, Kabupaten Gianyar, Bali 80571",tipposbali.com,"F736+WV Lodtunduh, Gianyar, Bali",4.6,206,"https://www.google.com/maps/place/Tippo%E2%80%99s+Bali/@-8.5452455,115.192146,12z/data=!4m9!1m3!2m2!1srestaurants+in+Gianyar+Regency,+Bali!6e5!3m4!1s0x2dd23d1ad0649583:0x112d80a2efe16ff3!8m2!3d-8.5452455!4d115.2621838?hl=id"
1854,Odette Bali,"Jl. Raya Mas, MAS, Kecamatan Ubud, Kabupaten Gianyar, Bali 80571",,"F78C+7R MAS, Gianyar, Bali",4.7,206,"https://www.google.com/maps/place/Odette+Bali/@-8.534316,115.2020262,12z/data=!4m9!1m3!2m2!1srestaurants+in+Gianyar+Regency,+Bali!6e5!3m4!1s0x2dd23d855282181d:0xdd3d8f9b484b3c9a!8m2!3d-8.534316!4d115.272064?hl=id"
1858,Green Guru Smoothie Bowl Bar,"Pantai Batu Bolong St No.61, Canggu, North Kuta, Badung Regency, Bali 80351",,"84XP+VF Canggu, Badung Regency, Bali",4.7,207,"https://www.google.com/maps/place/Green+Guru+Smoothie+Bowl+Bar/@-8.657239,115.0125274,11z/data=!4m9!1m3!2m2!1srestaurants+in+Badung+Regency,+Bali!6e5!3m4!1s0x2dd24723d77973bb:0x4f0e8f2a3a2017ec!8m2!3d-8.6503422!4d115.1362252?hl=id"
1859,Lantern Bali,"Petitenget St No.17, Kerobokan, North Kuta, Badung Regency, Bali 80361",eatcompany.co,"85H6+9W Kerobokan, Badung Regency, Bali",4.5,207,"https://www.google.com/maps/place/Lantern+Bali/@-8.657239,115.0125274,11z/data=!4m9!1m3!2m2!1srestaurants+in+Badung+Regency,+Bali!6e5!3m4!1s0x2dd2476afec3b2f5:0x9e05e61c56d75387!8m2!3d-8.6715553!4d115.1623234?hl=id"
1863,Made's Warung Penestanan Ubud,"Jl. Campuhan Br. Penestanan Kaja, Ubud, Sayan, Kecamatan Ubud, Kabupaten Gianyar, Bali 80571",madeswarungubud.com,"F7W2+J4 Sayan, Gianyar, Bali",4.5,207,"https://www.google.com/maps/place/Made's+Warung+Penestanan+Ubud/@-8.503384,115.1102943,11z/data=!4m9!1m3!2m2!1srestaurants+in+Buleleng+Regency,+Bali!6e5!3m4!1s0x2dd23d3ce345f071:0xd5132b3d35d3f438!8m2!3d-8.503384!4d115.25037?hl=id"
1865,Teras Padi Cafe,"Jl. Raya Tegallalang No.5758, Tegallalang, Kec. Tegallalang, Kabupaten Gianyar, Bali 80561",teraspadicafe.com,"H78H+JC Tegallalang, Gianyar, Bali",4.1,207,"https://www.google.com/maps/place/Teras+Padi+Cafe/@-8.4333941,114.7182906,9z/data=!4m9!1m3!2m2!1srestaurants+in+Gianyar+Regency,+Bali!6e5!3m4!1s0x2dd21f4555555555:0xfc6f5fb2d63c33bf!8m2!3d-8.4333941!4d115.2785933?hl=id"
1867,Loaf Candidasa Cafe,"Jl. Raya Candidasa, Nyuh Tebel, Kec. Karangasem, Kabupaten Karangasem, Bali 80811",,"FHV6+FX Nyuh Tebel, Karangasem Regency, Bali",4.6,207,"https://www.google.com/maps/place/Loaf+Candidasa+Cafe/@-8.5062566,115.4223528,11z/data=!4m9!1m3!2m2!1srestaurants+in+Karangasem+Regency,+Bali!6e5!3m4!1s0x2dd20ed5d939440d:0xf91b9fe6f9b5f26c!8m2!3d-8.5062566!4d115.5624285?hl=id"
1868,The Balcony Restaurant & Bar Bali,"Jl. Bene Sari No.16, Legian, Kuta, Kabupaten Badung, Bali 80361",thebalconybali.com,"75QC+25 Legian, Badung Regency, Bali",4.4,208,"https://www.google.com/maps/place/The+Balcony+Restaurant+%26+Bar+Bali/@-8.657239,115.0125274,11z/data=!4m9!1m3!2m2!1srestaurants+in+Badung+Regency,+Bali!6e5!3m4!1s0x2dd246c0ca3d87df:0xe34b25d85193b96a!8m2!3d-8.7124989!4d115.1704315?hl=id"
1869,Wasabi Hotel and Restaurant,"Jl. Pantai Pererenan, Pererenan, Kec. Mengwi, Kabupaten Badung, Bali 80351",wasabihotel.com,"943F+4V Pererenan, Badung Regency, Bali",4.5,208,"https://www.google.com/maps/place/Wasabi+Hotel+and+Restaurant/@-8.657239,115.0125274,11z/data=!4m12!1m3!2m2!1srestaurants+in+Bangli+Regency,+Bali!6e5!3m7!1s0x2dd23871eea496fb:0x988f513692738f36!5m2!4m1!1i2!8m2!3d-8.6472267!4d115.1246341?hl=id"
1873,L'Osteria,"Jl. Monkey Forest No.8, Ubud, Kecamatan Ubud, Kabupaten Gianyar, Bali 80571",instagram.com,"F7J7+P6 Ubud, Gianyar, Bali",4.6,209,"https://www.google.com/maps/place/L'Osteria/@-8.5181699,115.1230254,11z/data=!4m9!1m3!2m2!1srestaurants+in+Buleleng+Regency,+Bali!6e5!3m4!1s0x2dd23d8ce04adca9:0x6686562fa59be99b!8m2!3d-8.5181699!4d115.2631011?hl=id"
1876,Bali Cafe 21,"Jl. Pantai Kedonganan No.21, Kedonganan, Kuta, Kabupaten Badung, Bali 80361",,"65R9+FP Kedonganan, Badung Regency, Bali",4.1,210,"https://www.google.com/maps/place/Bali+Cafe+21/@-8.657239,115.0125274,11z/data=!4m9!1m3!2m2!1srestaurants+in+Badung+Regency,+Bali!6e5!3m4!1s0x2dd2446bc4c9e23d:0x4aff174821b80910!8m2!3d-8.7588221!4d115.1693099?hl=id"
1877,The Luhron,"Jl. Cendrawasih No.17, Kerobokan Kelod, Kec. Kuta Utara, Kabupaten Badung, Bali 80361",,"85F3+R8 Kerobokan Kelod, Badung Regency, Bali",4.6,210,"https://www.google.com/maps/place/The+Luhron/@-8.657239,115.0125274,11z/data=!4m8!1m2!2m1!1srestaurants+in+Badung+Regency,+Bali!3m4!1s0x2dd24712b019bccf:0xb604eb5ed06e91f4!8m2!3d-8.6754845!4d115.1533082?hl=id"
1878,Kunti 3,"Banjar Semer, Jl. Raya Anyar, Kerobokan, North Kuta, Badung Regency, Bali 80361",,"9526+GQ Kerobokan, Badung Regency, Bali",4.3,210,"https://www.google.com/maps/place/Kunti+3/@-8.657239,115.0125274,11z/data=!4m9!1m3!2m2!1srestaurants+in+Bangli+Regency,+Bali!6e5!3m4!1s0x2dd238992b46d3df:0xa2858e4a33d5562a!8m2!3d-8.6487317!4d115.1619721?hl=id"
1881,Puri Agung Kerambitan,"Jl. Jurusan Kerambitan, Kerambitan, Kec. Kerambitan, Kabupaten Tabanan, Bali 82161",,"F33H+9X Kerambitan, Tabanan Regency, Bali",4.6,210,"https://www.google.com/maps/place/Puri+Agung+Kerambitan/@-8.5066963,115.0803123,10z/data=!4m9!1m3!2m2!1sobjek+wisata+di+bali!6e1!3m4!1s0x504576ba6f0b7cd:0xc30c2c19422036d6!8m2!3d-8.5465004!4d115.0799096?hl=id"
1882,Rice Terrace Cafe,"Jalan Raya Tegallalang, Tegallalang, Kec. Tegallalang, Kabupaten Gianyar, Bali 80561",riceterrace.business.site,"H78H+GF Tegallalang, Gianyar, Bali",4,211,"https://www.google.com/maps/place/Rice+Terrace+Cafe/@-8.4337034,114.7183662,9z/data=!4m9!1m3!2m2!1srestaurants+in+Gianyar+Regency,+Bali!6e5!3m4!1s0x2dd2220833764359:0x35d68f2b9d460172!8m2!3d-8.4337034!4d115.2786689?hl=id"
1883,Bali Sea Turtle Society,"Jl. Pantai Kuta, Kuta, Kabupaten Badung, Bali 80361",baliseaturtle.org,"75G9+MW Kuta, Badung Regency, Bali",4.4,211,"https://www.google.com/maps/place/Bali+Sea+Turtle+Society/@-8.5066963,115.0803123,10z/data=!4m9!1m3!2m2!1sobjek+wisata+di+bali!6e1!3m4!1s0x2dd246bcc72fc287:0xe9eb9a52e1958aab!8m2!3d-8.7232678!4d115.1698051?hl=id"
1884,The Wharf Restaurant Bali,"Jl. Kartika Plaza, Kuta, Kabupaten Badung, Bali 80361",thewharf-restaurant-bali.com,"7587+RJ Kuta, Badung Regency, Bali",4.2,212,"https://www.google.com/maps/place/The+Wharf+Restaurant+Bali/@-8.657239,115.0125274,11z/data=!4m9!1m3!2m2!1srestaurants+in+Badung+Regency,+Bali!6e5!3m4!1s0x2dd2469f912c49bd:0x14c08528835991b4!8m2!3d-8.732901!4d115.164106?hl=id"
1886,MAITAI BALI - Tahitian Kitchen,"Echo beach, Jalan Batu Mejan No.50, Canggu, North Kuta, Badung Regency, Bali 80361",maitaibali.com,"84XJ+5P Canggu, Badung Regency, Bali",4.4,213,"https://www.google.com/maps/place/MAITAI+BALI+-+Tahitian+Kitchen/@-8.657239,115.0125274,11z/data=!4m9!1m3!2m2!1srestaurants+in+Badung+Regency,+Bali!6e5!3m4!1s0x2dd23879a2dcba15:0x930a104c263d1d7a!8m2!3d-8.6520861!4d115.1318583?hl=id"
1888,Ithaka Ubud,"Jl. Tirta Tawar No.158, Ubud, Kecamatan Ubud, Kabupaten Gianyar, Bali 80571",ithakawarung.com,"G78C+H7 Ubud, Gianyar, Bali",4.6,213,"https://www.google.com/maps/place/Ithaka+Ubud/@-8.4835523,114.7103401,9z/data=!4m9!1m3!2m2!1srestaurants+in+Bangli+Regency,+Bali!6e5!3m4!1s0x2dd222b2611a2227:0xa6ad5e4ed74afa83!8m2!3d-8.4835523!4d115.2706428?hl=id"
1891,Sea Breeze Lovina,"Jalan Pantai Binaria Desa Kalibukbuk Lovina, Kecamatan Buleleng, Anturan, Kec. Buleleng, Kabupaten Buleleng, Bali 81151",,"R2QF+8J Anturan, Buleleng Regency, Bali",4.2,213,"https://www.google.com/maps/place/Sea+Breeze+Lovina/@-8.161649,114.4638048,9z/data=!4m12!1m3!2m2!1srestaurants+in+Buleleng+Regency,+Bali!6e5!3m7!1s0x2dd19b3f4f0113df:0x4b656261db3bc7df!5m2!4m1!1i2!8m2!3d-8.161649!4d115.0241075?hl=id"
1895,Blue Earth Village,"Amed St, Bunutan, Abang, Karangasem Regency, Bali 80852",blueearthvillage.com,"MM66+FX Bunutan, Karangasem Regency, Bali",4.7,213,"https://www.google.com/maps/place/Blue+Earth+Village/@-8.6568036,114.5904003,9z/data=!4m9!1m3!2m2!1srestaurants+in+Karangasem+Regency,+Bali!6e5!3m4!1s0x2dd200802f4b4691:0x6dd3cdb069174fea!8m2!3d-8.338795!4d115.6624562?hl=id"
1896,pantai dlod berawah,"Delod Brawah, Mendoyo, Delod Berawah, Kec. Jembrana, Kabupaten Jembrana, Bali",,"JM2G+9W Delod Berawah, Jembrana Regency, Bali",4.1,213,"https://www.google.com/maps/place/pantai+dlod+berawah/@-8.3990633,114.3971351,10z/data=!4m9!1m3!2m2!1sobjek+wisata+di+bali!6e1!3m4!1s0x2dd3d851ecd8f9a3:0x5844e6a61c73b439!8m2!3d-8.3990633!4d114.6772865?hl=id"
1897,Klumpu Warung Bali,"Jl. Cargo Permai No.48, Ubung, Kec. Denpasar Utara, Kota Denpasar, Bali 80111",,"959X+C4 Ubung, Denpasar City, Bali",4.3,214,"https://www.google.com/maps/place/Klumpu+Warung+Bali/@-8.657239,115.0125274,11z/data=!4m9!1m3!2m2!1srestaurants+in+Bangli+Regency,+Bali!6e5!3m4!1s0x2dd23f482cb53af5:0x57a856c9a74dee7b!8m2!3d-8.6314011!4d115.1978556?hl=id"
1900,Mona Lisa Restaurant,"Jl. Danau Tamblingan No.98, Sanur, Kec. Denpasar Sel., Kota Denpasar, Bali 80228",,"8757+VC Sanur, Denpasar City, Bali",4.5,214,"https://www.google.com/maps/place/Mona+Lisa+Restaurant/@-8.6703321,115.2031965,13z/data=!4m9!1m3!2m2!1srestaurants+in+Denpasar+Regency,+Bali!6e5!3m4!1s0x2dd241cb1cbacbdd:0xf374178079b63136!8m2!3d-8.6903724!4d115.2635727?hl=id"
