,Name,Full_Address,Website,Plus_Code,Rating,Reviews,URL
1090,Eight Degrees South,"Jalan Pratama 168, Tanjung Benoa, Nusa Dua, South Coast, Benoa, South Kuta, Badung Regency, Bali 80361",conradbali.com,"669G+QF Benoa, Badung Regency, Bali",4.2,77,"https://www.google.com/maps/place/Eight+Degrees+South/@-8.780513,115.0861263,11z/data=!4m9!1m3!2m2!1srestaurants+in+Badung+Regency,+Bali!6e5!3m4!1s0x2dd243b58005fac5:0xfe9b5cf4738c4ea7!8m2!3d-8.780513!4d115.226202?hl=id"
1091,Menega Restaurant,"Sol Beach House Hotel, Lantai 1, Jl. Pratama, Benoa, Kec. Kuta Sel., Kabupaten Badung, Bali 80361",melia.com,"667G+8W Benoa, Badung Regency, Bali",4.4,77,"https://www.google.com/maps/place/Menega+Restaurant/@-8.786726,115.0872663,11z/data=!4m9!1m3!2m2!1srestaurants+in+Badung+Regency,+Bali!6e5!3m4!1s0x2dd243199dbf6d79:0xfb3888d58020ba89!8m2!3d-8.786726!4d115.227342?hl=id"
1092,Sai Krisna Vegetarian,"Jl. Seroja No.19, Tonja, Kec. Denpasar Utara, Kota Denpasar, Bali 80235",,"968H+HP Tonja, Denpasar City, Bali",3.8,77,"https://www.google.com/maps/place/Sai+Krisna+Vegetarian/@-8.6335143,115.0892423,11z/data=!4m9!1m3!2m2!1srestaurants+in+Bangli+Regency,+Bali!6e5!3m4!1s0x2dd23f73e41e7705:0xf73608ee026098e3!8m2!3d-8.6335143!4d115.229318?hl=id"
1093,Nasi Kajeng,"Jl. Merdeka No.43, Kawan, Kec. Bangli, Kabupaten Bangli, Bali 80614",nasi-kajeng.business.site,"G9R4+XM Kawan, Bangli Regency, Bali",4.6,77,"https://www.google.com/maps/place/Nasi+Kajeng/@-8.657239,115.0125274,9z/data=!4m9!1m3!2m2!1srestaurants+in+Bangli+Regency,+Bali!6e5!3m4!1s0x2dd2199546db4abb:0xa438cb2d8746ac20!8m2!3d-8.4576213!4d115.3566477?hl=id"
1094,Warung Jowet,"Penelokan Main Rd, South Batur, Kintamani, Bangli Regency, Bali 80652",,"P8JV+79 South Batur, Bangli Regency, Bali",4.2,77,"https://www.google.com/maps/place/Warung+Jowet/@-8.657239,115.0125274,9z/data=!4m8!1m2!2m1!1srestaurants+in+Bangli+Regency,+Bali!3m4!1s0x2dd1f44fe6d9a37d:0x54ea35f10ec8da9a!8m2!3d-8.2692929!4d115.3434462?hl=id"
1095,Kojin - Japanese Teppanyaki Restaurant Ubud,"Jl. Raya Desa Kenderan No.88 A, Kenderan, Kec. Tegallalang, Kabupaten Gianyar, Bali 80571",aksariubud.com,"H7CX+P4 Kenderan, Gianyar, Bali",5,77,"https://www.google.com/maps/place/Kojin+-+Japanese+Teppanyaki+Restaurant+Ubud/@-8.657239,115.0125274,9z/data=!4m8!1m2!2m1!1srestaurants+in+Bangli+Regency,+Bali!3m4!1s0x2dd219349a81f83d:0xc9ce9647347215!8m2!3d-8.4282451!4d115.2977884?hl=id"
1098,Be Pasih Warung,"Jl. Raya Batumulapan, Batununggul, Nusapenida, Kabupaten Klungkung, Bali 80771",,"8H6H+WQ Batununggul, Klungkung Regency, Bali",4.4,77,"https://www.google.com/maps/place/Be+Pasih+Warung/@-8.6567527,114.5897129,9z/data=!4m9!1m3!2m2!1srestaurants+in+Klungkung+Regency,+Bali!6e5!3m4!1s0x2dd2740d838df459:0x6ce8fc6a3b37dcb7!8m2!3d-8.6877058!4d115.5794697?hl=id"
1100,Warung Cak Man,"Baturiti, Tabanan Regency, Bali 82191",business.site,"M5FP+R6 Baturiti, Tabanan Regency, Bali",4.4,77,"https://www.google.com/maps/place/Warung+Cak+Man/@-8.3254718,115.0455447,11z/data=!4m9!1m3!2m2!1srestaurants+in+Tabanan+Regency,+Bali!6e5!3m4!1s0x2dd189fee0cf0c17:0x68d16c0a02edf922!8m2!3d-8.3254718!4d115.1856204?hl=id"
1101,Warung Dadidu,"81114, Jl. Cendrawasih, Kaliuntu, Kec. Buleleng, Kabupaten Buleleng, Bali 81116",,"V3QP+MJ Kaliuntu, Buleleng Regency, Bali",4.3,78,"https://www.google.com/maps/place/Warung+Dadidu/@-8.1107709,114.5262626,9z/data=!4m9!1m3!2m2!1srestaurants+in+Buleleng+Regency,+Bali!6e5!3m4!1s0x2dd19a0c4016afe7:0x53c94edb5400ac7d!8m2!3d-8.1107709!4d115.0865653?hl=id"
1102,Bali Pesto Cafe,"Jalan Wenara Wana, Ubud, Kecamatan Ubud, Kabupaten Gianyar, Bali 80571",,"F7P6+P6 Ubud, Gianyar, Bali",4,78,"https://www.google.com/maps/place/Bali+Pesto+Cafe/@-8.5131511,115.1905387,12z/data=!4m9!1m3!2m2!1srestaurants+in+Gianyar+Regency,+Bali!6e5!3m4!1s0x2dd23d6d2fa5aefd:0xb16673c9207ceee1!8m2!3d-8.5131511!4d115.2605765?hl=id"
1103,Divers Cafe & Restaurant,"Jl. Raya Amed, Jemeluk, Purwakerti, Abang, Kabupaten Karangasem, Bali 80852",,"MM75+3F Purwakerti, Karangasem Regency, Bali",4.2,78,"https://www.google.com/maps/place/Divers+Cafe+%26+Restaurant/@-8.6568036,114.5904003,9z/data=!4m9!1m3!2m2!1srestaurants+in+Karangasem+Regency,+Bali!6e5!3m4!1s0x2dd200809ea336b1:0x3448c7a0bbfd84a9!8m2!3d-8.337357!4d115.658716?hl=id"
1104,Oto Bento Japanese Restaurant,"Tuban, Kuta, Badung Regency, Bali 80361",,"755H+4H Tuban, Badung Regency, Bali",4.3,79,"https://www.google.com/maps/place/Oto+Bento+Japanese+Restaurant/@-8.657239,115.0125274,11z/data=!4m9!1m3!2m2!1srestaurants+in+Badung+Regency,+Bali!6e5!3m4!1s0x2dd245a4ed6709a9:0x2cc1fcd53e8d8e59!8m2!3d-8.7421269!4d115.1789515?hl=id"
1105,Amed Harmony Bungalows & Villas,"Amed St, Bunutan, Abang, Karangasem Regency, Bali 80811",amedharmony.com,"MM3C+WC Bunutan, Karangasem Regency, Bali",4.6,79,"https://www.google.com/maps/place/Amed+Harmony+Bungalows+%26+Villas/@-8.345239,115.5309843,11z/data=!4m12!1m3!2m2!1srestaurants+in+Karangasem+Regency,+Bali!6e5!3m7!1s0x2dcdff7b23f91a0f:0x8a6b04c4fc0ce31b!5m2!4m1!1i2!8m2!3d-8.345239!4d115.67106?hl=id"
1107,Warung Sripadi,"Jalan Pura Tirta Empul Tampaksiring, Gianyar, Bali, Tampaksiring, Kabupaten Gianyar, Bali 80552",,"H8J7+X8 Tampaksiring, Gianyar, Bali",4.6,79,"https://www.google.com/maps/place/Warung+Sripadi/@-8.4175865,115.1732843,11z/data=!4m9!1m3!2m2!1srestaurants+in+Karangasem+Regency,+Bali!6e5!3m4!1s0x2dd218c3e0e265c5:0xe1a75e746124a277!8m2!3d-8.4175865!4d115.31336?hl=id"
1109,Garamerica Restaurant,"Jl. Dewi Sri, Kuta, Kabupaten Badung, Bali 80361",business.site,"75RH+XC Kuta, Badung Regency, Bali",4.2,80,"https://www.google.com/maps/place/Garamerica+Restaurant/@-8.657239,115.0125274,11z/data=!4m9!1m3!2m2!1srestaurants+in+Badung+Regency,+Bali!6e5!3m4!1s0x2dd246cf30f74ced:0x57e3f52cfd049edb!8m2!3d-8.7076109!4d115.1785205?hl=id"
1110,Sareng Sareng Megibung,"Jl. Raya Sanggingan No.88X, Kedewatan, Kecamatan Ubud, Kabupaten Gianyar, Bali 80571",sarengsareng.com,"G733+X9 Kedewatan, Gianyar, Bali",4.7,80,"https://www.google.com/maps/place/Sareng+Sareng+Megibung/@-8.495061,115.1833392,12z/data=!4m9!1m3!2m2!1srestaurants+in+Gianyar+Regency,+Bali!6e5!3m4!1s0x2dd23d30ba6dbdb1:0xaa8999056893cea9!8m2!3d-8.495061!4d115.253377?hl=id"
1111,Wayan Restaurant Tulamben,"Tulamben, Kubu, Krangasem, Bali 80852",business.site,"PHFR+5W Tulamben, Karangasem Regency, Bali",4.1,80,"https://www.google.com/maps/place/Wayan+Restaurant+Tulamben/@-8.6568036,114.5904003,9z/data=!4m9!1m3!2m2!1srestaurants+in+Karangasem+Regency,+Bali!6e5!3m4!1s0x2dd1ff15fa7cf655:0x6a48425617f7e144!8m2!3d-8.2770289!4d115.5923316?hl=id"
1112,Joglo Bar & Restaurant,"Jl. Raya Candidasa, Sengkidu, Kec. Karangasem, Kabupaten Karangasem, Bali 80851",,"FHR8+JQ Sengkidu, Karangasem Regency, Bali",4.1,80,"https://www.google.com/maps/place/Joglo+Bar+%26+Restaurant/@-8.6568036,114.5904003,9z/data=!4m9!1m3!2m2!1srestaurants+in+Karangasem+Regency,+Bali!6e5!3m4!1s0x2dd20ed4bc3a5443:0xae21547abeed9679!8m2!3d-8.5084316!4d115.5669015?hl=id"
1115,Scooby doo,"Nusa Lembongan, Nusapenida, Jungutbatu, Nusapenida, Kabupaten Klungkung, Bali 80771",,"8CHX+62 Jungutbatu, Klungkung Regency, Bali",3.8,80,"https://www.google.com/maps/place/Scooby+doo/@-8.6567527,114.5897129,9z/data=!4m9!1m3!2m2!1srestaurants+in+Klungkung+Regency,+Bali!6e5!3m4!1s0x2dd26d0ae48c5631:0x106e1858a116c61e!8m2!3d-8.6719583!4d115.4475935?hl=id"
1116,As Siddiq Restaurant,"Banjar Candikuning 2, Bedugul, Kabupaten Tabanan, Bali 82191",business.site,"P5F7+PJ Candikuning, Tabanan Regency, Bali",3.9,80,"https://www.google.com/maps/place/As+Siddiq+Restaurant/@-8.2756352,115.0240257,11z/data=!4m9!1m3!2m2!1srestaurants+in+Tabanan+Regency,+Bali!6e5!3m4!1s0x2dd189135cf5d127:0x1c0800585974132a!8m2!3d-8.2756352!4d115.1641014?hl=id"
1117,Lembu Putih Taro,"Taro, Tegallalang, Gianyar, Bali 80561",,"J75M+6V Taro, Gianyar, Bali",4.6,80,"https://www.google.com/maps/place/Lembu+Putih+Taro/@-8.5066963,115.0803123,10z/data=!4m9!1m3!2m2!1sobjek+wisata+di+bali!6e1!3m4!1s0x2dd21f58190f515b:0xbc9a32fe7cc7cf13!8m2!3d-8.3919447!4d115.2846379?hl=id"
1118,Waroeng Billy's 69 Resto,"Jl. Prof. Dr. Ida Bagus Mantra, Saba, Kec. Blahbatuh, Kabupaten Gianyar, Bali 80581",business.site,"98V9+GC Saba, Gianyar, Bali",4.2,81,"https://www.google.com/maps/place/Waroeng+Billy's+69+Resto/@-8.657188,115.0118399,11z/data=!4m9!1m3!2m2!1srestaurants+in+Karangasem+Regency,+Bali!6e5!3m4!1s0x2dd2150e971bf79d:0xadf209fe70ee8bf1!8m2!3d-8.6061899!4d115.318545?hl=id"
1119,Puri Sawah Bungalows & Restaurant,"Tirta Gangga, Ababi, Abang, Karangasem Regency, Bali 80852",business.site,"HHQQ+R5 Ababi, Karangasem Regency, Bali",4.4,81,"https://www.google.com/maps/place/Puri+Sawah+Bungalows+%26+Restaurant/@-8.6568036,114.5904003,9z/data=!4m12!1m3!2m2!1srestaurants+in+Karangasem+Regency,+Bali!6e5!3m7!1s0x2dd2069237bcd1f5:0xcb72c5ce4898836f!5m2!4m1!1i2!8m2!3d-8.410397!4d115.587989?hl=id"
1121,Ocean Blue Bar And Restaurant,"Jl. Raya Batumulapan, Batununggul, Nusapenida, Kabupaten Klungkung, Bali 80771",,"8H7H+X5 Batununggul, Klungkung Regency, Bali",4.5,81,"https://www.google.com/maps/place/Ocean+Blue+Bar+And+Restaurant/@-8.6567527,114.5897129,9z/data=!4m9!1m3!2m2!1srestaurants+in+Klungkung+Regency,+Bali!6e5!3m4!1s0x2dd275a4e70c2e19:0x729fc15d48e43285!8m2!3d-8.6851073!4d115.5779418?hl=id"
1122,Warung Babi Guling Men Du,"Jl. Raya Alas Kedaton No.51, Kukuh, Marga, Kabupaten Tabanan, Bali 82181",business.site,"F5P6+83 Kukuh, Tabanan Regency, Bali",4.4,81,"https://www.google.com/maps/place/Warung+Babi+Guling+Men+Du/@-8.6570861,115.010465,11z/data=!4m9!1m3!2m2!1srestaurants+in+Tabanan+Regency,+Bali!6e5!3m4!1s0x2dd23b15c585678b:0x4db866c7e34e97db!8m2!3d-8.5142459!4d115.1601725?hl=id"
1123,Gembok cinta,"Tegallalang, Gianyar, Bali 80561",gembok-cinta.business.site,"H77G+76 Tegallalang, Gianyar, Bali",4.1,81,"https://www.google.com/maps/place/Gembok+cinta/@-8.5066963,115.0803123,10z/data=!4m9!1m3!2m2!1sobjek+wisata+di+bali!6e1!3m4!1s0x2dd2227bb0f3f8cf:0xdc6da707fe183513!8m2!3d-8.4367798!4d115.2755398?hl=id"
1124,Nature Tourism Green Cliff,"Unnamed Road, Yeh Embang Kangin, Kec. Mendoyo, Kabupaten Jembrana, Bali 82261",,"JQMW+PG Yeh Embang Kangin, Jembrana Regency, Bali",4.3,81,"https://www.google.com/maps/place/Nature+Tourism+Green+Cliff/@-8.5066963,115.0803123,10z/data=!4m8!1m2!2m1!1sobjek+wisata+di+bali!3m4!1s0x2dd3d6100ea21099:0xfc3c9c456b175a53!8m2!3d-8.3656816!4d114.7963116?hl=id"
1125,Beranda Vintage Restaurant & Coffee,"Jl. Raya Padang Luwih No.118, Dalung, Kec. Kuta Utara, Kabupaten Badung, Bali 80361",business.site,"95GF+HP Dalung, Badung Regency, Bali",4.4,82,"https://www.google.com/maps/place/Beranda+Vintage+Restaurant+%26+Coffee/@-8.657239,115.0125274,11z/data=!4m9!1m3!2m2!1srestaurants+in+Bangli+Regency,+Bali!6e5!3m4!1s0x2dd238c506d30e27:0x737a3c4a4bc3feba!8m2!3d-8.6235781!4d115.1743726?hl=id"
1127,Healthy Warung,"Jl. Gootama No.5, Ubud, Kecamatan Ubud, Kabupaten Gianyar, Bali 80571",business.site,"F7R7+GP Ubud, Gianyar, Bali",4.6,82,"https://www.google.com/maps/place/Healthy+Warung/@-8.5087271,115.1942921,12z/data=!4m9!1m3!2m2!1srestaurants+in+Gianyar+Regency,+Bali!6e5!3m4!1s0x2dd23d6bb91a0d8d:0x655495262ee1b507!8m2!3d-8.5087271!4d115.2643299?hl=id"
1128,Amed Resto,"Jl. Raya Amed, Bunutan, Abang, Kabupaten Karangasem, Bali 80852",,"MJ7X+PP Bunutan, Karangasem Regency, Bali",4.2,82,"https://www.google.com/maps/place/Amed+Resto/@-8.6568036,114.5904003,9z/data=!4m9!1m3!2m2!1srestaurants+in+Karangasem+Regency,+Bali!6e5!3m4!1s0x2dd20062e6fa4329:0x15b7280e1363ed3!8m2!3d-8.335692!4d115.649287?hl=id"
1129,Toya Gangga,"Jl. Raya Toya Pakeh - Ped, Ped, Nusapenida, Kabupaten Klungkung, Bali 80771",,"8FGX+G7 Ped, Klungkung Regency, Bali",4.5,82,"https://www.google.com/maps/place/Toya+Gangga/@-8.6567527,114.5897129,9z/data=!4m9!1m3!2m2!1srestaurants+in+Klungkung+Regency,+Bali!6e5!3m4!1s0x2dd27388e007dc6b:0x81aee48d6336b4b5!8m2!3d-8.6736464!4d115.4981558?hl=id"
1130,"K, Jendra Bar & Warung","Nusa Lembongan, Jungutbatu, Nusapenida, Klungkung Regency, Bali 80771",,"8C8H+7X Jungutbatu, Klungkung Regency, Bali",4.9,82,"https://www.google.com/maps/place/K,+Jendra+Bar+%26+Warung/@-8.6361621,115.4416862,12z/data=!4m8!1m2!2m1!1srestaurants+in+Klungkung+Regency,+Bali!3m4!1s0x2dd26d57c6bb6973:0x72ec5d962c83b555!8m2!3d-8.6842961!4d115.42996?hl=id"
1131,Pantai Cemongkak,"Pecatu, South Kuta, Badung Regency, Bali 80361",badungtourism.com,"54X8+3J Pecatu, Badung Regency, Bali",4.4,82,"https://www.google.com/maps/place/Pantai+Cemongkak/@-8.5066963,115.0803123,10z/data=!4m9!1m3!2m2!1sobjek+wisata+di+bali!6e1!3m4!1s0x2dd24540ceb0ac3b:0x59fd750511bd5bf6!8m2!3d-8.8023515!4d115.1165586?hl=id"
1132,Swiss Restaurant,"Jl. Legian Kelod No.360, Legian, Kuta, Kabupaten Badung, Bali 80361",bali-swiss.weebly.com,"75RC+9V Kuta, Badung Regency, Bali",4,83,"https://www.google.com/maps/place/Swiss+Restaurant/@-8.657239,115.0125274,11z/data=!4m9!1m3!2m2!1srestaurants+in+Badung+Regency,+Bali!6e5!3m4!1s0x2dd246ddc0cdb3dd:0x1fe467f9df3e906c!8m2!3d-8.709005!4d115.172136?hl=id"
1133,Lambodar Indian Food,"Dewi Sri Food Center, Jl. Raya Kuta No.59, Kuta, Badung Regency, Bali 80361",,"75RJ+49 Kuta, Badung Regency, Bali",4.7,83,"https://www.google.com/maps/place/Lambodar+Indian+Food/@-8.657239,115.0125274,11z/data=!4m9!1m3!2m2!1srestaurants+in+Badung+Regency,+Bali!6e5!3m4!1s0x2dd24756eca14929:0xa5258a62485a9e07!8m2!3d-8.7096738!4d115.1809435?hl=id"
1134,Bananaleaf Restaurant,"Unnamed Road banyuwedang, Menjangan, Pejarakan, Gerokgak, Kabupaten Buleleng, Bali 81155",batuamparbali.com,"VH7C+4W Pejarakan, Buleleng Regency, Bali",4.3,83,"https://www.google.com/maps/place/Bananaleaf+Restaurant/@-8.1371945,114.0120499,9z/data=!4m9!1m3!2m2!1srestaurants+in+Buleleng+Regency,+Bali!6e5!3m4!1s0x2dd16977fb1b9eb5:0xd19f59f88a41e85e!8m2!3d-8.1371945!4d114.5723526?hl=id"
1135,La Joya Restaurant,"Jl. Pantai Balangan, Jimbaran, Kec. Kuta Sel., Kabupaten Badung, Bali 80361",,"644G+X4 Jimbaran, Badung Regency, Bali",4.2,83,"https://www.google.com/maps/place/La+Joya+Restaurant/@-8.657239,115.0125274,11z/data=!4m9!1m3!2m2!1srestaurants+in+Gianyar+Regency,+Bali!6e5!3m4!1s0x2dd24511379725b3:0x3676b24aba307484!8m2!3d-8.792531!4d115.125307?hl=id"
1138,Warung Makan Lawar Bebek Pitik Bali,"Pasar Senggol Sari Boga, Gianyar, Kec. Gianyar, Kabupaten Gianyar, Bali 80511",,"F85G+FG Gianyar, Bali",4.4,83,"https://www.google.com/maps/place/Warung+Makan+Lawar+Bebek+%E2%80%9CPitik+Bali%E2%80%9D/@-8.657188,115.0118399,11z/data=!4m9!1m3!2m2!1srestaurants+in+Karangasem+Regency,+Bali!6e5!3m4!1s0x2dd2165dfb185d8d:0x284a9ebe53df038c!8m2!3d-8.5413521!4d115.3263305?hl=id"
1139,Warung Rusti,"Jl. Amlapura Singaraja, Tulamben, Kubu, Kabupaten Karangasem, Bali 80853",,"PHFR+CH Tulamben, Karangasem Regency, Bali",4.5,83,"https://www.google.com/maps/place/Warung+Rusti/@-8.6568036,114.5904003,9z/data=!4m9!1m3!2m2!1srestaurants+in+Karangasem+Regency,+Bali!6e5!3m4!1s0x2dd1ff3deabc2b1f:0x7438266f3a9618a7!8m2!3d-8.276416!4d115.591437?hl=id"
1140,Natys restaurant Tanah Lot,"Jl. Tanah Lot, Beraban, Kec. Kediri, Kabupaten Tabanan, Bali 82121",natysrestaurant.com,"93JQ+H7 Beraban, Tabanan Regency, Bali",4,83,"https://www.google.com/maps/place/Natys+restaurant+Tanah+Lot/@-8.6570861,115.010465,11z/data=!4m9!1m3!2m2!1srestaurants+in+Tabanan+Regency,+Bali!6e5!3m4!1s0x2dd23782189318fb:0x4b65c21034e74a78!8m2!3d-8.6185735!4d115.0881985?hl=id"
1141,"Warung Makan & Catering ""Wayan"" Candikuning","Candikuning, Baturiti, Tabanan Regency, Bali 82191",tumblr.com,"P5H6+CC Candikuning, Tabanan Regency, Bali",5,83,"https://www.google.com/maps/place/Warung+Makan+%26+Catering+%22Wayan%22+Candikuning/@-8.2714175,115.020959,11z/data=!4m8!1m2!2m1!1srestaurants+in+Tabanan+Regency,+Bali!3m4!1s0x2dd1897ead0268cb:0xb0edf31b2cd2b55a!8m2!3d-8.2714175!4d115.1610347?hl=id"
1142,Prada Priority Restaurant,"Jl. Nusa Dua, Benoa, Kec. Kuta Sel., Kabupaten Badung, Bali 80361",,"56XH+7Q Benoa, Badung Regency, Bali",3.7,84,"https://www.google.com/maps/place/Prada+Priority+Restaurant/@-8.801868,115.0893513,11z/data=!4m9!1m3!2m2!1srestaurants+in+Badung+Regency,+Bali!6e5!3m4!1s0x2dd2432f469da253:0x64f6390e36825d71!8m2!3d-8.801868!4d115.229427?hl=id"
1144,Bebek Asap Balcon Bali,"Jalan raya dalung permai, ruko dalung permai blok d no 23, Dalung, Kec. Kuta Utara, Kabupaten Badung, Bali 80361",balconindonesia.com,"95CC+V5 Dalung, Badung Regency, Bali",4,84,"https://www.google.com/maps/place/Bebek+Asap+Balcon+Bali/@-8.627806,115.1354801,13z/data=!4m9!1m3!2m2!1srestaurants+in+Buleleng+Regency,+Bali!6e5!3m4!1s0x2dd238c3fd6b49c7:0xee895d0a86e7d3ad!8m2!3d-8.627806!4d115.170499?hl=id"
1146,Orlando's Mama Pizza,"Jl. AA Pandji Tisna, Kaliasem, Kec. Banjar, Kabupaten Buleleng, Bali 81152",orlandosmama.com,"R2MC+JH Kaliasem, Buleleng Regency, Bali",4.8,84,"https://www.google.com/maps/place/Orlando's+Mama+Pizza/@-8.165909,114.4611802,9z/data=!4m9!1m3!2m2!1srestaurants+in+Buleleng+Regency,+Bali!6e5!3m4!1s0x2dd19b479e55856d:0x77c47439c4ecf797!8m2!3d-8.165909!4d115.0214829?hl=id"
1147,Warung Melati,"Jl. Nakula 5 No.5, Legian, Kuta, Kabupaten Badung, Bali 80361",fb.me,"852F+F7 Legian, Badung Regency, Bali",4.8,84,"https://www.google.com/maps/place/Warung+Melati/@-8.6987927,115.1382087,13z/data=!4m9!1m3!2m2!1srestaurants+in+Denpasar+Regency,+Bali!6e5!3m4!1s0x2dd246dbd9910699:0x1172fb38fee24ff4!8m2!3d-8.6987927!4d115.1732276?hl=id"
1148,OUR'S Bar & Restaurant,"Jl. Sahadewa, Legian, Kuta, Kabupaten Badung, Bali 80361",business.site,"75R9+RP Legian, Badung Regency, Bali",4.3,84,"https://www.google.com/maps/place/OUR'S+Bar+%26+Restaurant/@-8.657239,115.0125274,11z/data=!4m9!1m3!2m2!1srestaurants+in+Gianyar+Regency,+Bali!6e5!3m4!1s0x2dd246c3bf772f75:0xcddce8f7a11e19c1!8m2!3d-8.707945!4d115.169271?hl=id"
1149,Geringsing Restaurant,"Jl. Raya Candidasa, Dusun Samuh, Desa Bugbug, Candidasa, Kabupaten Karangasem, Bali 80801",puribaguscandidasa.com,"FHPH+FJ Sengkidu, Karangasem Regency, Bali",4.9,84,"https://www.google.com/maps/place/Geringsing+Restaurant/@-8.6568036,114.5904003,9z/data=!4m8!1m2!2m1!1srestaurants+in+Karangasem+Regency,+Bali!3m4!1s0x2dd20955dc3f48a9:0x3318d0be18a7b4aa!8m2!3d-8.5138214!4d115.5790859?hl=id"
1150,RM Rajawali,"Jl. Gn. Rinjani No.11, Semarapura Kelod Kangin, Kec. Klungkung, Kabupaten Klungkung, Bali 80761",,"FC74+X2 Semarapura Kelod Kangin, Klungkung Regency, Bali",4.2,84,"https://www.google.com/maps/place/RM+Rajawali/@-8.6567527,114.5897129,9z/data=!4m9!1m3!2m2!1srestaurants+in+Klungkung+Regency,+Bali!6e5!3m4!1s0x2dd2111521df50cf:0x8bd944fece7d583e!8m2!3d-8.5350394!4d115.4050765?hl=id"
1152,Warung Ida,"warung ida, tabola,, Telaga Tawang, Sidemen, Kabupaten Karangasem, Bali 80864",,"GCGR+CC Telaga Tawang, Karangasem Regency, Bali",4.4,85,"https://www.google.com/maps/place/Warung+Ida/@-8.5076567,115.3426894,12z/data=!4m9!1m3!2m2!1srestaurants+in+Bangli+Regency,+Bali!6e5!3m4!1s0x2dd2107635b6618b:0xddaba7c098158575!8m2!3d-8.4739398!4d115.4410435?hl=id"
1154,Mangrove Beach Club,"jl. pantai jungutbatu, Nusa Lembongan, Jungutbatu, Nusapenida, Klungkung Regency, Bali 87500",balibta.com,"8FP6+48 Jungutbatu, Klungkung Regency, Bali",3.9,85,"https://www.google.com/maps/place/Mangrove+Beach+Club/@-8.6567527,114.5897129,9z/data=!4m9!1m3!2m2!1srestaurants+in+Klungkung+Regency,+Bali!6e5!3m4!1s0x2dd26d70718cf2a9:0xcdf5e7b7fd0cd56d!8m2!3d-8.66466!4d115.460857?hl=id"
1156,The Palms Ceningan Hotel Bar and Restaurant,"Jl. Nusa Ceningan, Lembongan, Nusapenida, Kabupaten Klungkung, Bali 80771",thepalmsceningan.com,"7CWQ+3W Lembongan, Klungkung Regency, Bali",4.2,85,"https://www.google.com/maps/place/The+Palms+Ceningan+Hotel+Bar+and+Restaurant/@-8.6567527,114.5897129,9z/data=!4m12!1m3!2m2!1srestaurants+in+Klungkung+Regency,+Bali!6e5!3m7!1s0x2dd26dc5351534dd:0xd95da0b0da1ef459!5m2!4m1!1i2!8m2!3d-8.704832!4d115.43976?hl=id"
1157,The Gallery Nusa Penida,"Jln. Raya Bodong, Klungkun, 80771, Ped, Nusapenida, Klungkung Regency, Bali 80771",,"8GC8+Q8 Ped, Klungkung Regency, Bali",4.3,85,"https://www.google.com/maps/place/The+Gallery+Nusa+Penida/@-8.6567527,114.5897129,9z/data=!4m9!1m3!2m2!1srestaurants+in+Klungkung+Regency,+Bali!6e5!3m4!1s0x2dd272523d8a15e1:0x4adb8cb0f154a5b8!8m2!3d-8.6780833!4d115.5158128?hl=id"
1158,Art Cafe,"Jl. Monkey Forest, Ubud, Kecamatan Ubud, Kabupaten Gianyar, Bali 80571",business.site,"F7P6+F9 Ubud, Gianyar, Bali",4.4,86,"https://www.google.com/maps/place/Art+Cafe/@-8.5137741,114.7005785,9z/data=!4m9!1m3!2m2!1srestaurants+in+Bangli+Regency,+Bali!6e5!3m4!1s0x2dd23d6b44485479:0x88dc5097db5e1361!8m2!3d-8.5137741!4d115.2608812?hl=id"
1159,Warung Igelanca,"Jl. Raya Ubud, Padangtegal Kaja, Ubud, Kecamatan Ubud, Kabupaten Gianyar, Bali 80571",warung-igelanca.business.site,"F7R8+GP Ubud, Gianyar, Bali",4.4,86,"https://www.google.com/maps/place/Warung+Igelanca/@-8.50875,115.196813,12z/data=!4m9!1m3!2m2!1srestaurants+in+Gianyar+Regency,+Bali!6e5!3m4!1s0x2dd23d6a4f8f6ead:0x340357a1de654663!8m2!3d-8.50875!4d115.2668508?hl=id"
1160,Alon Alon Cafe,"Jl. Raya Tegallalang, Tegallalang, Kec. Tegallalang, Kabupaten Gianyar, Bali 80561",alonaloncafe.business.site,"H79H+4F Tegallalang, Gianyar, Bali",3.9,86,"https://www.google.com/maps/place/Alon+Alon+Cafe/@-8.4321752,115.2086117,12z/data=!4m9!1m3!2m2!1srestaurants+in+Gianyar+Regency,+Bali!6e5!3m4!1s0x2dd22277301d6035:0x6a48e5ce875f4a02!8m2!3d-8.4321752!4d115.2786495?hl=id"
1161,Bebek puri suling,"Jalan Raya Goa Gajah, Bedulu, Blahbatuh, Bedulu, Kec. Blahbatuh, Kabupaten Gianyar, Bali 80581",business.site,"F7GQ+P2 Bedulu, Gianyar, Bali",4.2,86,"https://www.google.com/maps/place/Bebek+puri+suling/@-8.657188,115.0118399,11z/data=!4m9!1m3!2m2!1srestaurants+in+Karangasem+Regency,+Bali!6e5!3m4!1s0x2dd217d4cfed92ef:0x5e7ca0a2c10726cb!8m2!3d-8.5231853!4d115.2875369?hl=id"
1162,Candidasa Restaurant,"Jl. Raya Candidasa, Sengkidu, Kec. Manggis, Kabupaten Karangasem, Bali 80851",candidasarestaurantmusicbar.com,"FHR8+MJ Sengkidu, Karangasem Regency, Bali",4.5,86,"https://www.google.com/maps/place/Candidasa+Restaurant/@-8.6568036,114.5904003,9z/data=!4m9!1m3!2m2!1srestaurants+in+Karangasem+Regency,+Bali!6e5!3m4!1s0x2dd20ed495bb8203:0x673c4a9821f6a26e!8m2!3d-8.5083405!4d115.5665779?hl=id"
1163,Prana Dewi Mountain Resort,"Wongaya Gede, Penebel, Wongaya Gede, Penebel, Kabupaten Tabanan, Bali 82113",balipranaresort.com,"J465+CG Wongaya Gede, Tabanan Regency, Bali",4.4,86,"https://www.google.com/maps/place/Prana+Dewi+Mountain+Resort/@-8.3889548,114.9687535,11z/data=!4m12!1m3!2m2!1srestaurants+in+Tabanan+Regency,+Bali!6e5!3m7!1s0x2dd2262ce957830b:0x2daed9c2b2a03064!5m2!4m1!1i2!8m2!3d-8.3889548!4d115.1088292?hl=id"
1165,Pura Jaya Prana,"Kalianget, Seririt, Buleleng Regency, Bali 81152",,"RX26+P6 Kalianget, Buleleng Regency, Bali",4.7,86,"https://www.google.com/maps/place/Pura+Jaya+Prana/@-8.7058183,114.9742483,10z/data=!4m9!1m3!2m2!1sobjek+wisata+di+bali!6e1!3m4!1s0x2dd18323846626c3:0xc1efd3b290a06334!8m2!3d-8.1981984!4d114.9605003?hl=id"
1166,Pura Blanjong,"Jl. Danau Poso Pura Blanjong No.80227, Sanur Kauh, Kec. Denpasar Sel., Kota Denpasar, Bali 80228",,"77V3+MQ Sanur Kauh, Denpasar City, Bali",4.4,86,"https://www.google.com/maps/place/Pura+Blanjong/@-8.5066963,115.0803123,10z/data=!4m9!1m3!2m2!1sobjek+wisata+di+bali!6e1!3m4!1s0x2dd241bc518a9da7:0x8de4253580bcf64a!8m2!3d-8.7058183!4d115.2543997?hl=id"
1168,Objek Wisata Sangeh,"Jl. Brahmana, Sangeh, Kec. Abiansemal, Kabupaten Badung, Bali 80352",bukit-sari-sangeh.com,"G694+9J Sangeh, Badung Regency, Bali",4.5,86,"https://www.google.com/maps/place/Objek+Wisata+Sangeh/@-8.5066963,115.0803123,10z/data=!4m8!1m2!2m1!1sobjek+wisata+di+bali!3m4!1s0x2dd223479e94fb0f:0x5274752bd0620946!8m2!3d-8.4815663!4d115.2065458?hl=id"
1169,Aquaa Bali,"Jl. Raya Kerobokan No.89, Kerobokan Kelod, Kec. Kuta Utara, Kabupaten Badung, Bali 80361",aquaabali.wordpress.com,"85J7+2V Kerobokan Kelod, Badung Regency, Bali",4.9,87,"https://www.google.com/maps/place/Aquaa+Bali/@-8.657239,115.0125274,11z/data=!4m8!1m2!2m1!1srestaurants+in+Badung+Regency,+Bali!3m4!1s0x2dd2478160e0a0ff:0x34356120de8b1490!8m2!3d-8.66993!4d115.164726?hl=id"
1170,Warung Sandat,"Jl. Sandat No.1, Taman Kelod, Kecamatan Ubud, Kabupaten Gianyar, Bali 80571",warungsandat.business.site,"F7R8+MF Ubud, Gianyar, Bali",4.4,87,"https://www.google.com/maps/place/Warung+Sandat/@-8.5082682,115.1961632,12z/data=!4m9!1m3!2m2!1srestaurants+in+Gianyar+Regency,+Bali!6e5!3m4!1s0x2dd23d697cd8f18b:0xa410be5993e499ac!8m2!3d-8.5082682!4d115.266201?hl=id"
1171,Zactie Bar,"Sakti, Nusapenida, Klungkung Regency, Bali 80771",,"7FRG+MH Sakti, Klungkung Regency, Bali",4.3,87,"https://www.google.com/maps/place/Zactie+Bar/@-8.7082582,115.3363856,11z/data=!4m9!1m3!2m2!1srestaurants+in+Klungkung+Regency,+Bali!6e5!3m4!1s0x2dd2737fd0328479:0xe20458e5620a6b81!8m2!3d-8.7082582!4d115.4764613?hl=id"
1172,Lembongan Reef Restaurant & Bar,"Pulau Lembongan, Jungutbatu, Nusapenida, Jungutbatu, Klungkung, Kabupaten Klungkung, Bali 80771",lembonganreef.com,"8CCV+6V Jungutbatu, Klungkung Regency, Bali",4.1,87,"https://www.google.com/maps/place/Lembongan+Reef+Restaurant+%26+Bar/@-8.6567527,114.5897129,9z/data=!4m9!1m3!2m2!1srestaurants+in+Klungkung+Regency,+Bali!6e5!3m4!1s0x2dd26da3e18fde33:0xfa739c011362ea6e!8m2!3d-8.6794656!4d115.4447287?hl=id"
1173,Cinta Coffee Shop Bar and Grill,"Mushroom Bay Lembongan, Jungutbatu, Nusapenida, Kabupaten Klungkung, Bali 80771",business.site,"8C8P+42 Jungutbatu, Klungkung Regency, Bali",4.6,87,"https://www.google.com/maps/place/Cinta+Coffee+Shop+Bar+and+Grill/@-8.6567527,114.5897129,9z/data=!4m9!1m3!2m2!1srestaurants+in+Klungkung+Regency,+Bali!6e5!3m4!1s0x2dd26d008529b953:0x7bdc62deae3f14b3!8m2!3d-8.6846601!4d115.4350945?hl=id"
1174,Kayu Lembongan,"Jl. Jungutbatu, Nusa Lembongan, Nusapenida, Kabupaten Klungkung, Bali 80771",kayulembongan.com,"8CHX+JW Nusapenida, Klungkung Regency, Bali",4.7,87,"https://www.google.com/maps/place/Kayu+Lembongan/@-8.6567527,114.5897129,9z/data=!4m9!1m3!2m2!1srestaurants+in+Klungkung+Regency,+Bali!6e5!3m4!1s0x2dd26d5360a7e6e1:0x23efe3c2958cce8!8m2!3d-8.6709179!4d115.4498215?hl=id"
