,Name,Full_Address,Website,Plus_Code,Rating,Reviews,URL
806,To'ge Restaurant,"Sejahtera, RIMBA Jimbaran BALI by AYANA, Jl. Karang Mas, Jimbaran, South Kuta, Badung Regency, Bali 80364",rimbajimbaran.com,"644Q+HP Jimbaran, Badung Regency, Bali",4.6,47,"https://www.google.com/maps/place/To'ge+Restaurant/@-8.657239,115.0125274,11z/data=!4m9!1m3!2m2!1srestaurants+in+Badung+Regency,+Bali!6e5!3m4!1s0x2dd2451e5d2d7785:0xaf726e43a5de4e11!8m2!3d-8.7935215!4d115.139289?hl=id"
808,Maha Neka,"Banjar Tabola, Telaga Tawang, Sidemen, Kabupaten Karangasem, Bali 80864",,"GCGR+HH Telaga Tawang, Karangasem Regency, Bali",4.8,47,"https://www.google.com/maps/place/Maha+Neka/@-8.657239,115.0125274,9z/data=!4m12!1m3!2m2!1srestaurants+in+Bangli+Regency,+Bali!6e5!3m7!1s0x2dd21077b3cea817:0xbcb6b7c980693f36!5m2!4m1!1i2!8m2!3d-8.4735348!4d115.4414277?hl=id"
809,Warung Pande Vegetarian,"Jl. Raya Babakan Canggu No.49, Canggu, Kec. Kuta Utara, Kabupaten Badung, Bali 80351",business.site,"95C2+9G Canggu, Badung Regency, Bali",4.5,47,"https://www.google.com/maps/place/Warung+Pande+Vegetarian/@-8.657239,115.0125274,11z/data=!4m9!1m3!2m2!1srestaurants+in+Buleleng+Regency,+Bali!6e5!3m4!1s0x2dd238f188553165:0x8ce8ceadb55eb651!8m2!3d-8.6290694!4d115.1513029?hl=id"
810,Cemara Beach,"JL. Cemara Beach, Sanur, Kec. Denpasar Sel., Kota Denpasar, Bali",,"77R5+27 Sanur, Denpasar City, Bali",4.3,47,"https://www.google.com/maps/place/Cemara+Beach/@-8.6703321,115.2031965,13z/data=!4m9!1m3!2m2!1srestaurants+in+Denpasar+Regency,+Bali!6e5!3m4!1s0x2dd24195720e033d:0x34cdd752b9d6d5be!8m2!3d-8.7099235!4d115.2582439?hl=id"
811,Coco Bistro Sanur,"Jl. Setapak, Sanur, Kec. Denpasar Sel., Kota Denpasar, Bali 80228",business.site,"77W7+8M Sanur, Denpasar City, Bali",4.3,47,"https://www.google.com/maps/place/Coco+Bistro+Sanur/@-8.6703321,115.2031965,13z/data=!4m9!1m3!2m2!1srestaurants+in+Denpasar+Regency,+Bali!6e5!3m4!1s0x2dd241c10df6540f:0xc650e66af63d5893!8m2!3d-8.7041489!4d115.2641846?hl=id"
814,Rangkung Camping Ground & Resto,"Serongga, Gianyar, Bali",business.site,"C89X+FF Serongga, Gianyar, Bali",4,47,"https://www.google.com/maps/place/Rangkung+Camping+Ground+%26+Resto/@-8.657188,115.0118399,11z/data=!4m9!1m3!2m2!1srestaurants+in+Karangasem+Regency,+Bali!6e5!3m4!1s0x2dd214474a681683:0x428b18a1d02e2bbf!8m2!3d-8.5812662!4d115.3487095?hl=id"
817,Sky Resto and Bar at Sanctum,"Jl Prapat, Ped, Nusa Penida, Kabupaten Klungkung, Bali 80771",sanctumdiveindonesia.com,"8FGX+X3 Ped, Klungkung Regency, Bali",4.2,47,"https://www.google.com/maps/place/Sky+Resto+and+Bar+at+Sanctum/@-8.6567527,114.5897129,9z/data=!4m9!1m3!2m2!1srestaurants+in+Klungkung+Regency,+Bali!6e5!3m4!1s0x2dd27391b66f78f1:0xfa29e65008883c94!8m2!3d-8.6725837!4d115.4976368?hl=id"
818,Pondok Pekak Library & Learning Centre,"Jl. Monkey Forest, sebelah Timur Lapangan Ubud, Ubud, Kecamatan Ubud, Kabupaten Gianyar, Bali 80571",pondokpekaklibrary.com,"F7Q6+VW Ubud, Gianyar, Bali",4.6,47,"https://www.google.com/maps/place/Pondok+Pekak+Library+%26+Learning+Centre/@-8.5066963,115.0803123,10z/data=!4m9!1m3!2m2!1sobjek+wisata+di+bali!6e1!3m4!1s0x2dd23d6b1874107d:0xf2ea271e968e8e52!8m2!3d-8.510352!4d115.2622879?hl=id"
819,Wisata Kubu Abian Bagus,"Bila, Kubutambahan, Bila, Kubutambahan, Kabupaten Buleleng, Bali 81171",,"V58Q+C7 Bila, Buleleng Regency, Bali",4.5,47,"https://www.google.com/maps/place/Wisata+Kubu+Abian+Bagus/@-8.5066963,115.0803123,10z/data=!4m9!1m3!2m2!1sobjek+wisata+di+bali!6e1!3m4!1s0x2dd191875cd44ec9:0xe7ceb291054b011!8m2!3d-8.1339961!4d115.1881907?hl=id"
820,Bali Sedap,"Jl. Raya Semer No.126, Kerobokan, Kec. Kuta Utara, Kabupaten Badung, Bali 80361",balisedap.business.site,"9526+6W Kerobokan, Badung Regency, Bali",4.2,48,"https://www.google.com/maps/place/Bali+Sedap/@-8.657239,115.0125274,11z/data=!4m9!1m3!2m2!1srestaurants+in+Bangli+Regency,+Bali!6e5!3m4!1s0x2dd2389f27cdadfb:0xe1e50a2f75eb5ddd!8m2!3d-8.6494113!4d115.1623718?hl=id"
821,Pulu Mujung Warung,"Penelokan Main Rd, Central Batur, Kintamani, Bangli Regency, Bali 80652",,"P9C2+VV Central Batur, Bangli Regency, Bali",4.1,48,"https://www.google.com/maps/place/Pulu+Mujung+Warung/@-8.657239,115.0125274,9z/data=!4m8!1m2!2m1!1srestaurants+in+Bangli+Regency,+Bali!3m4!1s0x2dd1f5b52bae2371:0xec148339af2d5f02!8m2!3d-8.2777606!4d115.3521776?hl=id"
822,Rotiboy Singaraja,"Jl. Ngurah Rai No.78, Astina, Kec. Buleleng, Kabupaten Buleleng, Bali 81113",rotiboy.com,"V3PR+RH Astina, Buleleng Regency, Bali",4.5,48,"https://www.google.com/maps/place/Rotiboy+Singaraja/@-8.1128779,114.5311726,9z/data=!4m9!1m3!2m2!1srestaurants+in+Buleleng+Regency,+Bali!6e5!3m4!1s0x2dd19a75db0d0391:0x26b10ae3b6f13fb1!8m2!3d-8.1128779!4d115.0914753?hl=id"
823,"AJI ANOM Vegan Food,Drink & Happy","Jl. Gajah Mada No.85, Banjar Jawa, Kec. Buleleng, Kabupaten Buleleng, Bali 81113",business.site,"V3PV+MG Banjar Jawa, Buleleng Regency, Bali",4.7,48,"https://www.google.com/maps/place/AJI+ANOM+Vegan+Food,Drink+%26+Happy/@-8.113366,114.5335443,9z/data=!4m9!1m3!2m2!1srestaurants+in+Buleleng+Regency,+Bali!6e5!3m4!1s0x2dd19b234608f73b:0x132c21e8d832f2e!8m2!3d-8.113366!4d115.093847?hl=id"
824,Yakama Barito,"Jl. Tukad Barito No.88, Dauh Puri Klod, Kec. Denpasar Bar., Kota Denpasar, Bali 80225",yakama.co.id,"868M+53 Dauh Puri Klod, Denpasar City, Bali",4.3,48,"https://www.google.com/maps/place/Yakama+Barito/@-8.6703321,115.2031965,13z/data=!4m9!1m3!2m2!1srestaurants+in+Denpasar+Regency,+Bali!6e5!3m4!1s0x2dd24160d5eec917:0x8fe22a038c5f9ca9!8m2!3d-8.684514!4d115.2326342?hl=id"
827,Gula Bali,"Jl. Raya Andong No.93, Petulu, Kecamatan Ubud, Kabupaten Gianyar, Bali 80571",,"F7XF+G9 Petulu, Gianyar, Bali",4.5,48,"https://www.google.com/maps/place/Gula+Bali/@-8.501171,115.2033766,12z/data=!4m9!1m3!2m2!1srestaurants+in+Gianyar+Regency,+Bali!6e5!3m4!1s0x2dd23d5ce9e6ecfd:0x93bb504a2afe14c0!8m2!3d-8.501171!4d115.2734144?hl=id"
828,ACK Fried Chicken,"82262, Pekutatan, Jembrana Regency, Bali 82262",,"HRJC+7P Pekutatan, Jembrana Regency, Bali",3.6,48,"https://www.google.com/maps/place/ACK+Fried+Chicken/@-8.6568036,114.5904003,9z/data=!4m9!1m3!2m2!1srestaurants+in+Jembrana+Regency,+Bali!6e5!3m4!1s0x2dd3d410ad0fb7bd:0xb0ab5c5decbb3b83!8m2!3d-8.4192903!4d114.8217513?hl=id"
829,Kelingking Bar and Restaurant,"Dusun / Br, Karang Dawa, Bunga Mekar, Nusapenida, Klungkung Regency, Bali 80771",,"6FWH+G7 Bunga Mekar, Klungkung Regency, Bali",4,48,"https://www.google.com/maps/place/Kelingking+Bar+and+Restaurant/@-8.6567527,114.5897129,9z/data=!4m9!1m3!2m2!1srestaurants+in+Klungkung+Regency,+Bali!6e5!3m4!1s0x2dd271b1565d4a43:0x5f802ee7ccad67ac!8m2!3d-8.7537092!4d115.4782323?hl=id"
830,Agus Shipwreck Bar & Restaurant,"Nusa Lembongan, Jungutbatu, Nusapenida, Klungkung Regency, Bali 80771",agusshipwreck.com,"8CJX+J5 Jungutbatu, Klungkung Regency, Bali",4.6,48,"https://www.google.com/maps/place/Agus+Shipwreck+Bar+%26+Restaurant/@-8.6567527,114.5897129,9z/data=!4m9!1m3!2m2!1srestaurants+in+Klungkung+Regency,+Bali!6e5!3m4!1s0x2dd26d521fb5d761:0xa210013a8b342b8c!8m2!3d-8.6684148!4d115.4479402?hl=id"
831,Rumah Desa Balinese House and Cooking Studio,"Jl. Raya Apuan -Baturiti, Banjar Baru, Desa Baru, Marga, Kabupaten Tabanan, Bali 82181",rumahdesa.com,"J52J+CG Marga, Tabanan Regency, Bali",4.8,48,"https://www.google.com/maps/place/Rumah+Desa+Balinese+House+and+Cooking+Studio/@-8.3988951,115.0411919,11z/data=!4m12!1m3!2m2!1srestaurants+in+Tabanan+Regency,+Bali!6e5!3m7!1s0x2dd224701a2e4d3b:0xfb5a66dfd416681d!5m2!4m1!1i2!8m2!3d-8.3988951!4d115.1812676?hl=id"
832,Warung Nanda Vegetarian,"Jl. Sahadewa, Delod Peken, Kec. Tabanan, Kabupaten Tabanan, Bali 82121",business.site,"F45J+59 Delod Peken, Tabanan Regency, Bali",4.4,48,"https://www.google.com/maps/place/Warung+Nanda+Vegetarian/@-8.6570861,115.010465,11z/data=!4m9!1m3!2m2!1srestaurants+in+Tabanan+Regency,+Bali!6e5!3m4!1s0x2dd23a508a8ded37:0xed8052be329b752b!8m2!3d-8.5421029!4d115.130965?hl=id"
833,Soka Restaurant,"Jalan Nusa Dua Selatan Lot SW 03 Benoa, NUSA DUA, South Kuta, Badung Regency, Bali 80363",restaurants.accor.com,"56VC+7M South Kuta, Badung Regency, Bali",4.2,49,"https://www.google.com/maps/place/Soka+Restaurant/@-8.657239,115.0125274,11z/data=!4m9!1m3!2m2!1srestaurants+in+Badung+Regency,+Bali!6e5!3m4!1s0x2dd24333d0dc4eaf:0x5ac9859959c2bf0!8m2!3d-8.806821!4d115.22175?hl=id"
834,Rumah Makan MUNDUK SARI,"Central Batur, Kintamani, Bangli Regency, Bali 80652",,"P995+MX Central Batur, Bangli Regency, Bali",4.4,49,"https://www.google.com/maps/place/Rumah+Makan+MUNDUK+SARI/@-8.657239,115.0125274,9z/data=!4m9!1m3!2m2!1srestaurants+in+Bangli+Regency,+Bali!6e5!3m4!1s0x2dd1f5cb928ff75f:0xf4202b679dafcd8!8m2!3d-8.2807632!4d115.3599992?hl=id"
835,GUBUK RELAX,"Jl. Surapati No.103, Banyuning, Kec. Buleleng, Kabupaten Buleleng, Bali 81114",,"V3XX+F3 Banyuning, Buleleng Regency, Bali",4.5,49,"https://www.google.com/maps/place/GUBUK+RELAX/@-8.1013086,114.5373866,9z/data=!4m9!1m3!2m2!1srestaurants+in+Buleleng+Regency,+Bali!6e5!3m4!1s0x2dd190a926394ce3:0x7ba82772ffe85e9c!8m2!3d-8.1013086!4d115.0976893?hl=id"
836,Warung Bakso Buk Adik,"Jalan Galuh, Dusun Dauh Pangkung, Desa Pekutatan, Kecamatan Jembrana, Pekutatan, Kec. Pekutatan, Kabupaten Jembrana, Bali 82262",,"HR9H+F2 Pekutatan, Jembrana Regency, Bali",4.4,49,"https://www.google.com/maps/place/Warung+Bakso+Buk+Adik/@-8.6568036,114.5904003,9z/data=!4m8!1m2!2m1!1srestaurants+in+Jembrana+Regency,+Bali!3m4!1s0x2dd3d40bd2e3e9f7:0x66a80e9867573205!8m2!3d-8.4313516!4d114.8275225?hl=id"
837,Wayan Beachfront Restaurant,"tamarind bay, lembongan, Jungutbatu, Nusapenida, lembongan, Bali 80771",kubutamu.com,"8C9Q+88 Jungutbatu, Klungkung Regency, Bali",4,49,"https://www.google.com/maps/place/Wayan+Beachfront+Restaurant/@-8.6567527,114.5897129,9z/data=!4m9!1m3!2m2!1srestaurants+in+Klungkung+Regency,+Bali!6e5!3m4!1s0x2dd26da5856301ff:0xb623341806fbb317!8m2!3d-8.6816456!4d115.438371?hl=id"
838,Billy's Lake View,"Jl. Raya Bedugul, Candikuning, Kec. Baturiti, Kabupaten Tabanan, Bali 82191",billys-lake-view.business.site,"P5F8+C7 Candikuning, Tabanan Regency, Bali",3.3,49,"https://www.google.com/maps/place/Billy's+Lake+View/@-8.2764691,115.0255763,11z/data=!4m9!1m3!2m2!1srestaurants+in+Tabanan+Regency,+Bali!6e5!3m4!1s0x2dd1896cc98c88bf:0x1b3b5a3e142ba97a!8m2!3d-8.2764691!4d115.165652?hl=id"
839,Dukuh Hill,"Unnamed Road, Peninjoan, Tembuku, Kabupaten Bangli, Bali 80671",,"H9QX+RW Peninjoan, Bangli Regency, Bali",4.4,49,"https://www.google.com/maps/place/Dukuh+Hill/@-8.5066963,115.0803123,10z/data=!4m9!1m3!2m2!1sobjek+wisata+di+bali!6e1!3m4!1s0x2dd21beb7c5d13d3:0xce1e40a4a9b50e58!8m2!3d-8.4104375!4d115.3998254?hl=id"
840,BURASSAI TEPPANYAKI RESTAURANT,"Jl. Kunti I No.16S, Seminyak, Kuta, Kabupaten Badung, Bali 80361",business.site,"8569+HJ Seminyak, Badung Regency, Bali",4.4,50,"https://www.google.com/maps/place/BURASSAI+TEPPANYAKI+RESTAURANT/@-8.657239,115.0125274,11z/data=!4m9!1m3!2m2!1srestaurants+in+Badung+Regency,+Bali!6e5!3m4!1s0x2dd24723d9db23ef:0x25da43fa5e426522!8m2!3d-8.688502!4d115.1690297?hl=id"
841,Jay India Bali Canggu,"Pantai Batu Bolong St No.9, Canggu, North Kuta, Badung Regency, Bali 80351",,"943R+XF Canggu, Badung Regency, Bali",4.6,50,"https://www.google.com/maps/place/Jay+India+Bali+Canggu/@-8.657239,115.0125274,11z/data=!4m9!1m3!2m2!1srestaurants+in+Bangli+Regency,+Bali!6e5!3m4!1s0x2dd23952b5025a49:0x12da6f7fe2ecf0c3!8m2!3d-8.645022!4d115.14122?hl=id"
843,Bakery Lovina,"Jl. Seririt- Singaraja, Anturan, Kalibukbuk, Kabupaten Buleleng, Bali 81119",bakery-lovina.com,"R2QJ+W6 Anturan, Buleleng Regency, Bali",4.2,50,"https://www.google.com/maps/place/Bakery+Lovina/@-8.1601426,114.8904303,11z/data=!4m9!1m3!2m2!1srestaurants+in+Buleleng+Regency,+Bali!6e5!3m4!1s0x2dd19b10cd91b0cb:0xfa1b0615424bc553!8m2!3d-8.1601426!4d115.030506?hl=id"
844,Layang Layang at Fairmont Sanur Beach Bali,"Jl. Kusuma Sari No.8, Sanur, Kec. Denpasar Sel., Kota Denpasar, Bali 80227",fairmont.com,"77V7+H5 Sanur, Denpasar City, Bali",4.6,50,"https://www.google.com/maps/place/Layang+Layang+at+Fairmont+Sanur+Beach+Bali/@-8.6703321,115.2031965,13z/data=!4m9!1m3!2m2!1srestaurants+in+Denpasar+Regency,+Bali!6e5!3m4!1s0x2dd241c02fd95307:0x87301d3296a33458!8m2!3d-8.7060819!4d115.2629055?hl=id"
845,Ketupat Restaurant And Villa,"Jl. Dewi Sri, Legian, Kuta, Kabupaten Badung, Bali 80361",,"75WG+J9 Legian, Badung Regency, Bali",4,50,"https://www.google.com/maps/place/Ketupat+Restaurant+And+Villa/@-8.657239,115.0125274,11z/data=!4m12!1m3!2m2!1srestaurants+in+Gianyar+Regency,+Bali!6e5!3m7!1s0x2dd246cf813903b9:0x1bf8ab29fe717f8f!5m2!4m1!1i2!8m2!3d-8.7034044!4d115.175944?hl=id"
846,99 Meals House,"Lembongan island, Jungutbatu, Nusapenida, Kabupaten Klungkung, Bali 80771",,"8CFW+7Q Jungutbatu, Klungkung Regency, Bali",4.1,50,"https://www.google.com/maps/place/99+Meals+House/@-8.6567527,114.5897129,9z/data=!4m9!1m3!2m2!1srestaurants+in+Klungkung+Regency,+Bali!6e5!3m4!1s0x2dd26da10a013c05:0xd2381a493c54607b!8m2!3d-8.6767715!4d115.4468757?hl=id"
847,The Shore Restaurant,"Jl. Raya Nusa Dua Selatan, Benoa, Kec. Kuta Sel., Kabupaten Badung, Bali 80363",hilton.com,"56F9+7X Benoa, Badung Regency, Bali",4.4,51,"https://www.google.com/maps/place/The+Shore+Restaurant/@-8.657239,115.0125274,11z/data=!4m9!1m3!2m2!1srestaurants+in+Badung+Regency,+Bali!6e5!3m4!1s0x2dd2434707cb445d:0x7f7c3e4e34bc7b79!8m2!3d-8.8268159!4d115.2199887?hl=id"
848,Dapur Santai Restaurant,"Courtyard by Marriott Bali Nusa Dua Resort, Benoa, South Kuta, Badung Regency, Bali 80361",marriott.com,"56VF+5Q Benoa, Badung Regency, Bali",4.7,51,"https://www.google.com/maps/place/Dapur+Santai+Restaurant/@-8.657239,115.0125274,11z/data=!4m9!1m3!2m2!1srestaurants+in+Badung+Regency,+Bali!6e5!3m4!1s0x2dd243ccd2f05ec9:0xf2c5c028e1e9e39c!8m2!3d-8.8070172!4d115.2244032?hl=id"
849,Munduk Menir Villas,"Jl. Pure puseh dusun beji, Munduk, Kec. Banjar, Kabupaten Buleleng, Bali 81152",mundukmenirvillas.com,"P3GM+J4 Munduk, Buleleng Regency, Bali",4.6,51,"https://www.google.com/maps/place/Munduk+Menir+Villas/@-8.2733993,114.9426833,11z/data=!4m12!1m3!2m2!1srestaurants+in+Buleleng+Regency,+Bali!6e5!3m7!1s0x2dd18617f47f735b:0x160d4a97d92be2ad!5m2!4m1!1i2!8m2!3d-8.2733993!4d115.082759?hl=id"
850,BreadTalk Teuku Umar,"Jl. Teuku Umar No.175, Dauh Puri Kauh, Kec. Denpasar Bar., Kota Denpasar, Bali 80114",breadtalk-tub.business.site,"86C4+J4 Dauh Puri Kauh, Denpasar City, Bali",4.3,51,"https://www.google.com/maps/place/BreadTalk+Teuku+Umar/@-8.6703321,115.2031965,13z/data=!4m9!1m3!2m2!1srestaurants+in+Denpasar+Regency,+Bali!6e5!3m4!1s0x2dd240c4f4d500cf:0xfceedba8b6da7cbd!8m2!3d-8.678484!4d115.2052667?hl=id"
851,Warung Ombak,"Bunutan, Abang, Karangasem Regency, Bali 80852",,"MM66+H8 Bunutan, Karangasem Regency, Bali",4.1,51,"https://www.google.com/maps/place/Warung+Ombak/@-8.6568036,114.5904003,9z/data=!4m12!1m3!2m2!1srestaurants+in+Karangasem+Regency,+Bali!6e5!3m7!1s0x2dd20080446b9285:0x882c8a6db4db36c7!5m2!4m1!1i2!8m2!3d-8.3385893!4d115.660871?hl=id"
852,AMP beach club,"Toya Pakeh Nusapenida, Penida, Ped, Nusapenida, Kabupaten Klungkung, Bali 80771",ampbeachclub.com,"8FGW+XR Ped, Klungkung Regency, Bali",4.5,51,"https://www.google.com/maps/place/AMP+beach+club/@-8.6567527,114.5897129,9z/data=!4m9!1m3!2m2!1srestaurants+in+Klungkung+Regency,+Bali!6e5!3m4!1s0x2dd2725fd7cf8c21:0x1c08f748df2744e2!8m2!3d-8.672597!4d115.4971?hl=id"
853,Penida beach club,"Ped, Nusapenida, Klungkung Regency, Bali 80771",penida-beachclub.com,"8FGV+J5 Ped, Klungkung Regency, Bali",4.5,51,"https://www.google.com/maps/place/Penida+beach+club/@-8.6567527,114.5897129,9z/data=!4m9!1m3!2m2!1srestaurants+in+Klungkung+Regency,+Bali!6e5!3m4!1s0x2dd273e3ab18451b:0xc0353a658225bf3c!8m2!3d-8.6734047!4d115.4929252?hl=id"
854,warung sushitoo,"Jalan Raya Munggu By Pass Tanah Lot Mengwi Cemagi Mengwi Kabupaten Badung Bali 80351 depan, Cemagi, Mengwi, Badung Regency, Bali 80351",,"94GC+V6 Cemagi, Badung Regency, Bali",4.4,52,"https://www.google.com/maps/place/warung+sushitoo/@-8.6227606,115.0855908,13z/data=!4m9!1m3!2m2!1srestaurants+in+Bangli+Regency,+Bali!6e5!3m4!1s0x2dd239a06bc960a3:0x2ac5451c7106bb9!8m2!3d-8.6227606!4d115.1206097?hl=id"
856,Nonadansa Kitchen & Coffee,"Jl. Danau Poso No.54, Sanur Kauh, Kec. Denpasar Sel., Kota Denpasar, Bali 80228",business.site,"77V3+MF Sanur Kauh, Denpasar City, Bali",4.5,52,"https://www.google.com/maps/place/Nonadansa+Kitchen+%26+Coffee/@-8.6703321,115.2031965,13z/data=!4m9!1m3!2m2!1srestaurants+in+Denpasar+Regency,+Bali!6e5!3m4!1s0x2dd241b31ca6bf5f:0xa71665fac944a240!8m2!3d-8.7058012!4d115.2537495?hl=id"
857,The BAR,"Lembongan island, Jungutbatu, Nusapenida, Klungkung Regency, Bali, Indonesia, Jungutbatu, Nusapenida, Kabupaten Klungkung, Bali 80771",,"8C8M+CM Jungutbatu, Klungkung Regency, Bali",4.4,52,"https://www.google.com/maps/place/The+BAR/@-8.6839637,115.2941356,11z/data=!4m9!1m3!2m2!1srestaurants+in+Klungkung+Regency,+Bali!6e5!3m4!1s0x2dd26dae37c06b37:0x28b4cb7e610199d5!8m2!3d-8.6839637!4d115.4342113?hl=id"
859,Sushi Surf Balian,"Jl. Pantai Balian, Lalanglinggah, Kec. Selemadeg Bar., Kabupaten Tabanan, Bali 82162",,"FXW8+R6 Lalanglinggah, Tabanan Regency, Bali",3.9,52,"https://www.google.com/maps/place/Sushi+Surf+Balian/@-8.6570861,115.010465,11z/data=!4m9!1m3!2m2!1srestaurants+in+Tabanan+Regency,+Bali!6e5!3m4!1s0x2dd22d88f62753a3:0x9e6c3c252b4f7151!8m2!3d-8.5029611!4d114.9655231?hl=id"
860,Kroya Waterfall,"Sambangan, Sukasada, Buleleng Regency, Bali 81161",,"R4F4+WC Sambangan, Buleleng Regency, Bali",4.8,52,"https://www.google.com/maps/place/Kroya+Waterfall/@-8.175232,114.8259452,10z/data=!4m9!1m3!2m2!1sobjek+wisata+di+bali!6e1!3m4!1s0x2dd19002ae53abff:0x1f6b21231afa7e3a!8m2!3d-8.175232!4d115.1060966?hl=id"
861,Bloom Restaurant Seminyak,"Jl. Raya Seminyak No.29, Seminyak, Kuta, Kabupaten Badung, Bali 80361",bloomseminyak.com,"8549+H5 Seminyak, Badung Regency, Bali",4.5,53,"https://www.google.com/maps/place/Bloom+Restaurant+Seminyak/@-8.657239,115.0125274,11z/data=!4m9!1m3!2m2!1srestaurants+in+Badung+Regency,+Bali!6e5!3m4!1s0x2dd24762e7ff0371:0x282cf029827c1ad9!8m2!3d-8.6936175!4d115.1679772?hl=id"
862,Laci Restaurant,"Jl. Munduk Catu No.88X, Canggu, Kec. Kuta Utara, Kabupaten Badung, Bali 80361",,"84WH+5W Canggu, Badung Regency, Bali",4.9,53,"https://www.google.com/maps/place/Laci+Restaurant/@-8.657239,115.0125274,11z/data=!4m9!1m3!2m2!1srestaurants+in+Bangli+Regency,+Bali!6e5!3m4!1s0x2dd23972cf307c19:0x1e5bba92cfff4206!8m2!3d-8.6546239!4d115.1298397?hl=id"
863,ACK Taman Bali,"Jl. Merdeka, Taman Bali, Kec. Bangli, Kabupaten Bangli, Bali 80614",,"G83X+GC Taman Bali, Bangli Regency, Bali",4.5,53,"https://www.google.com/maps/place/ACK+Taman+Bali/@-8.657239,115.0125274,9z/data=!4m9!1m3!2m2!1srestaurants+in+Bangli+Regency,+Bali!6e5!3m4!1s0x2dd2176c7992d9d9:0xd79f2cde0212aefc!8m2!3d-8.496172!4d115.3485763?hl=id"
865,Teras Ubud,"Jl. Hanoman Pengosekan, Ubud, Kecamatan Ubud, Ubud, Bali 80571",plataran.com,"F7H7+R8 Ubud, Gianyar, Bali",4.3,53,"https://www.google.com/maps/place/Teras+Ubud/@-8.520478,115.1932122,12z/data=!4m9!1m3!2m2!1srestaurants+in+Gianyar+Regency,+Bali!6e5!3m4!1s0x2dd23d747f6d93f5:0x7a0395d418a2cc7!8m2!3d-8.520478!4d115.26325?hl=id"
866,Papilas Coffee & Eatery - Gianyar,"Jl. By Pass Dharma Giri, Gianyar, Kec. Gianyar, Kabupaten Gianyar, Bali 87015",papilascoffee.com,"F859+JP Gianyar, Bali",4.5,53,"https://www.google.com/maps/place/Papilas+Coffee+%26+Eatery+-+Gianyar/@-8.5408883,115.2492228,12z/data=!4m9!1m3!2m2!1srestaurants+in+Gianyar+Regency,+Bali!6e5!3m4!1s0x2dd217c7754f94fb:0x486fbf500a0464c8!8m2!3d-8.5408883!4d115.3192606?hl=id"
870,Sushi island,"Jl. Ped - Buyuk, Ped, Nusapenida, Kabupaten Klungkung, Bali 80771",,"8GF5+WX Ped, Klungkung Regency, Bali",4.6,53,"https://www.google.com/maps/place/Sushi+island/@-8.6567527,114.5897129,9z/data=!4m9!1m3!2m2!1srestaurants+in+Klungkung+Regency,+Bali!6e5!3m4!1s0x2dd273624f6808f3:0x19a2abfb20d39633!8m2!3d-8.6751902!4d115.5098854?hl=id"
871,Warung Tasik,"Jl. Singaraja-Amlapura, Les, Tejakula, Kabupaten Buleleng, Bali 81173",business.site,"V999+Q8 Les, Buleleng Regency, Bali",4.1,54,"https://www.google.com/maps/place/Warung+Tasik/@-8.657239,115.0125274,9z/data=!4m9!1m3!2m2!1srestaurants+in+Bangli+Regency,+Bali!6e5!3m4!1s0x2dd1eddb5e6a5dc7:0x9f39aa764cdc9a27!8m2!3d-8.1305264!4d115.3682628?hl=id"
872,Starlight Restaurant,"Dn.Banyualit, Ds.Kalibukbuk, Jl. Starlight, Lovina, Anturan, Kec. Buleleng, Kabupaten Buleleng, Bali 81116",starlight-bali.com,"R2WJ+VW Anturan, Buleleng Regency, Bali",4.1,54,"https://www.google.com/maps/place/Starlight+Restaurant/@-8.152772,114.4720453,9z/data=!4m9!1m3!2m2!1srestaurants+in+Buleleng+Regency,+Bali!6e5!3m4!1s0x2dd19b10d1a67087:0x64b464415d90db44!8m2!3d-8.152772!4d115.032348?hl=id"
874,The Restaurant at The Chedi Club Tanah Gajah,"Tengkulak Kaja, Jl. Raya Goa Gajah, Kemenuh, Kecamatan Ubud, Kabupaten Gianyar, Bali 80571",tanahgajahubud.com,"F7GJ+GV Kemenuh, Gianyar, Bali",4.6,54,"https://www.google.com/maps/place/The+Restaurant+at+The+Chedi+Club+Tanah+Gajah/@-8.5236496,115.2121616,12z/data=!4m9!1m3!2m2!1srestaurants+in+Gianyar+Regency,+Bali!6e5!3m4!1s0x2dd217d4c6c83f11:0xf47d240888abf140!8m2!3d-8.5236496!4d115.2821994?hl=id"
877,K'A Grill,"Jl. Danau Buyan, Mengwi, Kec. Mengwi, Kabupaten Badung, Bali 08361",kagrill.business.site,"F558+7J Mengwi, Badung Regency, Bali",5,55,"https://www.google.com/maps/place/K'A+Grill/@-8.5418486,114.6062024,9z/data=!4m9!1m3!2m2!1srestaurants+in+Bangli+Regency,+Bali!6e5!3m4!1s0x2dd23bf9b7c36d4b:0xbd54bfc7594fdf6!8m2!3d-8.5418486!4d115.1665051?hl=id"
878,Warung Seni,"Tejakula, Buleleng Regency, Bali 81173",,"V9F2+5F Tejakula, Buleleng Regency, Bali",4.6,55,"https://www.google.com/maps/place/Warung+Seni/@-8.657239,115.0125274,9z/data=!4m8!1m2!2m1!1srestaurants+in+Bangli+Regency,+Bali!3m4!1s0x2dd1edb762b1a203:0x7382f9ae1f8e8840!8m2!3d-8.1271097!4d115.3511389?hl=id"
879,Roa Manadonese Food Bali,"Jl. Tukad Gangga No.15x, Renon, Kec. Denpasar Sel., Kota Denpasar, Bali 80226",,"86FH+G8 Renon, Denpasar City, Bali",4.1,55,"https://www.google.com/maps/place/Roa+Manadonese+Food+Bali/@-8.6703321,115.2031965,13z/data=!4m9!1m3!2m2!1srestaurants+in+Denpasar+Regency,+Bali!6e5!3m4!1s0x2dd2419f2efa0def:0x1fd39e7628130104!8m2!3d-8.6761554!4d115.2282545?hl=id"
880,Rumah Makan Padang Ampera Gianyar,"Jl. Dalem Rai No.5, Gianyar, Kec. Gianyar, Kabupaten Gianyar, Bali 80511",amperagianyar.wordpress.com,"F84J+W8 Gianyar, Bali",4.4,55,"https://www.google.com/maps/place/Rumah+Makan+Padang+Ampera+Gianyar/@-8.657188,115.0118399,11z/data=!4m9!1m3!2m2!1srestaurants+in+Karangasem+Regency,+Bali!6e5!3m4!1s0x2dd2166024343f7b:0x539ba5014fbda700!8m2!3d-8.5427499!4d115.3308125?hl=id"
882,Ombak Zero Waste Cafe,"Jungutbatu, Nusapenida, Klungkung Regency, Bali 80771",,"8CMX+57 Jungutbatu, Klungkung Regency, Bali",4.5,55,"https://www.google.com/maps/place/Ombak+Zero+Waste+Cafe/@-8.6567527,114.5897129,9z/data=!4m9!1m3!2m2!1srestaurants+in+Klungkung+Regency,+Bali!6e5!3m4!1s0x2dd26d8ef81d8f97:0xb84252c814387b68!8m2!3d-8.6670537!4d115.4481723?hl=id"
883,Dulang Restaurant,"Kawasan Pariwisata Nusa Dua, Blok Lot S6, Benoa, South Kuta, Badung Regency, Bali 80363",marriott.com,"56QG+2X Benoa, Badung Regency, Bali",4.6,56,"https://www.google.com/maps/place/Dulang+Restaurant/@-8.8123835,115.0873958,11z/data=!4m9!1m3!2m2!1srestaurants+in+Badung+Regency,+Bali!6e5!3m4!1s0x2dd24326de238373:0xd1659221112f941b!8m2!3d-8.8123835!4d115.2274715?hl=id"
884,Warung Nasi Padang Sari Raso,"Jl. Raya Canggu No.101X, Kerobokan, Kec. Kuta Utara, Kabupaten Badung, Bali 80361",,"9535+VJ Kerobokan, Badung Regency, Bali",4.1,56,"https://www.google.com/maps/place/Warung+Nasi+Padang+Sari+Raso/@-8.657239,115.0125274,11z/data=!4m9!1m3!2m2!1srestaurants+in+Bangli+Regency,+Bali!6e5!3m4!1s0x2dd2389a226a6927:0x4b58e0cb117a7097!8m2!3d-8.6453119!4d115.1590455?hl=id"
885,Baturiti Resto Cottage,"Temukus, Banjar, Buleleng Regency, Bali 81152",facebook.com,"RXFW+32 Temukus, Buleleng Regency, Bali",4.4,56,"https://www.google.com/maps/place/Baturiti+Resto+Cottage/@-8.1773098,114.4347265,9z/data=!4m9!1m3!2m2!1srestaurants+in+Buleleng+Regency,+Bali!6e5!3m4!1s0x2dd19cabb91740d5:0xe5fb8daa611e444b!8m2!3d-8.1773098!4d114.9950292?hl=id"
886,Lovina Nachoz Hot Bar n Restaurant,"Jl. AA Pandji Tisna, Kaliasem, Kec. Banjar, Kabupaten Buleleng, Bali 81152",business.site,"R2HC+XR Kaliasem, Buleleng Regency, Bali",4.1,56,"https://www.google.com/maps/place/Lovina+Nachoz+Hot+Bar+n+Restaurant/@-8.170105,114.461811,9z/data=!4m9!1m3!2m2!1srestaurants+in+Buleleng+Regency,+Bali!6e5!3m4!1s0x2dd19b4818b6112d:0xc1e5f6f88408a49a!8m2!3d-8.170105!4d115.0221137?hl=id"
888,KUBU BAKAS,"Unnamed Road, Bakas, Banjarankan, Kabupaten Klungkung, Bali 80752",,"F9G8+XR Bakas, Klungkung Regency, Bali",4.4,56,"https://www.google.com/maps/place/KUBU+BAKAS/@-8.6568036,114.5904003,9z/data=!4m9!1m3!2m2!1srestaurants+in+Karangasem+Regency,+Bali!6e5!3m4!1s0x2dd217381e9f6467:0xdd6615f34ee7055f!8m2!3d-8.5225062!4d115.3670501?hl=id"
891,Bukit Jambul,"Pesaban, Rendang, Karangasem Regency, Bali",,"G99W+VX Pesaban, Karangasem Regency, Bali",4.4,56,"https://www.google.com/maps/place/Bukit+Jambul/@-8.5138464,115.265584,10z/data=!4m9!1m3!2m2!1sobjek+wisata+di+bali!6e1!3m4!1s0x2dd210a15caff747:0xa6f1a9d73f50b716!8m2!3d-8.4802778!4d115.3975?hl=id"
892,Fast and Delicious,"Jl. Tirta Tawar, Ubud, Kec. Tegallalang, Kabupaten Gianyar, Bali 80561",,"G7RF+JP Ubud, Gianyar, Bali",4.6,57,"https://www.google.com/maps/place/Fast+and+Delicious/@-8.4583832,114.7140074,9z/data=!4m9!1m3!2m2!1srestaurants+in+Bangli+Regency,+Bali!6e5!3m4!1s0x2dd223d3397a2ed7:0xe81c1a8f3e395031!8m2!3d-8.4583832!4d115.2743101?hl=id"
893,Secret bay,"Jl. Pantai Balian No.72, Lalanglinggah, Kec. Selemadeg Bar., Kabupaten Tabanan, Bali 82162",gajahminaresort.com,"FXX6+MH Lalanglinggah, Tabanan Regency, Bali",4.4,57,"https://www.google.com/maps/place/Secret+bay/@-8.5008124,114.8213161,11z/data=!4m9!1m3!2m2!1srestaurants+in+Buleleng+Regency,+Bali!6e5!3m4!1s0x2dd22d867793e86b:0x4cd52c6bdfad9b9c!8m2!3d-8.5008124!4d114.9613918?hl=id"
