,Name,Full_Address,Website,Plus_Code,Rating,Reviews,URL
2430,MM Juice Gatot Subroto,"Jl. Gatot Subroto Barat, Ubung, Kec. Denpasar Utara, Kota Denpasar, Bali 80116",mmjuicerestaurant.com,"9662+PH Ubung, Denpasar City, Bali",4.3,393,"https://www.google.com/maps/place/MM+Juice+Gatot+Subroto/@-8.6703321,115.2031965,13z/data=!4m9!1m3!2m2!1srestaurants+in+Denpasar+Regency,+Bali!6e5!3m4!1s0x2dd23f45833153af:0x66cc6f657aa85a56!8m2!3d-8.6382205!4d115.2014458?hl=id"
2432,Sleeping Buddha statue Pupuan Tabanan,"Jl. Pekutatan - Pupuan No.1, Pupuan, Kabupaten Tabanan, Bali 82163",,"M2J9+43 Pupuan, Tabanan Regency, Bali",4.6,393,"https://www.google.com/maps/place/Sleeping+Buddha+statue+Pupuan+Tabanan/@-8.3196905,114.7375353,10z/data=!4m9!1m3!2m2!1sobjek+wisata+di+bali!6e1!3m4!1s0x2dd1873f5aa74e73:0xa6b11316a895bb35!8m2!3d-8.3196905!4d115.0176867?hl=id"
2433,Sungai Seafood Chinese Restaurant,"Jl. Raya Kuta No.333, Tuban, Kuta, Kabupaten Badung, Bali 80361",,"757H+55 Kuta, Badung Regency, Bali",4,395,"https://www.google.com/maps/place/Sungai+Seafood+Chinese+Restaurant/@-8.657239,115.0125274,11z/data=!4m9!1m3!2m2!1srestaurants+in+Badung+Regency,+Bali!6e5!3m4!1s0x2dd246b0074c3887:0xeae02648e8dcfb14!8m2!3d-8.7370381!4d115.1779509?hl=id"
2434,Warung Lesehan Mina Carik,"Jl. Ahmad Yani, Amlapura, Subagan, Kec. Karangasem, Kabupaten Karangasem, Bali 80813",,"GJM6+V6 Subagan, Karangasem Regency, Bali",4.2,395,"https://www.google.com/maps/place/Warung+Lesehan+Mina+Carik/@-8.6568036,114.5904003,9z/data=!4m9!1m3!2m2!1srestaurants+in+Karangasem+Regency,+Bali!6e5!3m4!1s0x2dd2088145b2a3c1:0x5a29062cc17fb62e!8m2!3d-8.465276!4d115.610526?hl=id"
2435,Mason,"Pantai Batu Bolong St No.39a, Canggu, North Kuta, Badung Regency, Bali 80361",masonbali.com,"84WJ+9P Canggu, Badung Regency, Bali",4.4,396,"https://www.google.com/maps/place/Mason/@-8.657239,115.0125274,11z/data=!4m9!1m3!2m2!1srestaurants+in+Bangli+Regency,+Bali!6e5!3m4!1s0x2dd239105a5f6c05:0xd0f22ee258c2bdcd!8m2!3d-8.6540373!4d115.1318627?hl=id"
2438,Kepiting Sukro,"Jl. Imam Bonjol No.442, Pemecutan Klod, Kec. Denpasar Bar., Kota Denpasar, Bali 80119",kepiting-sukro.business.site,"852P+92 Pemecutan Klod, Denpasar City, Bali",4.4,398,"https://www.google.com/maps/place/Kepiting+Sukro/@-8.6990054,115.1500567,13z/data=!4m9!1m3!2m2!1srestaurants+in+Denpasar+Regency,+Bali!6e5!3m4!1s0x2dd246baa30351ff:0x8a8722859e298502!8m2!3d-8.6990054!4d115.1850756?hl=id"
2439,Warung Ongan Asri Ikan Bakar Jimbaran,"Jl. Noja Saraswati, Kesiman Petilan, Kec. Denpasar Tim., Kota Denpasar, Bali 80361",,"968M+7R Kesiman Petilan, Denpasar City, Bali",4.3,399,"https://www.google.com/maps/place/Warung+Ongan+Asri+Ikan+Bakar+Jimbaran/@-8.6703321,115.2031965,13z/data=!4m9!1m3!2m2!1srestaurants+in+Denpasar+Regency,+Bali!6e5!3m4!1s0x2dd23f75d6760c17:0xf970480cc94e129a!8m2!3d-8.6342659!4d115.2345199?hl=id"
2440,Bali Bowls & Smoothies - Nochi,"Jalan Segara Perancak, Tibubeneng, Kuta Utara, Tibubeneng, Kec. Kuta Utara, Kabupaten Badung, Bali",balibowls.com,"84PQ+8R Tibubeneng, Badung Regency, Bali",4.3,400,"https://www.google.com/maps/place/Bali+Bowls+%26+Smoothies+-+Nochi/@-8.657239,115.0125274,11z/data=!4m9!1m3!2m2!1srestaurants+in+Gianyar+Regency,+Bali!6e5!3m4!1s0x2dd24782e9e30afd:0xc37d58a9efd21156!8m2!3d-8.6641803!4d115.1396239?hl=id"
2442,IBU SUSU Bar & Kitchen,"Jl. Monkey Forest, Ubud, Kecamatan Ubud, Kabupaten Gianyar, Bali 80571",ibususu.com,"F7J7+P2 Ubud, Gianyar, Bali",4.6,401,"https://www.google.com/maps/place/IBU+SUSU+Bar+%26+Kitchen/@-8.5181908,115.192497,12z/data=!4m9!1m3!2m2!1srestaurants+in+Gianyar+Regency,+Bali!6e5!3m4!1s0x2dd23d731ce881df:0x95175cd90c2e7b8d!8m2!3d-8.5181908!4d115.2625348?hl=id"
2443,Lacalita Bar y Cocina,"Pantai Batu Bolong St No.68, Canggu, North Kuta, Badung Regency, Bali 80361",lacalongtime.com,"84VJ+PJ Canggu, Badung Regency, Bali",4.2,402,"https://www.google.com/maps/place/Lacalita+Bar+y+Cocina/@-8.657239,115.0125274,11z/data=!4m9!1m3!2m2!1srestaurants+in+Bangli+Regency,+Bali!6e5!3m4!1s0x2dd2387952389a3d:0x64b18aa8c2c58fc4!8m2!3d-8.655696!4d115.131583?hl=id"
2445,Made's Warung Berawa,"Berawa, denpasar, Jl. Subak Sari 13 No.8, Tibubeneng, Kec. Kuta Utara, Kabupaten Badung, Bali 80361",thejoglo.com,"84PV+3X Tibubeneng, Badung Regency, Bali",4.4,402,"https://www.google.com/maps/place/Made's+Warung+Berawa/@-8.664875,115.1099691,13z/data=!4m9!1m3!2m2!1srestaurants+in+Denpasar+Regency,+Bali!6e5!3m4!1s0x2dd24779d0c66f73:0x3d5732a667e8cb7b!8m2!3d-8.664875!4d115.144988?hl=id"
2446,"Mangrove Denpasar, Last Point","Pemogan, Denpasar Selatan, Denpasar City, Bali 80361",,"75FV+H8 Pemogan, Denpasar City, Bali",4.2,402,"https://www.google.com/maps/place/Mangrove+Denpasar,+Last+Point/@-8.5066963,115.0803123,10z/data=!4m9!1m3!2m2!1sobjek+wisata+di+bali!6e1!3m4!1s0x2dd243fdc8691c31:0x421c1429a91194b8!8m2!3d-8.7261185!4d115.1933509?hl=id"
2447,Deliziosa Coffee Pizza & Pasta,"Jalan Popies II No.47, Kuta, Badung Regency, Bali 80361",business.site,"75MF+33 Kuta, Badung Regency, Bali",4.5,404,"https://www.google.com/maps/place/Deliziosa+Coffee+Pizza+%26+Pasta/@-8.657239,115.0125274,11z/data=!4m9!1m3!2m2!1srestaurants+in+Badung+Regency,+Bali!6e5!3m4!1s0x2dd246b93e3e6691:0x208d07fec479e0a!8m2!3d-8.7173205!4d115.1726925?hl=id"
2448,Madu Sari Hotel & Restaurant,"Penelokan Main Rd, Central Batur, Kintamani, Bangli Regency, Bali 80652",balimadusari.com,"P8FX+MV Central Batur, Bangli Regency, Bali",3.9,404,"https://www.google.com/maps/place/Madu+Sari+Hotel+%26+Restaurant/@-8.657239,115.0125274,9z/data=!4m11!1m2!2m1!1srestaurants+in+Bangli+Regency,+Bali!3m7!1s0x2dd1f44c0466d7b3:0x4d1182e2fbe6d983!5m2!4m1!1i2!8m2!3d-8.275823!4d115.3497216?hl=id"
2449,"Puri Lumbung Cottages, Restaurant & Spa - Munduk Village","Dinas Taman, Jalan Raya, Desa, Munduk, Kec. Banjar, Kabupaten Buleleng, Bali 81152",purilumbung.com,"P3P6+53 Munduk, Buleleng Regency, Bali",4.4,404,"https://www.google.com/maps/place/Puri+Lumbung+Cottages,+Restaurant+%26+Spa+-+Munduk+Village/@-8.264618,114.9200722,11z/data=!4m12!1m3!2m2!1srestaurants+in+Buleleng+Regency,+Bali!6e5!3m7!1s0x2dd186713cbe9975:0x8293fe33dde4568!5m2!4m1!1i2!8m2!3d-8.264618!4d115.0601479?hl=id"
2450,Munduk asri,"Jl. Raya Payangan, Kerta, Payangan, Kabupaten Gianyar, Bali 80572",,"M76H+2X Kerta, Gianyar, Bali",4.3,404,"https://www.google.com/maps/place/Munduk+asri/@-8.5066963,115.0803123,10z/data=!4m9!1m3!2m2!1sobjek+wisata+di+bali!6e1!3m4!1s0x2dd2201f0020640b:0x6f5797d152d72578!8m2!3d-8.3399086!4d115.2799045?hl=id"
2451,Tamarind Mediterranean Restaurant,"Nusa Dua Beach Hotel & Spa Kawasan Pariwisata Nusa Dua North 4, Benoa, Kec. Kuta Sel., Kabupaten Badung, Bali 80361",nusaduahotel.com,"664J+FP Benoa, Badung Regency, Bali",4.3,405,"https://www.google.com/maps/place/Tamarind+Mediterranean+Restaurant/@-8.7937935,115.0917864,11z/data=!4m9!1m3!2m2!1srestaurants+in+Badung+Regency,+Bali!6e5!3m4!1s0x2dd243219d3885af:0xbe6bf8f9f5beea65!8m2!3d-8.7937935!4d115.2318621?hl=id"
2452,Bowl Kitchen,"Jl. Gatot Subroto Barat No.88, Dangin Puri Kaja, Kec. Denpasar Utara, Kota Denpasar, Bali 80234",,"9679+JW Dangin Puri Kaja, Denpasar City, Bali",4.4,406,"https://www.google.com/maps/place/Bowl+Kitchen/@-8.6703321,115.2031965,13z/data=!4m9!1m3!2m2!1srestaurants+in+Denpasar+Regency,+Bali!6e5!3m4!1s0x2dd23f6ec08190bb:0xa6dc5ddc276f0c2b!8m2!3d-8.6359818!4d115.2198064?hl=id"
2454,Tsavo Lion Restaurant,"Serongga, Gianyar, Bali 80515",balisafarimarinepark.com,"C8CV+9W Serongga, Gianyar, Bali",4.4,406,"https://www.google.com/maps/place/Tsavo+Lion+Restaurant/@-8.579047,115.2747202,12z/data=!4m9!1m3!2m2!1srestaurants+in+Gianyar+Regency,+Bali!6e5!3m4!1s0x2dd2143841c364b3:0xcf9dd3f437271bd0!8m2!3d-8.579047!4d115.344758?hl=id"
2457,"Tebasari Resto, Bar & Lounge","Jl. Raya Tegallalang, Tegallalang, Kec. Tegallalang, Kabupaten Gianyar, Bali 80561",tebasari.com,"H75J+95 Tegallalang, Gianyar, Bali",4.3,407,"https://www.google.com/maps/place/Tebasari+Resto,+Bar+%26+Lounge/@-8.4415091,115.140329,11z/data=!4m9!1m3!2m2!1srestaurants+in+Badung+Regency,+Bali!6e5!3m4!1s0x2dd223450e70abe7:0xde95d6567688bd58!8m2!3d-8.4415091!4d115.2804047?hl=id"
2458,Teh Manis Bali,"Batu Mejan Street, Canggu, North Kuta, Badung Regency, Bali 80361",,"84WG+RX Canggu, Badung Regency, Bali",4.4,407,"https://www.google.com/maps/place/Teh+Manis+Bali/@-8.657239,115.0125274,11z/data=!4m9!1m3!2m2!1srestaurants+in+Buleleng+Regency,+Bali!6e5!3m4!1s0x2dd2397b7af069a9:0x65440695f3077c70!8m2!3d-8.6529483!4d115.1274974?hl=id"
2464,Beji Temple,"Jl. Raya Sangsit, Sangsit, Sawan, Kabupaten Buleleng, Bali 81171",balitravelhub.com,"W48M+GM Sangsit, Buleleng Regency, Bali",4.6,409,"https://www.google.com/maps/place/Beji+Temple/@-8.5066963,115.0803123,10z/data=!4m9!1m3!2m2!1sobjek+wisata+di+bali!6e1!3m4!1s0x2dd1972ee69dc055:0x7dc5a808cdcbdca4!8m2!3d-8.0836764!4d115.1342333?hl=id"
2465,Usha Cafe&Bakery,"No., Jl. Raya Pengosekan No.2013, MAS, Ubud, Gianyar, Bali 80571",,"F787+JF MAS, Gianyar, Bali",4.4,410,"https://www.google.com/maps/place/Usha+Cafe%26Bakery/@-8.657137,115.0111525,11z/data=!4m9!1m3!2m2!1srestaurants+in+Klungkung+Regency,+Bali!6e5!3m4!1s0x2dd23d99af76f8fd:0xb7b0bc79549bf34c!8m2!3d-8.5334611!4d115.2636951?hl=id"
2466,La Pacha Mama Ubud,"Jl. Penestanan Kelod No.1, Sayan, Kecamatan Ubud, Kabupaten Gianyar, Bali 80571",,"F7V3+CG Sayan, Gianyar, Bali",4.4,411,"https://www.google.com/maps/place/La+Pacha+Mama+Ubud/@-8.5063993,115.1137812,11z/data=!4m9!1m3!2m2!1srestaurants+in+Tabanan+Regency,+Bali!6e5!3m4!1s0x2dd23d16063f154d:0x23775e1233bdedc8!8m2!3d-8.5063993!4d115.2538569?hl=id"
2467,Billys Bar & Restaurant,"Jl. Sahadewa No.8, Legian, Kuta, Kabupaten Badung, Bali 80361",,"75R9+WQ Legian, Badung Regency, Bali",4.4,412,"https://www.google.com/maps/place/Billys+Bar+%26+Restaurant/@-8.707669,115.1343591,13z/data=!4m9!1m3!2m2!1srestaurants+in+Denpasar+Regency,+Bali!6e5!3m4!1s0x2dd246c3c09f0fe9:0xc9ddd3e43213d36a!8m2!3d-8.707669!4d115.169378?hl=id"
2468,Finns VIP Beach Club,"Jalan Pantai Berawa No: 5, Tibubeneng, North Kuta, Badung Regency, Bali 80361",vipbeachclubbali.com,"84MQ+FM Tibubeneng, Badung Regency, Bali",4.5,415,"https://www.google.com/maps/place/Finns+VIP+Beach+Club/@-8.666359,115.1042291,13z/data=!4m9!1m3!2m2!1srestaurants+in+Buleleng+Regency,+Bali!6e5!3m4!1s0x2dd2471ae04a080b:0xb6a11f9344bcffc0!8m2!3d-8.666359!4d115.139248?hl=id"
2470,Warung Sri,"Jl. Wijaya Kusuma, Baler Bale Agung, Kec. Negara, Kabupaten Jembrana, Bali 82218",business.site,"JJVC+9J Baler Bale Agung, Jembrana Regency, Bali",4.2,415,"https://www.google.com/maps/place/Warung+Sri/@-8.6568036,114.5904003,9z/data=!4m8!1m2!2m1!1srestaurants+in+Jembrana+Regency,+Bali!3m4!1s0x2dd1621d2d9968fd:0x75bda2483bea385b!8m2!3d-8.3565238!4d114.6215515?hl=id"
2471,Kampung Cafe at the Kampung Resort Ubud,"Jl. Ceking, Tegalalang, Ubud, Tegallalang, Kec. Gianyar, Kabupaten Gianyar, Bali 80561",thekampungresortubud.com,"H76J+V3 Tegallalang, Gianyar, Bali",4.5,417,"https://www.google.com/maps/place/Kampung+Cafe+at+the+Kampung+Resort+Ubud/@-8.4377608,114.7198448,9z/data=!4m9!1m3!2m2!1srestaurants+in+Bangli+Regency,+Bali!6e5!3m4!1s0x2dd218abc7b1318d:0xf0aff3fd497e9e58!8m2!3d-8.4377608!4d115.2801475?hl=id"
2473,Gypsy Kitchen+Bar,"Jalan Pura Batu Mejan, Gg. Munduk Catu No 1 Echo Beach Canggu, Canggu, Kec. Kuta Utara, Kabupaten Badung, Bali 80351",wearegypsy.com,"84WJ+QC Canggu, Badung Regency, Bali",4.4,418,"https://www.google.com/maps/place/Gypsy+Kitchen%2BBar/@-8.657239,115.0125274,11z/data=!4m9!1m3!2m2!1srestaurants+in+Bangli+Regency,+Bali!6e5!3m4!1s0x2dd23879c9e92c7f:0xd776df01a71ec258!8m2!3d-8.653026!4d115.131035?hl=id"
2475,Ubud Coffee Roastery,"Jl. Goutama Sel., Ubud, Kecamatan Ubud, Kabupaten Gianyar, Bali 80571",ubudcoffeeroastery.com,"F7Q7+CG Ubud, Gianyar, Bali",4.8,419,"https://www.google.com/maps/place/Ubud+Coffee+Roastery/@-8.511464,115.1237683,11z/data=!4m9!1m3!2m2!1srestaurants+in+Gianyar+Regency,+Bali!6e5!3m4!1s0x2dd23d6c429fa0b1:0x37efc0bb2c1e35d2!8m2!3d-8.511464!4d115.263844?hl=id"
2476,Strawberry Hill Hotel And Restaurant,"Jl. Raya Denpasar-Singaraja Km. 48, Jl. Raya Bedugul, Batunya, Kec. Baturiti, Kabupaten Tabanan, Bali 82191",strawberryhillbali.com,"P579+GJ Batunya, Tabanan Regency, Bali",4.2,419,"https://www.google.com/maps/place/Strawberry+Hill+Hotel+And+Restaurant/@-8.2862399,115.0289734,11z/data=!4m12!1m3!2m2!1srestaurants+in+Tabanan+Regency,+Bali!6e5!3m7!1s0x2dd189744284c44d:0x34a71a8a5e13b26d!5m2!4m1!1i2!8m2!3d-8.2862399!4d115.1690491?hl=id"
2477,"Matahari Tulamben Resort, Dive & Spa, Bali","Jl. Kubu-Abang, Tulamben, Kubu, Karangasem Regency, Bali 80853",divetulamben.com,"PHCV+RM Tulamben, Karangasem Regency, Bali",4.3,420,"https://www.google.com/maps/place/Matahari+Tulamben+Resort,+Dive+%26+Spa,+Bali/@-8.6568036,114.5904003,9z/data=!4m12!1m3!2m2!1srestaurants+in+Karangasem+Regency,+Bali!6e5!3m7!1s0x2dd1ff15b0e03a13:0x7b7a2456a90f29c2!5m2!4m1!1i2!8m2!3d-8.277958!4d115.594193?hl=id"
2478,NGERODOK RESTO,"Jl. Mulawarman No.132A, Abianbase, Kec. Gianyar, Kabupaten Gianyar, Bali 80515",ngerodok-resto.business.site,"C8WG+RQ Abianbase, Gianyar, Bali",4.2,421,"https://www.google.com/maps/place/NGERODOK+RESTO/@-8.657188,115.0118399,11z/data=!4m9!1m3!2m2!1srestaurants+in+Karangasem+Regency,+Bali!6e5!3m4!1s0x2dd2167cec78d163:0xedc8bb4db6aae0e3!8m2!3d-8.5529027!4d115.3269343?hl=id"
2480,Ceningan Cliffs,"Lembongan Nusapenida, Lembongan, Klungkung, Kabupaten Klungkung, Bali 80771",,"8F36+C4 Lembongan, Klungkung Regency, Bali",4.6,421,"https://www.google.com/maps/place/Ceningan+Cliffs/@-8.6567527,114.5897129,9z/data=!4m9!1m3!2m2!1srestaurants+in+Klungkung+Regency,+Bali!6e5!3m4!1s0x2dd26ded90a60e47:0x9d5ffc55178b323e!8m2!3d-8.6964965!4d115.4603276?hl=id"
2481,Alam Sambangan - The Secret Valley Club,"Jl. Raya Desa Sambangan, Sambangan, Kec. Sukasada, Kabupaten Buleleng, Bali 81161",alam-amazing-adventures.com,"R4J3+7M Sambangan, Buleleng Regency, Bali",4.2,422,"https://www.google.com/maps/place/Alam+Sambangan+-+The+Secret+Valley+Club/@-8.1692994,114.5438752,9z/data=!4m9!1m3!2m2!1srestaurants+in+Buleleng+Regency,+Bali!6e5!3m4!1s0x2dd246c6a480acf5:0xc67e9c85aadb10f0!8m2!3d-8.1692994!4d115.1041779?hl=id"
2482,Mujair Nyat Nyat Pung Green Sempidi,"Jalan Raya Sempidi No.26, Banjar Uma Gunung, Kwanji, Sempidi, Badung, Kabupaten Badung, Bali 80351",ikanmujairnyatnyatkhasdanaubatur.blogspot.com,"95RJ+6C Sempidi, Badung Regency, Bali",4.3,423,"https://www.google.com/maps/place/Mujair+Nyat+Nyat+Pung+Green+Sempidi/@-8.657239,115.0125274,11z/data=!4m9!1m3!2m2!1srestaurants+in+Bangli+Regency,+Bali!6e5!3m4!1s0x2dd23929a7660617:0xbe84b41eecfbf2!8m2!3d-8.609491!4d115.18102?hl=id"
2483,Ranggon Sunset,"Pemaron, Buleleng, Buleleng Regency, Bali 81119",ranggonsunset.com,"V3G7+HF Pemaron, Buleleng Regency, Bali",4.2,423,"https://www.google.com/maps/place/Ranggon+Sunset/@-8.1235045,114.5033393,9z/data=!4m9!1m3!2m2!1srestaurants+in+Buleleng+Regency,+Bali!6e5!3m4!1s0x2dd19a4488618c11:0xbec46356d7eeb543!8m2!3d-8.1235045!4d115.063642?hl=id"
2485,"AKUA de Bilbao Spanish Tapas, Restaurant","Jl. Pemelisan Agung Pantai No.27, Jimbaran, Kec. Kuta Sel., Kabupaten Badung, Bali 80361",akuabali.com,"65J9+3P Jimbaran, Badung Regency, Bali",4.6,428,"https://www.google.com/maps/place/AKUA+de+Bilbao+Spanish+Tapas,+Restaurant/@-8.657239,115.0125274,11z/data=!4m9!1m3!2m2!1srestaurants+in+Badung+Regency,+Bali!6e5!3m4!1s0x2dd24466cbeb8aa5:0x50c07ffeb3c28003!8m2!3d-8.7698156!4d115.1693169?hl=id"
2487,Kayumanis Resto Jimbaran,"Jl. Yoga Perkanthi, Jimbaran, Kec. Kuta Sel., Kabupaten Badung, Bali 80361",kayumanis.com,"65GC+V5 Jimbaran, Badung Regency, Bali",4.8,428,"https://www.google.com/maps/place/Kayumanis+Resto+Jimbaran/@-8.657239,115.0125274,11z/data=!4m9!1m3!2m2!1srestaurants+in+Gianyar+Regency,+Bali!6e5!3m4!1s0x2dd24461854df96b:0x1bb5e3950c36572b!8m2!3d-8.7727585!4d115.17041?hl=id"
2490,Babi Guling Depot Betty,"Jalan Mekarsari - Baturiti Bedugul, Luwus, Baturiti, Luwus, Kec. Baturiti, Kabupaten Tabanan, Bali 82191",,"H5RW+5X Luwus, Tabanan Regency, Bali",4.3,428,"https://www.google.com/maps/place/Babi+Guling+Depot+Betty/@-8.4095456,115.0573683,11z/data=!4m9!1m3!2m2!1srestaurants+in+Tabanan+Regency,+Bali!6e5!3m4!1s0x2dd223fd830d7067:0x6fa67edfc9916eaa!8m2!3d-8.4095456!4d115.197444?hl=id"
2491,Cengkih Jintens Resto - Denpasar,"Jl. Prof. Moh. Yamin No.99, Sumerta Kelod, Kec. Denpasar Tim., Kota Denpasar, Bali 80239",,"86JQ+GG Sumerta Kelod, Denpasar City, Bali",4.3,429,"https://www.google.com/maps/place/Cengkih+Jintens+Resto+-+Denpasar/@-8.6703321,115.2031965,13z/data=!4m9!1m3!2m2!1srestaurants+in+Denpasar+Regency,+Bali!6e5!3m4!1s0x2dd2406078652af5:0x98eec8f40128e337!8m2!3d-8.6686702!4d115.2388206?hl=id"
2492,Nusa Dua Beach Grill,"Jalan Pura Geger Sawangan, Jl. Raya Nusa Dua Selatan, Benoa, Kec. Kuta Sel., Kabupaten Badung, Bali 80363",nusaduabeachgrill.com,"56JF+VH Benoa, Badung Regency, Bali",4.3,430,"https://www.google.com/maps/place/Nusa+Dua+Beach+Grill/@-8.657239,115.0125274,11z/data=!4m9!1m3!2m2!1srestaurants+in+Badung+Regency,+Bali!6e5!3m4!1s0x2e6a1e3b8b0e7805:0xdbab87a4239c91!8m2!3d-8.817847!4d115.2239271?hl=id"
2493,Zibiru Restaurant,"Jl. Drupadi No.7, Seminyak, Kuta, Kabupaten Badung, Bali 80361",zibiru.com,"8577+WR Seminyak, Badung Regency, Bali",4.4,430,"https://www.google.com/maps/place/Zibiru+Restaurant/@-8.657239,115.0125274,11z/data=!4m9!1m3!2m2!1srestaurants+in+Badung+Regency,+Bali!6e5!3m4!1s0x2dd247188332a72d:0x7397d7930f295590!8m2!3d-8.6851817!4d115.1645996?hl=id"
2496,Sambal Matah Restaurant,"Jl. Goutama Sel. No.5, Ubud, Kecamatan Ubud, Kabupaten Gianyar, Bali 80571",,"F7R7+JQ Ubud, Gianyar, Bali",4.3,431,"https://www.google.com/maps/place/Sambal+Matah+Restaurant/@-8.5084979,114.7040866,9z/data=!4m9!1m3!2m2!1srestaurants+in+Gianyar+Regency,+Bali!6e5!3m4!1s0x2dd23d6bbf81ad5d:0xe09200d0f214ab6d!8m2!3d-8.5084979!4d115.2643893?hl=id"
2498,Kedaton Restaurant,"Jl. Raya Kuta No.62/3, Kuta, Kabupaten Badung, Bali 80361",business.site,"75MJ+29 Kuta, Badung Regency, Bali",4.2,432,"https://www.google.com/maps/place/Kedaton+Restaurant/@-8.7173881,115.1458845,13z/data=!4m9!1m3!2m2!1srestaurants+in+Gianyar+Regency,+Bali!6e5!3m4!1s0x2dd246b6c44652e1:0xa0b70b4ea2a75338!8m2!3d-8.7173881!4d115.1809034?hl=id"
2499,Mudra Cafe,"Jl. Goutama Sel. No.22, Ubud, Kecamatan Ubud, Kabupaten Gianyar, Bali 80571",mudrabali.com,"F7Q7+JH Ubud, Gianyar, Bali",4.4,433,"https://www.google.com/maps/place/Mudra+Cafe/@-8.5109234,115.1238079,11z/data=!4m9!1m3!2m2!1srestaurants+in+Gianyar+Regency,+Bali!6e5!3m4!1s0x2dd23d6c6fd99f59:0xd7b73811a6a037f1!8m2!3d-8.5109234!4d115.2638836?hl=id"
2500,Ginger & Jamu,"Jungutbatu, Nusapenida, Klungkung Regency, Bali 80771",facebook.com,"8CJX+C5 Jungutbatu, Klungkung Regency, Bali",4.6,433,"https://www.google.com/maps/place/Ginger+%26+Jamu/@-8.6567527,114.5897129,9z/data=!4m9!1m3!2m2!1srestaurants+in+Klungkung+Regency,+Bali!6e5!3m4!1s0x2dd26d9955555555:0x5c67e53714fe2a5d!8m2!3d-8.6689789!4d115.447963?hl=id"
2501,Mahagiri Panoramic Resort & Restaurant,"Jl. Surya Indah, Desa Rendang, Kec. Rendang, Rendang, Karangasem, Kabupaten Karangasem, Bali 80863",,"HCGH+M7 Rendang, Karangasem Regency, Bali",4.1,435,"https://www.google.com/maps/place/Mahagiri+Panoramic+Resort+%26+Restaurant/@-8.657239,115.0125274,9z/data=!4m12!1m3!2m2!1srestaurants+in+Bangli+Regency,+Bali!6e5!3m7!1s0x2dd21b087af14de9:0x6b4e4379e63423dd!5m2!4m1!1i2!8m2!3d-8.4232606!4d115.4281999?hl=id"
2503,Delicioso Bistro & Restaurant,"Jl. Raya Semer No.168, Kerobokan Kelod, Kec. Kuta Utara, Kabupaten Badung, Bali 80361",deliciosobali.com,"85R7+M3 Kerobokan Kelod, Badung Regency, Bali",4.4,436,"https://www.google.com/maps/place/Delicioso+Bistro+%26+Restaurant/@-8.657239,115.0125274,11z/data=!4m9!1m3!2m2!1srestaurants+in+Badung+Regency,+Bali!6e5!3m4!1s0x2dd24760d0dfc663:0x62bee9b78e7cf011!8m2!3d-8.6583256!4d115.1626316?hl=id"
2506,Kintamani Coffee - By A K A S A,"Penelokan Main Rd No.777, Central Batur, Kintamani, Bangli Regency, Bali 80652",,"P9C5+53 Central Batur, Bangli Regency, Bali",4.6,437,"https://www.google.com/maps/place/Kintamani+Coffee+-+By+A+K+A+S+A/@-8.657239,115.0125274,9z/data=!4m9!1m3!2m2!1srestaurants+in+Bangli+Regency,+Bali!6e5!3m4!1s0x2dd1f5e1984fef6b:0xa5be2accdf6b4ba8!8m2!3d-8.2796213!4d115.3576378?hl=id"
2507,Warung Makan Teges,"Jalan Cok Rai Pudak,Peliatan,Ubud,Kabupaten Gianyar,Bali 80571, Peliatan, Kecamatan Ubud, Kabupaten Gianyar, Bali 80571",,"F7FC+CF Peliatan, Gianyar, Bali",4.5,437,"https://www.google.com/maps/place/Warung+Makan+Teges/@-8.5264244,115.2011025,12z/data=!4m9!1m3!2m2!1srestaurants+in+Gianyar+Regency,+Bali!6e5!3m4!1s0x2dd23d9d37a10e9b:0x9bb2bba618ff1bd0!8m2!3d-8.5264244!4d115.2711403?hl=id"
2508,oishii bar & grill,"Lembongan, Nusapenida, Klungkung Regency, Bali 80771",,"8C7J+M7 Lembongan, Klungkung Regency, Bali",4.4,438,"https://www.google.com/maps/place/oishii+bar+%26+grill/@-8.6567527,114.5897129,9z/data=!4m9!1m3!2m2!1srestaurants+in+Klungkung+Regency,+Bali!6e5!3m4!1s0x2dd26db20cdf8c55:0x7454a0bd20cf456e!8m2!3d-8.6858507!4d115.4307106?hl=id"
2509,Oka's Bakery,"Pantai Batu Bolong St No.27A, Canggu, North Kuta, Badung Regency, Bali 80361",,"943R+63 Canggu, Badung Regency, Bali",4.1,441,"https://www.google.com/maps/place/Oka's+Bakery/@-8.657239,115.0125274,11z/data=!4m9!1m3!2m2!1srestaurants+in+Bangli+Regency,+Bali!6e5!3m4!1s0x2dd2387d6d891505:0x7472ff58be3a42da!8m2!3d-8.6468946!4d115.1402421?hl=id"
2513,Uno Ristorante Italiano,"Jalan Raya Ubud, Ubud, Kecamatan Ubud, Kabupaten Gianyar, Bali 80571",,"F7V6+9G Ubud, Gianyar, Bali",3.8,441,"https://www.google.com/maps/place/Uno+Ristorante+Italiano/@-8.657137,115.0111525,11z/data=!4m9!1m3!2m2!1srestaurants+in+Klungkung+Regency,+Bali!6e5!3m4!1s0x2dd23d6abe4d1691:0xe1d9e653d019c8f4!8m2!3d-8.5065241!4d115.2613422?hl=id"
2514,Hengky Resto,"Jl. Sekar Tunjung No.19, Kesiman Kertalangu, Kec. Denpasar Tim., Kota Denpasar, Bali 80237",facebook.com,"967X+2V Kesiman Kertalangu, Denpasar City, Bali",4.3,442,"https://www.google.com/maps/place/Hengky+Resto/@-8.6703321,115.2031965,13z/data=!4m9!1m3!2m2!1srestaurants+in+Denpasar+Regency,+Bali!6e5!3m4!1s0x2dd23f9d0d5c4003:0xab74d905022c283c!8m2!3d-8.6374195!4d115.2497009?hl=id"
2515,Dewi Sinta Restaurant,"Jl. Tanah Lot, Beraban, Kec. Kediri, Kabupaten Tabanan, Bali 82121",,"93JQ+J8 Beraban, Tabanan Regency, Bali",4.1,443,"https://www.google.com/maps/place/Dewi+Sinta+Restaurant/@-8.657239,115.0125274,11z/data=!4m9!1m3!2m2!1srestaurants+in+Buleleng+Regency,+Bali!6e5!3m4!1s0x2dd237821de23db1:0xa4fbd5d529531f7e!8m2!3d-8.6184104!4d115.0883291?hl=id"
2519,Warung Siam Ubud,"Jl. Goutama Sel. No.17, Ubud, Kecamatan Ubud, Kabupaten Gianyar, Bali 80571",,"F7R7+CP Ubud, Gianyar, Bali",4.4,444,"https://www.google.com/maps/place/Warung+Siam+Ubud/@-8.5089512,115.1942911,12z/data=!4m9!1m3!2m2!1srestaurants+in+Gianyar+Regency,+Bali!6e5!3m4!1s0x2dd23d6b95919c31:0xf1712d93ff9efb82!8m2!3d-8.5089512!4d115.2643289?hl=id"
2520,SizzleWraps,"Jl. By Pass Tanah Lot, Munggu, Kec. Mengwi, Kabupaten Badung, Bali 80351",sizzlewraps.business.site,"94GC+V7 Munggu, Badung Regency, Bali",4.7,445,"https://www.google.com/maps/place/SizzleWraps/@-8.657239,115.0125274,11z/data=!4m9!1m3!2m2!1srestaurants+in+Bangli+Regency,+Bali!6e5!3m4!1s0x2dd23849a72c7c79:0x79006ceb25a5222!8m2!3d-8.6227968!4d115.120659?hl=id"
2523,Pelangi Bali Restaurant,"Jl. Dewi Sri No.7X, Kuta, Kabupaten Badung, Bali 80361",,"75VG+XX Kuta, Badung Regency, Bali",4.3,446,"https://www.google.com/maps/place/Pelangi+Bali+Restaurant/@-8.657239,115.0125274,11z/data=!4m9!1m3!2m2!1srestaurants+in+Badung+Regency,+Bali!6e5!3m4!1s0x2dd246c557ef0fa3:0x38f6834ce3585a12!8m2!3d-8.7051163!4d115.1774037?hl=id"
2525,Laota Hongkong Cafe,"No.106 A, Jl. Raya Kuta, Kuta, Badung Regency, Bali 80361",,"75HH+59 Kuta, Badung Regency, Bali",4.4,448,"https://www.google.com/maps/place/Laota+Hongkong+Cafe/@-8.657239,115.0125274,11z/data=!4m9!1m3!2m2!1srestaurants+in+Badung+Regency,+Bali!6e5!3m4!1s0x2dd246b0698f23e1:0x94c9b430449c9d09!8m2!3d-8.7220702!4d115.1784563?hl=id"
2526,Little Hongkong Restaurant,"Jl. Raya Kuta No.21/9, Kuta, Kabupaten Badung, Bali 80361",,"75RJ+MH Kuta, Badung Regency, Bali",4.4,452,"https://www.google.com/maps/place/Little+Hongkong+Restaurant/@-8.7082977,115.1464386,13z/data=!4m9!1m3!2m2!1srestaurants+in+Denpasar+Regency,+Bali!6e5!3m4!1s0x2dd24402b2f7384b:0x40c4ed46f8c92b88!8m2!3d-8.7082977!4d115.1814575?hl=id"
2528,Warung Putu,"Lembongan island, Jungutbatu, Nusapenida, Kabupaten Klungkung, Bali 80771",m.facebook.com,"8C5X+XJ Jungutbatu, Klungkung Regency, Bali",4.5,452,"https://www.google.com/maps/place/Warung+Putu/@-8.6361621,115.4416862,12z/data=!4m8!1m2!2m1!1srestaurants+in+Klungkung+Regency,+Bali!3m4!1s0x2dd26dbf903aba2f:0xf9cb93c68b16ad42!8m2!3d-8.6900089!4d115.4490482?hl=id"
2529,Tampaksiring Journey,"Jl. Melati, Manukaya, Tampaksiring, Kabupaten Gianyar, Bali 80552",,"J839+M2 Manukaya, Gianyar, Bali",4.3,452,"https://www.google.com/maps/place/Tampaksiring+Journey/@-8.7058183,114.9742483,10z/data=!4m9!1m3!2m2!1sobjek+wisata+di+bali!6e1!3m4!1s0x2dd21f1ecfb6bbd9:0xbb3e4eaa8b2dc0f2!8m2!3d-8.395787!4d115.317574?hl=id"
2530,Kayu Putih Beach,"Gang Bintang Laut, Denpasar Selatan, Tibubeneng, Kec. Kuta Utara, Kabupaten Badung, Bali 80223",,"84HV+M4 Tibubeneng, Badung Regency, Bali",4.3,454,"https://www.google.com/maps/place/Kayu+Putih+Beach/@-8.6707513,114.8626388,10z/data=!4m9!1m3!2m2!1sobjek+wisata+di+bali!6e1!3m4!1s0x2dd24775e701a31b:0xc6b32c03843cee15!8m2!3d-8.6707513!4d115.1427902?hl=id"
2531,beekini bowl,"Jl. Bukit Permai No.5a, Jimbaran, Kec. Kuta Sel., Kabupaten Badung, Bali 80361",,"6597+GH Jimbaran, Badung Regency, Bali",4.5,458,"https://www.google.com/maps/place/beekini+bowl/@-8.657239,115.0125274,11z/data=!4m9!1m3!2m2!1srestaurants+in+Badung+Regency,+Bali!6e5!3m4!1s0x2dd244f335fb6df9:0xe38e2a1e4846bb!8m2!3d-8.7811896!4d115.1639333?hl=id"
