,Name,Full_Address,Website,Plus_Code,Rating,Reviews,URL
2206,Avatar Bali Restaurant,"Jimbaran, South Kuta, Badung Regency, Bali",,"65V9+F3 Jimbaran, Badung Regency, Bali",4.1,301,"https://www.google.com/maps/place/Avatar+Bali+Restaurant/@-8.657239,115.0125274,11z/data=!4m9!1m3!2m2!1srestaurants+in+Badung+Regency,+Bali!6e5!3m4!1s0x2dd2446ae43404b3:0xdc71b1242a81e7ba!8m2!3d-8.756273!4d115.167631?hl=id"
2209,Bebek Tepi Sawah,"Jalan Kartika Plaza,, Bintang Bali Hotel Arcade, Kuta, Kabupaten Badung, Bali 80361",bebektepisawahrestaurant.com,"7588+GR Kuta, Badung Regency, Bali",4.2,301,"https://www.google.com/maps/place/Bebek+Tepi+Sawah/@-8.6570861,115.010465,11z/data=!4m9!1m3!2m2!1srestaurants+in+Tabanan+Regency,+Bali!6e5!3m4!1s0x2dd246a04d977acd:0x5127d4bd4e5f74ae!8m2!3d-8.7336911!4d115.1670074?hl=id"
2210,Matcha Cafe Bali,"Jl. Pantai Berawa No.99, Tibubeneng, Kec. Kuta Utara, Kabupaten Badung, Bali 80361",matchacafebali.com,"84QQ+RR Tibubeneng, Badung Regency, Bali",4.5,302,"https://www.google.com/maps/place/Matcha+Cafe+Bali/@-8.657239,115.0125274,11z/data=!4m9!1m3!2m2!1srestaurants+in+Badung+Regency,+Bali!6e5!3m4!1s0x2dd24782274743ff:0x7cb9088236314042!8m2!3d-8.660415!4d115.139563?hl=id"
2211,Segara Seafood & Indonesian Restaurant,"Discovery Shopping Mall Kuta, Kuta, Badung Regency, Bali 80361",segarafreshseafood.com,"75C8+RP Kuta, Badung Regency, Bali",4.2,302,"https://www.google.com/maps/place/Segara+Seafood+%26+Indonesian+Restaurant/@-8.657239,115.0125274,11z/data=!4m9!1m3!2m2!1srestaurants+in+Badung+Regency,+Bali!6e5!3m4!1s0x2dd246a25b91a5f9:0x31dc370cfee8fa3f!8m2!3d-8.727984!4d115.1667788?hl=id"
2212,Burgerz,"Pantai Batu Bolong St No.88A, Canggu, North Kuta, Badung Regency, Bali 80351",burgerzbali.business.site,"84VJ+XQ Canggu, Badung Regency, Bali",4.3,302,"https://www.google.com/maps/place/Burgerz/@-8.657239,115.0125274,11z/data=!4m9!1m3!2m2!1srestaurants+in+Bangli+Regency,+Bali!6e5!3m4!1s0x2dd238786580f81f:0xedffc2c0d89b67e8!8m2!3d-8.6550522!4d115.1319108?hl=id"
2213,COMO Beach Club Bali,"Jl. Pantai Pererenan Jl. Pantai Batu Mejan, Canggu, Kec. Kuta Utara, Kabupaten Badung, Bali 80361",comohotels.com,"84VG+MG Canggu, Badung Regency, Bali",4.5,302,"https://www.google.com/maps/place/COMO+Beach+Club+Bali/@-8.657239,115.0125274,11z/data=!4m9!1m3!2m2!1srestaurants+in+Bangli+Regency,+Bali!6e5!3m4!1s0x2dd23876320ea001:0x8c6c4da8dab829da!8m2!3d-8.6558671!4d115.1263006?hl=id"
2215,Spice Beach Club Restaurant,"Pantai Lovina, Jl. Seririt- Singaraja No.225, Kaliasem, Kec. Banjar, Kabupaten Buleleng, Bali 81152",spicebeachclubbali.com,"R2PC+8C Kaliasem, Buleleng Regency, Bali",4.3,302,"https://www.google.com/maps/place/Spice+Beach+Club+Restaurant/@-8.164143,114.4607243,9z/data=!4m9!1m3!2m2!1srestaurants+in+Buleleng+Regency,+Bali!6e5!3m4!1s0x2dd19b47348048d9:0x48bb350be3d94c2!8m2!3d-8.164143!4d115.021027?hl=id"
2218,"Warung THOR Wood Fired Pizza, Pasta, Teppanyaki, Gelato & Coffee","Jl. Raya Mas No.88x, MAS, Kecamatan Ubud, Kabupaten Gianyar, Bali 80571",warungthor.com,"F72F+42 MAS, Gianyar, Bali",4.1,302,"https://www.google.com/maps/place/Warung+THOR+Wood+Fired+Pizza,+Pasta,+Teppanyaki,+Gelato+%26+Coffee/@-8.5497039,115.2025265,12z/data=!4m9!1m3!2m2!1srestaurants+in+Gianyar+Regency,+Bali!6e5!3m4!1s0x2dd23df1e5231513:0x40b223015cf69616!8m2!3d-8.5497039!4d115.2725643?hl=id"
2221,Bali Outbound & Farmstay (BOF),"Banjar Baturiti Kaja, Baturiti, Tabanan Regency, Bali 82161",,"M5HG+8Q Angseri, Tabanan Regency, Bali",4.3,302,"https://www.google.com/maps/place/Bali+Outbound+%26+Farmstay+(BOF)/@-8.5066963,115.0803123,10z/data=!4m9!1m3!2m2!1sobjek+wisata+di+bali!6e1!3m4!1s0x2dd189e529e9a669:0xb6922e0d64545cba!8m2!3d-8.3217425!4d115.1769859?hl=id"
2222,Bali Bule BBQ,"Pemecutan Klod, West Denpasar, Denpasar City, Bali 80361",,"852J+48 Pemecutan Klod, Denpasar City, Bali",4.5,303,"https://www.google.com/maps/place/Bali+Bule+BBQ/@-8.6996991,115.1458124,13z/data=!4m9!1m3!2m2!1srestaurants+in+Denpasar+Regency,+Bali!6e5!3m4!1s0x2dd246d173161383:0xa5a58a9f6fc54e6d!8m2!3d-8.6996991!4d115.1808313?hl=id"
2223,Union Restaurant Ubud,"Jl. Gootama No.1, Ubud, Kecamatan Ubud, Kabupaten Gianyar, Bali 80571",,"F7R7+VR Ubud, Gianyar, Bali",4.4,303,"https://www.google.com/maps/place/Union+Restaurant+Ubud/@-8.5078448,115.1944626,12z/data=!4m9!1m3!2m2!1srestaurants+in+Gianyar+Regency,+Bali!6e5!3m4!1s0x2dd23d0519d0a767:0xbc06be02a109918!8m2!3d-8.5078448!4d115.2645004?hl=id"
2224,MOTHER,"Jl. Nyuh Bulan, Nyuh Kuning MAS, Ubud, MAS, Ubud, MAS, Ubud, Gianyar, Bali 80571",whatabutmymother.business.site,"F7G4+6F MAS, Gianyar, Bali",4.6,304,"https://www.google.com/maps/place/MOTHER/@-8.5244278,115.1861733,12z/data=!4m9!1m3!2m2!1srestaurants+in+Bangli+Regency,+Bali!6e5!3m4!1s0x2dd23d0a44aff56d:0xc8f2e7568902c4ad!8m2!3d-8.5244278!4d115.2562111?hl=id"
2227,Shrimpis Restaurant,"Kerobokan Kelod, North Kuta, Badung Regency, Bali",shrimpis.com,"8593+46 Kerobokan Kelod, Badung Regency, Bali",4.4,305,"https://www.google.com/maps/place/Shrimpis+Restaurant/@-8.657239,115.0125274,11z/data=!4m9!1m3!2m2!1srestaurants+in+Badung+Regency,+Bali!6e5!3m4!1s0x2dd247def13ad1eb:0xfccc8328ceabc68b!8m2!3d-8.6822008!4d115.1531171?hl=id"
2228,KFC KARANGASEM,"Subagan, Karangasem, Karangasem Regency, Bali 80811",,"GJX3+CV Subagan, Karangasem Regency, Bali",4.3,305,"https://www.google.com/maps/place/KFC+KARANGASEM/@-8.6568036,114.5904003,9z/data=!4m9!1m3!2m2!1srestaurants+in+Karangasem+Regency,+Bali!6e5!3m4!1s0x2dd20776de82937f:0x1f46205a2aa153e9!8m2!3d-8.4514453!4d115.6047045?hl=id"
2230,Joshua District,"Jl. Kebo Iwa, Pangkung Tibah, Kec. Kediri, Kabupaten Tabanan, Bali 82121",joshuadistrict.com,"C33P+83 Pangkung Tibah, Tabanan Regency, Bali",4.6,305,"https://www.google.com/maps/place/Joshua+District/@-8.6570861,115.010465,11z/data=!4m8!1m2!2m1!1srestaurants+in+Tabanan+Regency,+Bali!3m4!1s0x2dd2375d09d65e25:0x606243d5b2495f6d!8m2!3d-8.5966954!4d115.0851388?hl=id"
2231,Chapter 2 Restaurant & Bar,"Jl. Werkudara, Legian, Kuta, Kabupaten Badung, Bali 80361",,"8528+6V Legian, Badung Regency, Bali",4.4,306,"https://www.google.com/maps/place/Chapter+2+Restaurant+%26+Bar/@-8.657239,115.0125274,11z/data=!4m9!1m3!2m2!1srestaurants+in+Badung+Regency,+Bali!6e5!3m4!1s0x2dd246dddb119541:0x32e2d743ad9fd55b!8m2!3d-8.6994714!4d115.1671749?hl=id"
2232,Piccola Italia Bali,"Jl. Poppies II Gg. Bedugul No.21, Kuta, Kabupaten Badung, Bali 80361",,"75JF+6G Kuta, Badung Regency, Bali",4.6,306,"https://www.google.com/maps/place/Piccola+Italia+Bali/@-8.657239,115.0125274,11z/data=!4m9!1m3!2m2!1srestaurants+in+Badung+Regency,+Bali!6e5!3m4!1s0x2dd246bbce26306d:0x74aa5363a7f85a6!8m2!3d-8.719479!4d115.1737527?hl=id"
2235,Warung Heboh,"JL Raya Semat, Tibubeneng, Canggu, Kuta Utara, Tibubeneng, Kec. Kuta Utara, Kabupaten Badung, Bali 80361",warungheboh.business.site,"84WR+2P Tibubeneng, Badung Regency, Bali",4.2,307,"https://www.google.com/maps/place/Warung+Heboh/@-8.657239,115.0125274,11z/data=!4m9!1m3!2m2!1srestaurants+in+Bangli+Regency,+Bali!6e5!3m4!1s0x2dd2388001759ec7:0x9fa3acd0a273a4e1!8m2!3d-8.6548885!4d115.1418048?hl=id"
2236,Padmasari Resort Hotel,"Lovina Beach, Singaraja, Jl. Seririt- Singaraja, Temukus, Kec. Banjar, Kabupaten Buleleng, Bali 81151",padmasariresort.com,"R2M5+8J Temukus, Buleleng Regency, Bali",4.3,307,"https://www.google.com/maps/place/Padmasari+Resort+Hotel/@-8.166716,114.8689493,11z/data=!4m12!1m3!2m2!1srestaurants+in+Buleleng+Regency,+Bali!6e5!3m7!1s0x2dd19b5b1a74342f:0x623858c24e91555d!5m2!4m1!1i2!8m2!3d-8.166716!4d115.009025?hl=id"
2239,Rapuan Cili,"Jl. Raya Mas No.50, MAS, Kecamatan Ubud, Kabupaten Gianyar, Bali 80571",,"C7VF+6V MAS, Gianyar, Bali",3.9,307,"https://www.google.com/maps/place/Rapuan+Cili/@-8.5568779,115.2045924,12z/data=!4m9!1m3!2m2!1srestaurants+in+Gianyar+Regency,+Bali!6e5!3m4!1s0x2dd23dfaf85f8b67:0xb07ac9994b2edd2e!8m2!3d-8.5568779!4d115.2746302?hl=id"
2240,Mangsi Tropical,"Jl. Raya Puputan No.178, Sumerta Kelod, Kec. Denpasar Tim., Kota Denpasar, Bali 80239",mangsi.co.id,"86GQ+HP Sumerta Kelod, Denpasar City, Bali",4.3,310,"https://www.google.com/maps/place/Mangsi+Tropical/@-8.6736106,115.0992162,11z/data=!4m9!1m3!2m2!1srestaurants+in+Badung+Regency,+Bali!6e5!3m4!1s0x2dd24117cdbfcaad:0x9270bfdfceb30f9!8m2!3d-8.6736106!4d115.2392919?hl=id"
2242,Spaccanapoli di Ubud,"Jl. Raya Pengosekan Ubud No.108, Ubud, Kecamatan Ubud, Kabupaten Gianyar, Bali 80571",spaccanapoliubud.com,"F7G7+W4 Ubud, Gianyar, Bali",4.1,310,"https://www.google.com/maps/place/Spaccanapoli+di+Ubud/@-8.5226723,115.1927384,12z/data=!4m9!1m3!2m2!1srestaurants+in+Gianyar+Regency,+Bali!6e5!3m4!1s0x2dd23d74f8b1d919:0x2f4ce82116ed5850!8m2!3d-8.5226723!4d115.2627762?hl=id"
2243,Dim Sum House,"Jl. Pantai Berawa No. 6 Plambingan, Tibubeneng, Kec. Kuta Utara, Kabupaten Badung, Bali 80361",,"84WX+M9 Tibubeneng, Badung Regency, Bali",4.2,311,"https://www.google.com/maps/place/Dim+Sum+House/@-8.657239,115.0125274,11z/data=!4m9!1m3!2m2!1srestaurants+in+Badung+Regency,+Bali!6e5!3m4!1s0x2dd238821057fe83:0xc09235ba0daff176!8m2!3d-8.653289!4d115.1484256?hl=id"
2244,Balibola,"Jl. Petitenget No.8, Seminyak, Kec. Kuta Utara, Kabupaten Badung, Bali 80361",balibo.la,"85G5+PC Seminyak, Badung Regency, Bali",4.6,311,"https://www.google.com/maps/place/Balibola/@-8.657239,115.0125274,11z/data=!4m9!1m3!2m2!1srestaurants+in+Badung+Regency,+Bali!6e5!3m4!1s0x2dd2472a662466f9:0xccfda73bfb9b27e7!8m2!3d-8.6732412!4d115.1585077?hl=id"
2247,Mickey Sports Bar & Grill,"Lembongan island, Jungutbatu, Nusapenida, Klungkung Regency, Bali, Indonesia, Jungutbatu, Nusapenida, Kabupaten Klungkung, Bali 80771",,"8CHX+JX Jungutbatu, Klungkung Regency, Bali",3.9,311,"https://www.google.com/maps/place/Mickey+Sports+Bar+%26+Grill/@-8.6567527,114.5897129,9z/data=!4m9!1m3!2m2!1srestaurants+in+Klungkung+Regency,+Bali!6e5!3m4!1s0x2dd26d74d25a6d0f:0x49726aa1670e932!8m2!3d-8.670896!4d115.449877?hl=id"
2248,Nusantara By Locavore,"Tengah, Jl. Dewisita No.09C, Ubud, Kecamatan Ubud, Kabupaten Gianyar, Bali 80571",locavore.co.id,"F7R7+32 Ubud, Gianyar, Bali",4.4,312,"https://www.google.com/maps/place/Nusantara+By+Locavore/@-8.5097998,115.1224464,11z/data=!4m9!1m3!2m2!1srestaurants+in+Buleleng+Regency,+Bali!6e5!3m4!1s0x2dd23d6b7a8a067d:0x10a56d2f6614eead!8m2!3d-8.5097998!4d115.2625221?hl=id"
2250,Vegan Bali,"Bedugul Lane No.5, Kuta, Badung Regency, Bali 80361",m.facebook.com,"75HF+JQ Kuta, Badung Regency, Bali",4.4,312,"https://www.google.com/maps/place/Vegan+Bali/@-8.7208857,115.139464,13z/data=!4m9!1m3!2m2!1srestaurants+in+Gianyar+Regency,+Bali!6e5!3m4!1s0x2dd246bbd83d312f:0xe37b90ce0090f7f8!8m2!3d-8.7208857!4d115.1744829?hl=id"
2253,Wayans Warung,"Jl. Suweta No.75, Ubud, Kecamatan Ubud, Kabupaten Gianyar, Bali 80571",wayans-warung.business.site,"G738+54 Ubud, Gianyar, Bali",4.8,312,"https://www.google.com/maps/place/Wayan%E2%80%99s+Warung/@-8.4970451,115.1952767,12z/data=!4m9!1m3!2m2!1srestaurants+in+Gianyar+Regency,+Bali!6e5!3m4!1s0x2dd23d467a90de79:0x1397f01a7b90983a!8m2!3d-8.4970451!4d115.2653145?hl=id"
2256,Terrace River Pool Swing,"Jalan Raya Tegallalang(Around Tegallalang Post Office) in ALAS HARUM LUWAK COFFEE, Tegallalang, Gianyar, Bali 80561",,"H75J+R6 Tegallalang, Gianyar, Bali",4.5,312,"https://www.google.com/maps/place/Terrace+River+Pool+Swing/@-8.5066963,115.0803123,10z/data=!4m9!1m3!2m2!1sobjek+wisata+di+bali!6e1!3m4!1s0x2dd2227f20391a83:0x9fc75242a6f92fa7!8m2!3d-8.440379!4d115.28053?hl=id"
2257,Budesa Restaurant,"Jl. By Pass Ngurah Rai No.888X, Kuta, Kabupaten Badung, Bali 80221",,"75FJ+54 Kuta, Badung Regency, Bali",4.2,314,"https://www.google.com/maps/place/Budesa+Restaurant/@-8.657239,115.0125274,11z/data=!4m9!1m3!2m2!1srestaurants+in+Badung+Regency,+Bali!6e5!3m4!1s0x2dd246aee0d45a77:0x7b498883901354f9!8m2!3d-8.7270842!4d115.1803489?hl=id"
2260,Air Terjun Kuning,"Taman Bali, Bangli Sub-District, Bangli Regency, Bali 80752",,"G954+GX Taman Bali, Bangli Regency, Bali",4.5,314,"https://www.google.com/maps/place/Air+Terjun+Kuning/@-8.5066963,115.0803123,10z/data=!4m9!1m3!2m2!1sobjek+wisata+di+bali!6e1!3m4!1s0x2dd217439e7151a7:0xe2f5f07a5ca7b19d!8m2!3d-8.491141!4d115.3574832?hl=id"
2261,Benih Cafe,"Pertokoan Mekar Jaya, Jl. Benesari No.77, Kuta, Badung Regency, Bali 80361",benih.co,"75PC+7V Kuta, Badung Regency, Bali",4.6,316,"https://www.google.com/maps/place/Benih+Cafe/@-8.657239,115.0125274,11z/data=!4m8!1m2!2m1!1srestaurants+in+Badung+Regency,+Bali!3m4!1s0x2dd24725d34276cd:0xcfbd09a718a9eded!8m2!3d-8.7143077!4d115.172148?hl=id"
2262,Buda Bakery & Resto,"Perumahan BTN Graha Lovina, Jl. I Gede Taman No.26, Kalibukbuk, Kec. Buleleng, Kabupaten Buleleng, Bali 81152",facebook.com,"R2PM+68 Buleleng, Buleleng Regency, Bali",4.7,317,"https://www.google.com/maps/place/Buda+Bakery+%26+Resto/@-8.1644213,114.4730465,9z/data=!4m8!1m2!2m1!1srestaurants+in+Buleleng+Regency,+Bali!3m4!1s0x2dd19b3b47195769:0x2ad060fe4c545731!8m2!3d-8.1644213!4d115.0333492?hl=id"
2263,Terrazza Steak House Bali,"Jl. Gatot Subroto Barat No.334, Padangsambian Kaja, Kec. Denpasar Bar., Kota Denpasar, Bali 80117",online.fliphtml5.com,"957M+9F Padangsambian Kaja, Denpasar City, Bali",4.5,317,"https://www.google.com/maps/place/Terrazza+Steak+House+Bali/@-8.6365613,115.1487283,13z/data=!4m9!1m3!2m2!1srestaurants+in+Denpasar+Regency,+Bali!6e5!3m4!1s0x2dd238b40f034c03:0x5f1e4d38c8c70378!8m2!3d-8.6365613!4d115.1837472?hl=id"
2264,Sasa Ristorante Italiano,"Jl.Arjuna No.10 X (Double 66 rd, Jl. Raya Seminyak, Seminyak, Kuta, Badung Regency, Bali 80361",sasabali.com,"8538+5V Seminyak, Badung Regency, Bali",4.3,317,"https://www.google.com/maps/place/Sasa%E2%80%99+Ristorante+Italiano/@-8.6970669,115.1321191,13z/data=!4m9!1m3!2m2!1srestaurants+in+Denpasar+Regency,+Bali!6e5!3m4!1s0x5044258096a4fed:0x4b53966dec1a1329!8m2!3d-8.6970669!4d115.167138?hl=id"
2265,Breeze Restaurant,"22, Jl. Kayu Aya, Seminyak, Kuta, Badung Regency, Bali 80361",,"8582+MR Seminyak, Badung Regency, Bali",4.5,318,"https://www.google.com/maps/place/Breeze+Restaurant/@-8.657239,115.0125274,11z/data=!4m9!1m3!2m2!1srestaurants+in+Badung+Regency,+Bali!6e5!3m4!1s0x2dd2470fc1144531:0xadb659f89a3fe766!8m2!3d-8.6833319!4d115.1521237?hl=id"
2266,Pelangi Restaurant,"Jl. Gatot Subroto Tim. No.254, Tonja, Kec. Denpasar Tim., Kota Denpasar, Bali 80234",,"967G+W2 Tonja, Denpasar City, Bali",4.1,318,"https://www.google.com/maps/place/Pelangi+Restaurant/@-8.6352402,115.0849736,11z/data=!4m9!1m3!2m2!1srestaurants+in+Bangli+Regency,+Bali!6e5!3m4!1s0x2dd23f71e7726a25:0x56cd87d516867abc!8m2!3d-8.6352402!4d115.2250493?hl=id"
2270,Sitara Indian Restaurant,"Jl. Hanoman No.99X, Ubud, Kecamatan Ubud, Kabupaten Gianyar, Bali 80571",sitaraindianrestaurants.com,"F7M7+4G Ubud, Gianyar, Bali",3.7,319,"https://www.google.com/maps/place/Sitara+Indian+Restaurant/@-8.5171511,114.703493,9z/data=!4m9!1m3!2m2!1srestaurants+in+Bangli+Regency,+Bali!6e5!3m4!1s0x2dd23d6c38aabcb1:0x31c3c0e5549ab7a1!8m2!3d-8.5171511!4d115.2637957?hl=id"
2273,Warung Babi Guling Putra Celagi,"Jl. Desa Apuan No.87, Apuan, Susut, Kabupaten Bangli, Bali 80661",,"G84H+5J Apuan, Bangli Regency, Bali",4.6,319,"https://www.google.com/maps/place/Warung+Babi+Guling+Putra+Celagi/@-8.657188,115.0118399,11z/data=!4m9!1m3!2m2!1srestaurants+in+Karangasem+Regency,+Bali!6e5!3m4!1s0x2dd2179dc7a3a8cf:0x61893f2bcf6151d0!8m2!3d-8.4945137!4d115.3290985?hl=id"
2275,Tubes Bar & Restaurant,"JL. Poppies 2, Kuta, Kabupaten Badung, Bali 80361",,"75JF+W9 Kuta, Badung Regency, Bali",4.4,322,"https://www.google.com/maps/place/Tubes+Bar+%26+Restaurant/@-8.657239,115.0125274,11z/data=!4m9!1m3!2m2!1srestaurants+in+Badung+Regency,+Bali!6e5!3m4!1s0x2dd246b90c684b27:0xa960c9f41050f8e8!8m2!3d-8.7177229!4d115.1734067?hl=id"
2276,La Costa Beach Lounge,"Temukus, Banjar, Buleleng Regency, Bali 81152",,"RX9P+6P Temukus, Buleleng Regency, Bali",4.4,322,"https://www.google.com/maps/place/La+Costa+Beach+Lounge/@-8.1819529,114.4264859,9z/data=!4m9!1m3!2m2!1srestaurants+in+Buleleng+Regency,+Bali!6e5!3m4!1s0x2dd19cb2ae6f7b71:0x40c1af3c5a8d8258!8m2!3d-8.1819529!4d114.9867886?hl=id"
2278,The PaD Bar On Bene,"Jl. Lb. Bene No.168, Legian, Kuta, Kabupaten Badung, Bali 80361",,"75QC+HC Legian, Badung Regency, Bali",4.6,324,"https://www.google.com/maps/place/The+PaD+Bar+On+Bene/@-8.657239,115.0125274,11z/data=!4m9!1m3!2m2!1srestaurants+in+Badung+Regency,+Bali!6e5!3m4!1s0x2dd246c6d351915f:0xc4af79a3b1bade10!8m2!3d-8.7110508!4d115.1711031?hl=id"
2279,Roti Canai Street Kitchen,"Jalan Raya Batu Bolong, Canggu, Kuta Utara, Canggu, Kec. Kuta Utara, Kabupaten Badung, Bali 80351",business.site,"84XM+6G Canggu, Badung Regency, Bali",4.1,324,"https://www.google.com/maps/place/Roti+Canai+Street+Kitchen/@-8.657239,115.0125274,11z/data=!4m9!1m3!2m2!1srestaurants+in+Bangli+Regency,+Bali!6e5!3m4!1s0x2dd238796c85e833:0xdd140ac6d17f7285!8m2!3d-8.6518997!4d115.1337858?hl=id"
2280,Warung Danau Batur Mujair Nyatnyat Tabanan,"Jl. Yos. Sudarso No.12B, Dajan Peken, Kec. Tabanan, Kabupaten Tabanan, Bali 82114",wdb-tabanan.business.site,"F47M+PF Dajan Peken, Tabanan Regency, Bali",4.5,324,"https://www.google.com/maps/place/Warung+Danau+Batur+Mujair+Nyatnyat+Tabanan/@-8.6570861,115.010465,11z/data=!4m9!1m3!2m2!1srestaurants+in+Tabanan+Regency,+Bali!6e5!3m4!1s0x2dd23a566b067ec9:0x8f783ef2b6b9e410!8m2!3d-8.535635!4d115.1336288?hl=id"
2281,Mai Mai Restaurant,"Kawasan BTDC Area Bali Collection, Nusa Dua, Benoa, Kec. Kuta Sel., Kabupaten Badung, Bali 80363",,"56XM+94 Benoa, Badung Regency, Bali",4.2,326,"https://www.google.com/maps/place/Mai+Mai+Restaurant/@-8.6570861,115.010465,11z/data=!4m9!1m3!2m2!1srestaurants+in+Tabanan+Regency,+Bali!6e5!3m4!1s0x2dd243288ef11dc7:0x341e2fc0f31dd780!8m2!3d-8.80151!4d115.232852?hl=id"
2282,Pura Batu Kursi,"Jalan Raya Pemuteran, Pemuteran, Gerokgak, Kabupaten Buleleng, Bali 81155",,"RMR7+P2 Pemuteran, Buleleng Regency, Bali",4.7,326,"https://www.google.com/maps/place/Pura+Batu+Kursi/@-8.5066963,115.0803123,10z/data=!4m9!1m3!2m2!1sobjek+wisata+di+bali!6e1!3m4!1s0x2dd16efec1a40953:0x775bce7e6f5affc0!8m2!3d-8.1582127!4d114.6625892?hl=id"
2283,Sumberkima Hill Retreat,"Sumberkima, Gerokgak, Buleleng Regency, Bali 81155",sumberkimahill.com,"VJ25+2J Sumberkima, Buleleng Regency, Bali",4.6,327,"https://www.google.com/maps/place/Sumberkima+Hill+Retreat/@-8.1499209,114.4690029,11z/data=!4m12!1m3!2m2!1srestaurants+in+Buleleng+Regency,+Bali!6e5!3m7!1s0x2dd16930bc21579f:0x92f04b6d5d5398dc!5m2!4m1!1i2!8m2!3d-8.1499209!4d114.6090786?hl=id"
2285,Hank's Pizza & Liquor,"Maiden Love Lantai 2, Jalan Kayu Aya No. 27X, Oberoi, Kuta Utara, Seminyak, Kuta, Kabupaten Badung, Bali 80361",hankspizza.co,"8584+6M Seminyak, Badung Regency, Bali",4.4,328,"https://www.google.com/maps/place/Hank's+Pizza+%26+Liquor/@-8.657239,115.0125274,11z/data=!4m9!1m3!2m2!1srestaurants+in+Badung+Regency,+Bali!6e5!3m4!1s0x2dd247178c50ed13:0xdd61ed048684e85b!8m2!3d-8.6844817!4d115.1567401?hl=id"
2286,Warung D'BUCU,"Pemuteran, Gerokgak, Buleleng Regency, Bali 81155",warungdbucu.business.site,"VM42+5H Pemuteran, Buleleng Regency, Bali",4.8,330,"https://www.google.com/maps/place/Warung+D'BUCU/@-8.1445594,114.0911102,9z/data=!4m8!1m2!2m1!1srestaurants+in+Buleleng+Regency,+Bali!3m4!1s0x2dd16eecfb427847:0x722146b32ffe0c5!8m2!3d-8.1445594!4d114.6514129?hl=id"
2287,Hippie Fish Ubud,"Jl. Raya Ubud No.14, Ubud, Kecamatan Ubud, Kabupaten Gianyar, Bali 80571",hippiefishbali.com,"F7V7+2M Ubud, Gianyar, Bali",4.5,331,"https://www.google.com/maps/place/Hippie+Fish+Ubud/@-8.5074777,115.1941572,12z/data=!4m9!1m3!2m2!1srestaurants+in+Gianyar+Regency,+Bali!6e5!3m4!1s0x2dd23d0946a48ceb:0x4675830a8d84d5d8!8m2!3d-8.5074777!4d115.264195?hl=id"
2288,Warung Tulus Lobster,"Jl. Yeh Gangga I, Sudimara, Kec. Tabanan, Kabupaten Tabanan, Bali 82112",business.site,"C359+8P Sudimara, Tabanan Regency, Bali",4.3,332,"https://www.google.com/maps/place/Warung+Tulus+Lobster/@-8.6570861,115.010465,11z/data=!4m8!1m2!2m1!1srestaurants+in+Tabanan+Regency,+Bali!3m4!1s0x2dd237386150a1b1:0xc5e604d9fe5f7cc3!8m2!3d-8.5916384!4d115.0692762?hl=id"
2289,Maha,"Jalan Mongkey Forest, Ubud, Kecamatan Ubud, Kabupaten Gianyar, Bali 80571",facebook.com,"F7M5+CW Ubud, Gianyar, Bali",4.3,334,"https://www.google.com/maps/place/Maha/@-8.5164798,114.6994922,9z/data=!4m9!1m3!2m2!1srestaurants+in+Gianyar+Regency,+Bali!6e5!3m4!1s0x2dd23d6d161b696b:0xb3e794a2eb45b46f!8m2!3d-8.5164798!4d115.2597949?hl=id"
2290,Waroeng Italian Corner,"Jl. No 23B ||, Gg. Baik Baik II, Seminyak, Kuta, Badung Regency, Bali 80361",business.site,"854C+HH Seminyak, Badung Regency, Bali",4.6,335,"https://www.google.com/maps/place/Waroeng+Italian+Corner/@-8.657239,115.0125274,11z/data=!4m9!1m3!2m2!1srestaurants+in+Badung+Regency,+Bali!6e5!3m4!1s0x2dd2472755e80081:0x2570111331f2985c!8m2!3d-8.693511!4d115.171454?hl=id"
2291,Warung Gueek,"Jl. By Pass Tanah Lot, Buwit, Kec. Kediri, Kabupaten Tabanan, Bali 80351",,"94M8+HC Buwit, Tabanan Regency, Bali",3.9,335,"https://www.google.com/maps/place/Warung+Gueek/@-8.657239,115.0125274,11z/data=!4m9!1m3!2m2!1srestaurants+in+Bangli+Regency,+Bali!6e5!3m4!1s0x2dd239cac9442d2b:0xc44a18f519ae0779!8m2!3d-8.6160711!4d115.1160827?hl=id"
2292,Warung Krisna,"Jl. Sandat No.8, Ubud, Kecamatan Ubud, Kabupaten Gianyar, Bali 80571",,"F7R8+XH Ubud, Gianyar, Bali",4.7,335,"https://www.google.com/maps/place/Warung+Krisna/@-8.5075277,114.7061133,9z/data=!4m9!1m3!2m2!1srestaurants+in+Bangli+Regency,+Bali!6e5!3m4!1s0x2dd23d698211640f:0x6da9ae53f27ca8f0!8m2!3d-8.5075277!4d115.266416?hl=id"
2293,Warung Banyuwangi Echo,"Jl. Raya Denpasar - Gilimanuk No.KM 60, Pengeragoan, Kec. Pekutatan, Kabupaten Jembrana, Bali",business.site,"GVVX+6R Pengeragoan, Jembrana Regency, Bali",3.9,335,"https://www.google.com/maps/place/Warung+Banyuwangi+Echo/@-8.4569985,114.7595126,11z/data=!4m9!1m3!2m2!1srestaurants+in+Buleleng+Regency,+Bali!6e5!3m4!1s0x2dd3d5ba6dd69cc1:0xf6052328cfe38928!8m2!3d-8.4569985!4d114.8995883?hl=id"
2298,Warung Papa Pizza,"Jl. Pungutan No.1, Sanur, Kec. Denpasar Sel., Kota Denpasar, Bali 80228",,"8766+M7 Sanur, Denpasar City, Bali",4.6,336,"https://www.google.com/maps/place/Warung+Papa+Pizza/@-8.6703321,115.2031965,13z/data=!4m9!1m3!2m2!1srestaurants+in+Denpasar+Regency,+Bali!6e5!3m4!1s0x2dd240357b3e9957:0xd4f60d2a363cf8da!8m2!3d-8.6883061!4d115.2606754?hl=id"
2299,Kawasan Wisata Bali - The Keranjang,"Jl. By Pass Ngurah Rai No.97, Kuta, Kabupaten Badung, Bali 80361",thekeranjangbali.com,"759H+87 Kuta, Badung Regency, Bali",4.4,336,"https://www.google.com/maps/place/Kawasan+Wisata+Bali+-+The+Keranjang/@-8.5066963,115.0803123,10z/data=!4m9!1m3!2m2!1sobjek+wisata+di+bali!6e1!3m4!1s0x2dd245d21d180b8f:0xb2d823b6ac753289!8m2!3d-8.7317153!4d115.1781664?hl=id"
2300,Alleycats Restaurant,"Jl. Poppies II No.487, Kuta, Kabupaten Badung, Bali 80361",alleycatsbali.wordpress.com,"75JF+X5 Kuta, Badung Regency, Bali",4.4,337,"https://www.google.com/maps/place/Alleycats+Restaurant/@-8.7175302,115.1378759,13z/data=!4m9!1m3!2m2!1srestaurants+in+Gianyar+Regency,+Bali!6e5!3m4!1s0x2dd246b9161bf027:0x6b65db5a2991c094!8m2!3d-8.7175302!4d115.1728948?hl=id"
2301,Pizza Hut Delivery - PHD Indonesia,"Jl. Hayam Wuruk No.218, Sumerta Kelod, Kec. Denpasar Tim., Kota Denpasar, Bali 80239",phd.co.id,"86QQ+6W Sumerta Kelod, Denpasar City, Bali",4.5,338,"https://www.google.com/maps/place/Pizza+Hut+Delivery+-+PHD+Indonesia/@-8.6619424,114.6795123,9z/data=!4m9!1m3!2m2!1srestaurants+in+Gianyar+Regency,+Bali!6e5!3m4!1s0x2dd24063b6437183:0xbd2b30a6ab11255a!8m2!3d-8.6619424!4d115.239815?hl=id"
2302,Bro Resto,"Pantai Batu Bolong St No.34, Canggu, North Kuta, Badung Regency, Bali 80361",m.facebook.com,"942P+2Q North Kuta, Badung Regency, Bali",4.4,340,"https://www.google.com/maps/place/Bro+Resto/@-8.657239,115.0125274,11z/data=!4m9!1m3!2m2!1srestaurants+in+Bangli+Regency,+Bali!6e5!3m4!1s0x2dd2387c18602c89:0x4c4ba675e0a1e796!8m2!3d-8.6499807!4d115.1369551?hl=id"
2304,LOSIN Fillets N Fins,"Jl. Tukad Batanghari No.14, Panjer, Kec. Denpasar Sel., Kota Denpasar, Bali 80234",business.site,"86CJ+72 Panjer, Denpasar City, Bali",4.3,340,"https://www.google.com/maps/place/LOSIN+Fillets+N+Fins/@-8.6703321,115.2031965,13z/data=!4m9!1m3!2m2!1srestaurants+in+Denpasar+Regency,+Bali!6e5!3m4!1s0x2dd240f0aa355579:0xd5712b8b39b6c019!8m2!3d-8.6792712!4d115.2300018?hl=id"
2305,Starfish Bloo,"Kerobokan, Jl. Petitenget, Seminyak, Kec. Kuta Utara, Kabupaten Badung, Bali 80361",starfishbloorestaurant.com,"84FX+2C Seminyak, Badung Regency, Bali",4.5,341,"https://www.google.com/maps/place/Starfish+Bloo/@-8.657239,115.0125274,11z/data=!4m9!1m3!2m2!1srestaurants+in+Badung+Regency,+Bali!6e5!3m4!1s0x2dd246dfe0702f65:0x7dd21ff78d0b6410!8m2!3d-8.6774314!4d115.1485493?hl=id"
2307,Formosa Seafood Restaurant,"Jl. Setia Budi No.25, Kuta, Kabupaten Badung, Bali 80361",formosaseafoodrestaurant.com,"75HJ+VJ Kuta, Badung Regency, Bali",4.2,342,"https://www.google.com/maps/place/Formosa+Seafood+Restaurant/@-8.657239,115.0125274,11z/data=!4m9!1m3!2m2!1srestaurants+in+Badung+Regency,+Bali!6e5!3m4!1s0x2dd246b17405f467:0x7b02ba4c931300db!8m2!3d-8.7202991!4d115.1815747?hl=id"
2310,Warung Tepi Tebing,"Jl. Raya Singapadu, Singapadu Kaler, Kec. Sukawati, Kabupaten Gianyar, Bali 80571",,"C7M4+52 Singapadu Kaler, Gianyar, Bali",4.3,342,"https://www.google.com/maps/place/Warung+Tepi+Tebing/@-8.5670887,115.1850063,12z/data=!4m9!1m3!2m2!1srestaurants+in+Gianyar+Regency,+Bali!6e5!3m4!1s0x2dd23e75f6b510a9:0x98d1d9d86ea7f660!8m2!3d-8.5670887!4d115.2550441?hl=id"
2312,Balkan BBQ & Cocktail Bar,"Jl. Kunti I No.9, Seminyak, Kuta, Kabupaten Badung, Bali 80361",balkanbbq.business.site,"8569+JQ Seminyak, Badung Regency, Bali",4.8,343,"https://www.google.com/maps/place/Balkan+BBQ+%26+Cocktail+Bar/@-8.657239,115.0125274,11z/data=!4m9!1m3!2m2!1srestaurants+in+Badung+Regency,+Bali!6e5!3m4!1s0x2dd24723de8bde01:0x6b9d0fcc23883687!8m2!3d-8.688382!4d115.1694242?hl=id"
